Filename,Title,Description,Keywords,Category,Release(s)
233161_651c98f7-7440-4460-9fe4-6af7cbdc0a12.jpg,Pink Lotus Flower with Soft Light Blooming in Serene Nature Setting,Pink Lotus Flower with Soft Light Blooming in Serene Nature Setting,"lotus, lotus flower, sacred lotus, indian lotus, nelumbo nucifera, aquatic plant, water lily, flower, bloom, blossom, floral, flora, petal, pink, vibrant, fresh, growth, beautiful, beauty, elegant, delicate, stem, leaf, pond, water, nature, natural, environment, botany, botanical, plant, flora, zen, meditation, spiritual, symbol, symbolic, asian, oriental, background, backdrop, outdoor, macro, close-up, soft, light, summer, season, serene, well-being",14,2025-03-27
233163_53e3eb3d-85cf-457a-b79f-0589108f33e7.jpg,"Close-up of a Vibrant Seedling with Water Droplets, Showing New Life and Growth on Dark Soil","Close-up of a Vibrant Seedling with Water Droplets, Showing New Life and Growth on Dark Soil","seedling, young plant, new growth, sprout, sapling, plant, growth, growing, emerging, germination, beginning, new life, springtime, earth, soil, ground, dirt, close-up, macro, nature, natural, fresh, green, vibrant, alive, botany, botanical, leaf, foliage, veins, water droplets, dew drops, moisture, outdoors, daylight, sunlight, environment, environmental, eco, ecology, agricultural, horticulture, small, tiny, seed, cultivation, new beginning, hope, future, sustainability",5,2025-03-27
233166_b98e7124-4639-44c4-b711-61c2e01b4348.jpg,Elegant serpent basking on mossy terrain with detailed scales and vibrant greenery in a tranquil nature scene,Elegant serpent basking on mossy terrain with detailed scales and vibrant greenery in a tranquil nature scene,"snake, reptile, serpent, wildlife, nature, animal, scaled reptile, fauna, snakeskin, moss, greenery, foliage, vegetation, outdoors, forest, wild, scaled, vertebrate, scales, pattern, texture, environment, herpetology, exotic, tropical, close-up, macro, eye, head, predator, wild animal, grass, wild grass, leaf, leaves, botany, flora, detail, closeup, looking, lurking, sunlight, sun, sunlit, daylight, day, stalking, stalk, hunt",1,2025-03-27
233167_1d0284a4-2b0d-4f13-a553-3bfa356fa0a8.jpg,Dreamy Pink Daisy in Golden Sunlight: Close-Up Floral Bloom,Dreamy Pink Daisy in Golden Sunlight: Close-Up Floral Bloom,"pink flower, pink daisy, daisy, pink petals, flower, bloom, blossom, floral, blooming, blooms, blossoming, closeup, macro, nature, natural, garden, spring, summer, sun, sunlight, sunny, sunshine, bright, vibrant, yellow, orange, green, flora, petal, plant, beautiful, beauty, fresh, growth, outdoor, outdoors, field, meadow, botany, botanical, stem, yellow center, detail, soft, focus, background, wild, flora, wildflower",14,2025-03-27
233175_9bc3063f-882b-4f7b-9038-52b138fd5215.jpg,"Woman meditates atop mountain at sunrise, embracing nature and inner peace.","Woman meditates atop mountain at sunrise, embracing nature and inner peace.","meditation, mindfulness, wellness, well-being, nature, outdoors, woman, person, yoga, spiritual, zen, serenity, peaceful, peace, mountains, landscape, valley, river, relaxation, contemplation, self-care, escape, retreat, travel, adventure, solitude, quiet, calm, tranquility, harmony, balance, lifestyle, healthy, inspiration, scenery, view, destination, explore, freedom, journey, vacation, recreation, tourism, leisure, daylight, sunlight, hills, forest, trees, rocks",12,2025-03-27
233177_09f9e8c7-6428-4474-aa84-ec627c50f895.jpg,Photographer Exploring Historic European Town at Sunset. Walking through the Golden Hour.,Photographer Exploring Historic European Town at Sunset. Walking through the Golden Hour.,"travel, traveling, traveler, tourism, tourist, trip, vacation, journey, adventure, exploration, cityscape, urban, old town, buildings, architecture, cobblestone street, street view, european architecture, city, town, historic, alleyway, alley, golden hour, sunset, sunrise, sunlight, light, warm light, backpacker, backpack, camera, photographer, photography, man, male, person, walking, strolling, rear view, lifestyle, outdoors, daytime, flower pots, facade, exterior, destination, culture, wanderlust",21,2025-03-27
233179_35ab009a-4db9-410f-b6ea-1aa601d7858d.jpg,"Woman practices yoga tree pose on beach during a tranquil sunrise, promoting mindfulness and balance.","Woman practices yoga tree pose on beach during a tranquil sunrise, promoting mindfulness and balance.","woman, yoga, beach yoga, tree pose, vrksasana, balance, harmony, mindfulness, ocean, sea, waves, surf, coastline, seashore, shoreline, sand, golden sand, sandy, sunrise, sunset, dawn, dusk, morning, evening, light, golden light, sunlight, sky, cloudscape, tropical, island, seascape, meditation, wellness, well-being, health, healthy, fitness, sport, exercise, activity, outdoors, nature, peaceful, serene, calm, relaxation, travel, destination, tourism",18,2025-03-27
233180_63180cab-d836-4a56-baeb-d4dc52bf34b5.jpg,Close-up of a Glowing DNA Strand Structure for Medical Scientific Research,Close-up of a Glowing DNA Strand Structure for Medical Scientific Research,"DNA, double helix, genetic code, gene, genome, molecular biology, biotechnology, biochemistry, science, medical, research, scientific, biology, helix, strand, chromosome, molecule, structure, microscopic, cellular, cells, orange, glowing, futuristic, abstract, background, healthcare, medicine, diagnosis, treatment, pharmaceutical, genes, genetic, disease, virus, infection, microbiology, pathogen, illness, anatomy, physiology, illustration, graphic, 3d, rendering, digital, art, artwork, complex, spiral",16,2025-03-27
233181_4fa2cffa-e3a1-4416-b61e-4b992712b4cf.jpg,DNA Double Helix Structure: Scientific Research of Genetic Code in Molecular Biology with Abstract Glowing Sparkles,DNA Double Helix Structure: Scientific Research of Genetic Code in Molecular Biology with Abstract Glowing Sparkles,"dna, helix, genetic, code, molecular, biology, biotechnology, science, scientific, research, medicine, medical, healthcare, gene, genome, biochemistry, cells, chromosome, molecule, double helix, strand, mutation, life, body, orange, red, glow, glowing, sparkle, sparkling, bokeh, abstract, background, wallpaper, illustration, art, design, graphic, element, symbol, shape, structure, pattern, texture, macro, close-up, detail, futuristic, modern, technology",16,2025-03-27
233182_ce354ea8-03d2-4f6b-b4b2-57c0ef725019.jpg,Detailed DNA Structure: Scientific Visualization of Genetic Code and Molecular Biology (107 char),Detailed DNA Structure: Scientific Visualization of Genetic Code and Molecular Biology (107 char),"DNA, helix, genetic, genetics, molecule, molecular, science, scientific, biology, biological, biochemistry, biochemical, research, medical, medicine, health, healthcare, gene, genes, genome, genomic, biotechnology, biotech, laboratory, cell, cellular, strand, chromosome, chromosomes, code, coding, structure, structural, analysis, analyzing, discovery, data, datum, model, modeling, abstract, illustration, digital, render, rendering, background, backdrop, healthcare concept, scientific research, biomedical",16,2025-03-27
233184_35f62770-ba87-4071-8264-4f673ebe7b60.jpg,"Caring Nurse Giving Tea to Senior Woman in Sunny Room, Showing Compassion and Support in Home Care","Caring Nurse Giving Tea to Senior Woman in Sunny Room, Showing Compassion and Support in Home Care","nurse, caregiver, elderly care, healthcare, senior care, home care, assistance, support, medical professional, patient, senior woman, elderly woman, aged, old woman, older woman, woman, adult, cheerful, smiling, happy, friendly, compassionate, kind, comfort, well-being, cup, mug, drink, beverage, home, living room, chair, armchair, window, daylight, indoors, stethoscope, uniform, medical uniform, health, medicine, treatment, recovery, assistance, geriatric, nursing home, retirement, ageing, wellness, lifestyle",13,2025-03-27
233185_74a4cf96-c994-4481-8c05-f5217c7186b6.jpg,"Human Brain: Digital Visualization of Mind, Intelligence, and Neural Connections, Science and Technology.","Human Brain: Digital Visualization of Mind, Intelligence, and Neural Connections, Science and Technology.","human, mind, brain, head, consciousness, intelligence, neurology, intellect, thought, reason, psyche, cognition, cognitive, knowledge, understanding, awareness, wisdom, science, medicine, research, anatomy, physiology, neurons, neural, synapse, connection, network, system, cerebral, spinal, nervous, body, health, wellness, healthcare, medical, futuristic, technology, digital, artificial intelligence, ai, machine learning, innovation, cyber, virtual, abstract, concept, design, illustration, graphic",16,2025-03-27
233187_d0fcb5e3-91d8-439a-96a6-51a22d3c566e.jpg,Microscopic View of Skin Cells and Molecules on Dermis Surface with Glowing Effect,Microscopic View of Skin Cells and Molecules on Dermis Surface with Glowing Effect,"skin, human skin, skin cells, cellular, cells, dermatology, anatomy, biology, science, medical, medicine, pharmaceutical, body, health, healthcare, epidermis, tissue, membrane, surface, texture, structure, layer, dots, orange, light, bright, vibrant, glowing, illumination, close-up, macro, detail, abstract, background, illustration, rendering, digital art, 3d, microscopic, molecule, virus, bacteria, research, analysis, laboratory, experiment, treatment, cure, protection, immune system",16,2025-03-27
233188_a1ce5ccc-ed69-4c91-ac5a-f0302e5d740c.jpg,"Close-up of a DNA double helix, showcasing genetic code, molecular biology and the science of life.","Close-up of a DNA double helix, showcasing genetic code, molecular biology and the science of life.","DNA, double helix, genetic code, gene, chromosome, molecular biology, biotechnology, biochemistry, genetics, science, scientific, medical, medicine, research, healthcare, biology, biological, cellular, molecule, molecular, structure, helix, strand, spiral, nucleic acid, nucleotide, deoxyribonucleic acid, genetic, genome, body, anatomy, health, pharmaceutical, pharmacy, disease, illness, treatment, therapy, diagnosis, laboratory, microscopic, microscope, abstract, background, symbol, concept, futuristic, digital, illustration",16,2025-03-27
233190_054a7304-e99b-4c36-bdbf-225cb08682c6.jpg,Serum Bottle with Dropper on Minimalist Surface Bathed in Sunlight - Aesthetic Beauty and Skin Care,Serum Bottle with Dropper on Minimalist Surface Bathed in Sunlight - Aesthetic Beauty and Skin Care,"serum, face serum, skincare, skin care, beauty, skin, cosmetic, product, beauty product, cosmetic product, dropper, bottle, dropper bottle, glass bottle, treatment, wellness, essential, liquid, transparent, shadow, minimal, minimalism, modern, aesthetic, luxury, hyaluronic acid, collagen, anti-aging, moisturizer, hydration, nourishment, nourishing, healthcare, health, medicine, pharmaceutical, science, laboratory, tile, background, backdrop, clean, still life, indoor, daylight, sunlight, shiny, illuminated, closeup",12,2025-03-27
233193_db8493e4-8f32-4214-b7a9-8f5a02fe04b6.jpg,"Radiant Pink Lotus Flower with Sunlight, Close-Up Botanical Beauty, Peaceful Pond, and Green Leaf Backdrop ","Radiant Pink Lotus Flower with Sunlight, Close-Up Botanical Beauty, Peaceful Pond, and Green Leaf Backdrop ","lotus, lotus flower, water lily, aquatic plant, flower, floral, bloom, blossom, petal, pink, pink petals, leaves, leaf, green, green leaves, plant, flora, nature, natural, background, backdrop, botany, botanical, macro, close-up, beauty, beautiful, fresh, bright, vibrant, summer, spring, zen, meditation, peace, peaceful, tranquil, serene, asia, asian, eastern, symbol, sacred, spiritual, pond, water, flora, garden, decorative, element",14,2025-03-27
233194_e282322e-71d0-4e49-9820-dc6b35c1d110.jpg,"DNA helix inside a sphere in a forest, genetic research and medical innovation","DNA helix inside a sphere in a forest, genetic research and medical innovation","DNA, genetic code, genes, genome, helix, double helix, molecule, biology, biotechnology, scientific, science, research, medical, medicine, healthcare, innovation, discovery, development, environment, nature, forest, woods, green, leaf, foliage, outdoor, outdoors, landscape, scene, scenery, moss, water, reflection, puddle, sphere, glass, ball, globe, clear, transparent, glowing, light, bright, macro, close-up, artistic, conceptual, symbol, abstract, background",16,2025-03-27
233195_9d7ed6c3-ad6f-4c18-adf8-e9e4b752ce30.jpg,Little Girl and Teacher in Classroom Drawing Art Together ,Little Girl and Teacher in Classroom Drawing Art Together ,"teacher, caregiver, childcare, student, girl, preschool, classroom, kindergarten, learning, education, elementary, drawing, art, artwork, watercolor, sketch, paint, painting, colorful, creative, activity, school, lesson, knowledge, teach, tutor, studio, table, paper, crayon, marker, smile, happy, joyful, adorable, cute, young, small, female, people, indoor, day, daytime, study, friend, friendship, together, ethnicity, youth, child",13,2025-03-27
233197_5ba33288-d78e-4b38-abf8-f45776286f3b.jpg,"Abstract rendering of a DNA double helix for science and medicine, representing genetic research","Abstract rendering of a DNA double helix for science and medicine, representing genetic research","dna, genetic, genetics, gene, genes, molecule, molecular, helix, double helix, medical, medicine, science, scientific, research, biology, biological, biotechnology, biotech, health, healthcare, pharmaceutical, pharmacy, genome, genomic, chromosome, chromosomes, strand, cellular, cells, body, human, disease, illness, therapy, cure, genetic code, code, innovation, innovative, futuristic, future, abstract, rendering, data, analysis, complex, connection, structure, model, illustration",16,2025-03-27
233204_4586a632-0c48-4c00-8790-b2bb61f60305.jpg,Golden Serum Bottle with Dropper on Wooden Countertop in Home Interior with Natural Light,Golden Serum Bottle with Dropper on Wooden Countertop in Home Interior with Natural Light,"essential oil, serum, beauty oil, cosmetic oil, face oil, hair oil, dropper, bottle, glass bottle, dropper bottle, serum bottle, beauty product, cosmetic product, skin care, beauty, golden, illuminated, light, sunlight, wooden surface, table, countertop, interior, room, home, shelf, plants, indoor plants, window, wellness, aromatherapy, natural, organic, health, well-being, lifestyle, still life, product photography, studio shot, close-up, minimalist, clean, modern, simple, daylight, indoor, relaxation, calm, peaceful, therapeutic",12,2025-03-27
233205_6b84c8a0-40aa-4828-b2b1-7a4d42bc8172.jpg,"Microscopic View of a Cell with Glowing Core, Science and Medical Research Concept","Microscopic View of a Cell with Glowing Core, Science and Medical Research Concept","cell, cells, cellular, microscopic, molecule, biology, biological, science, scientific, research, medical, medicine, pharmaceutical, biotechnology, healthcare, virus, bacteria, pathogen, disease, infection, immune system, antibody, vaccine, diagnosis, treatment, microbiology, anatomy, physiology, biochemistry, genetics, DNA, RNA, genome, protein, laboratory, experiment, analysis, testing, technology, digital, illustration, abstract, futuristic, glowing, shiny, bright, dark, blue, orange",16,2025-03-27
233206_e03fd24d-8c44-4fbf-b3f2-def5bb03d2b2.jpg,Fresh and colorful assortment of fruits and vegetables on a wooden table indoors.,Fresh and colorful assortment of fruits and vegetables on a wooden table indoors.,"fresh produce, produce, fruits, vegetables, healthy, health, wellness, well-being, nutrition, nutritious, diet, dieting, eating, food, whole food, whole foods, plant-based, plant based, vegetarian, vegan, ingredients, cooking, kitchen, table, wooden table, counter, window, sunlight, bright, apple, oranges, strawberry, strawberries, broccoli, kale, red apple, citrus fruits, citrus fruit, leafy greens, leafy green, still life, still-life, close-up, macro, vibrant, colorful, organic, natural, raw",7,2025-03-27
233209_fb550487-ce78-4aad-835c-288ffd6aaa18.jpg,Chamomile herbal flower tea in a glass teapot with petals on a wooden table with soft daylight,Chamomile herbal flower tea in a glass teapot with petals on a wooden table with soft daylight,"chamomile tea, herbal tea, flower tea, tea, hot tea, fresh tea, teapot, glass teapot, tea brewing, flower petals, chamomile flower, white flowers, flower arrangement, floral, herbal, healthy beverage, wellness drink, aromatic tea, tea time, relaxing tea, warm drink, still life, kitchen, interior, cozy, wooden table, tabletop, window light, daylight, blurred background, plant, leaf, cup, table, home, domestic, closeup, macro, detail, refreshment, beverage, aroma, steaming, infusion, decoction, flavor, therapeutic, alternative medicine, medicinal, well-being",7,2025-03-27
233213_1ad32df9-f057-47f0-849b-d5e1fcae37a2.jpg,"Bonsai tree on a gravel path amidst a serene bamboo forest bathed in soft sunlight, embodying zen tranquility.","Bonsai tree on a gravel path amidst a serene bamboo forest bathed in soft sunlight, embodying zen tranquility.","bonsai, bonsai tree, miniature tree, small tree, dwarf tree, zen, zen garden, zen-like, tranquility, tranquil, peaceful, peace, harmony, harmony, balance, minimal, miniature, small, tiny, garden, nature, Japanese garden, Asian garden, forest, bamboo, bamboo forest, grove, bamboo grove, green, greenery, sunlight, sun rays, sunshine, light, path, pathway, road, gravel, pebbles, stones, rocks, ground, landscape, background, scenery, scenic, backdrop, natural, outdoor, environment",11,2025-03-27
233214_6aee8e72-c651-4265-90fc-9b97d5038f62.jpg,Abstract Teal Wave Background with Golden Light Particles: A dreamy teal and gold rendering of water wave.,Abstract Teal Wave Background with Golden Light Particles: A dreamy teal and gold rendering of water wave.,"abstract, abstract background, decorative, illustration, wave, sea, ocean, background, design, art, wallpaper, blue, nature, water, pattern, texture, graphic, element, modern, color, style, template, backdrop, graphic design, digital art, wavy, curve, shape, smooth, aqua, artistic, dynamic, light, bright, shiny, sparkle, glow, glitter, space, creative, fantasy, dreamy, celestial, magical, vibrant, elegant, stylish, cool, backdrop, rendering",8,2025-03-27
233215_bf86aaa9-b45b-4848-8bbb-49ec0e8ca0f8.jpg,Minimalist image of a clear glass bottle filled with pure water droplets on the bottle on a dark surface,Minimalist image of a clear glass bottle filled with pure water droplets on the bottle on a dark surface,"glass bottle, water bottle, clear bottle, empty bottle, bottle, liquid, water, refreshment, hydration, transparent, purity, clean, wet, droplets, condensation, still life, studio shot, minimalist, modern, simple, elegant, circular base, round platform, podium, display, presentation, tabletop, surface, background, backdrop, copy space, negative space, product shot, advertising, marketing, promotion, healthcare, wellness, beverage, liquid refreshment, drinkable, thirsty, still, indoor, closeup, single object, neutral color, serene, calm, clear",4,2025-03-27
233216_25f9a138-dde4-491e-8a04-abc4d95dfa79.jpg,Equilibrium of Healthy Eating: Apple and Grapes on Wooden Balance. Fresh food concept.,Equilibrium of Healthy Eating: Apple and Grapes on Wooden Balance. Fresh food concept.,"apple, grapes, fruit, healthy food, food, fresh, balance, nutrition, diet, red, green, still life, wooden, table, sweet, organic, delicious, vitamins, apple fruit, grape bunch, freshness, wooden table, nutrition balance, diet food, red apple, green grapes, wooden plank, food balance, apple and grapes, fresh fruits, health, fruit balance, well being, fruit still life, food still life, balanced diet, dietary, eating, natural, fruit nutrition, food nutrition, fruit diet, food diet, still life balance, wooden background, health concept, close-up, indoor, tabletop, studio shot",7,2025-03-27
233217_7ecdb559-9a11-4b6c-80a7-e5ff6b0854f6.jpg,Protective Shield Against Lightning in a Cloudy Sky: A concept of cyber security and power defense,Protective Shield Against Lightning in a Cloudy Sky: A concept of cyber security and power defense,"shield, protection, defense, security, guardian, safeguard, cybersecurity, cyber protection, lightning, electricity, energy, power, spark, bolt, voltage, force, strength, magic, fantasy, mystical, supernatural, aura, glow, cloud, sky, night, storm, weather, atmosphere, backdrop, futuristic, modern, abstract, concept, illustration, design, art, graphic, element, symbol, background, wallpaper, digital, rendering, creative, artwork, image, visual, effect",8,2025-03-27
233218_a2560d76-2e00-44fa-8f6b-684e06c242a9.jpg,"Close-up depiction of virus cells with spikes, representing infection and disease under a microscope","Close-up depiction of virus cells with spikes, representing infection and disease under a microscope","virus, viral, microscopic, organism, pathogen, infection, disease, medical, science, research, biology, cell, membrane, spike, protein, structure, surface, microbiology, virology, immunology, epidemic, pandemic, healthcare, pharmaceutical, treatment, prevention, vaccine, immunity, contagious, illness, sick, health, medicine, diagnosis, laboratory, test, analysis, anatomy, physiology, biochemistry, genome, replication, mutation, evolution, coronavirus, influenza, hiv, ebola, zika",16,2025-03-27
233220_bad39359-cbd7-4fa1-b6ea-604125f12050.jpg,Abstract Dark Wavy Texture with Red Glowing Light - Futuristic Background with Sparkles,Abstract Dark Wavy Texture with Red Glowing Light - Futuristic Background with Sparkles,"abstract, abstract background, background, dark, black, dark background, black background, texture, textured, wavy, waves, curve, curved, light, glowing, glow, red, red light, red glow, vibrant, bright, sparkle, sparkling, glitter, glittering, shimmer, shimmering, futuristic, sci-fi, science fiction, fantasy, dreamlike, mysterious, ominous, atmosphere, atmospheric, backdrop, design element, graphic, illustration, modern, contemporary, art, artistic, surface, pattern, render, 3D, 3D rendering, wallpaper",8,2025-03-27
233222_b5aa10cd-97b3-4d0a-90c5-5c53adb8e4c5.jpg,Focused scientist examines cell culture samples in petri dishes within a modern lab.,Focused scientist examines cell culture samples in petri dishes within a modern lab.,"scientist, scientific, research, researcher, laboratory, lab, medical, medicine, biotechnology, biology, chemist, chemistry, pharmaceutical, pharmacy, experiment, analysis, healthcare, discovery, development, doctor, virology, virus, bacteriology, bacteria, microbiology, microbe, petri dish, cell culture, sample, specimen, test, testing, science, clinical, diagnostics, diagnosis, glasses, goggles, protective eyewear, coat, white coat, indoor, indoors, hospital, clinic, wellness, well being, academia, academic",16,2025-03-27
233223_780bfa3f-907a-49bc-8fe2-cb324473fe4f.jpg,"Detailed 3D rendering of DNA molecule, illustrating genetic code, research in genetics and medicine","Detailed 3D rendering of DNA molecule, illustrating genetic code, research in genetics and medicine","DNA, double helix, genetic code, molecule, genes, chromosome, scientific research, helix, genetic, biology, science, biotechnology, medicine, medical, research, healthcare, pharmaceutical, pharmacy, molecular, biomedical, scientific, experiment, laboratory, microbiology, genetic engineering, cloning, genome, cellular, mutation, diagnosis, therapy, treatment, immunology, virus, cell, antibodies, vaccine, anatomy, physiology, biochemistry, disease, pathology, genetic disorder, microscopic, illness, digital art, 3D rendering, abstract, futuristic, dark background",16,2025-03-27
233224_a28dec23-0ffc-431c-907f-367270d07d24.jpg,Abstract DNA helix structure with science background. Double helix molecular strand with genetic engineering.,Abstract DNA helix structure with science background. Double helix molecular strand with genetic engineering.,"DNA, helix, double helix, molecular, genetic, biology, gene, molecule, chromosome, strand, biotechnology, science, scientific, research, medical, medicine, healthcare, pharmaceutical, biochemistry, laboratory, anatomy, life, body, cell, nucleus, structure, spiral, abstract, illustration, render, background, backdrop, wallpaper, design, graphic, element, pattern, texture, backdrop, art, modern, futuristic, digital, blue, red, bokeh, light, shape, bright, glowing",16,2025-03-27
233226_0da171a8-ee49-4360-832e-3d90377e2994.jpg,Majestic Old Tree Silhouette at Dusk with a Sky Filled with Starry Night Landscape,Majestic Old Tree Silhouette at Dusk with a Sky Filled with Starry Night Landscape,"old tree, ancient tree, gnarled tree, large tree, massive tree, big tree, giant tree, oak tree, bare tree, leafless tree, winter tree, tree silhouette, tree trunk, tree branches, root system, exposed roots, tree roots, landscape, field, meadow, sky, sunset, sunrise, dusk, dawn, twilight, evening, morning, rural scene, nature, outdoor, scenic, peaceful, tranquil, serene, calm, quiet, idyllic, pastoral, solitary, lonely, isolated, bare, branch, silhouette, night, star, dark, dreamlike, atmospheric",11,2025-03-27
