Filename,Title,Description,Keywords,Category,Release(s)
234466_7652b6d6-e3dd-4ae8-bd77-965070982daf.jpg,Tranquil Beach Scene with Seashells and Turquoise Sea ,Tranquil Beach Scene with Seashells and Turquoise Sea ,"seashells, shell, shells, sea shell, seashell, beach, sandy beach, sand, sand background, ocean, sea, seascape, seashore, coast, coastal, vacation, holiday, tropical, tropical beach, summer, summertime, travel, destination, shore, shoreline, turquoise water, aqua, aquatic, marine, nautical, water, nature, natural, outdoors, sunny, sunshine, daylight, bright, background, backdrop, scenic, tranquil, serene, relaxing, calm, leisure, closeup, macro, detail, decorative",11,2025-03-27
234467_3153eb6e-d66c-4414-b424-7cea1ac44943.jpg,"Zen Interior with Himalayan Salt Lamps, Stones, and Water Feature for Relaxation and Peaceful Home Decor","Zen Interior with Himalayan Salt Lamps, Stones, and Water Feature for Relaxation and Peaceful Home Decor","salt lamps, crystal lamps, rock lamps, himalayan salt lamps, decorative lamps, mood lighting, warm lighting, glowing, illumination, zen, mindfulness, wellness, spa, relaxation, tranquility, serenity, meditation, stones, pebbles, smooth stones, stack of stones, stone arrangement, stone balancing, water feature, indoor water feature, artificial stream, water flow, stream, indoor stream, plants, houseplants, greenery, home decor, interior design, window, curtains, natural light, daylight, calm, peaceful, soothing, atmosphere, still life, cozy, modern, home, indoors, well-being, healthy lifestyle, self-care",12,2025-03-27
234459_cee2ee95-fba9-4576-8319-4846fa2f3ce8.jpg,Happy Little Girl Holding a Dandelion in a Sunny Field of Wildflowers,Happy Little Girl Holding a Dandelion in a Sunny Field of Wildflowers,"child, kid, toddler, little girl, cute, happy, joyful, cheerful, smiling, laughing, adorable, innocent, dandelion, flower, yellow flower, wildflower, spring, summer, meadow, field, grass, outdoors, nature, daylight, daytime, sunny, blue sky, portrait, close-up, hair, blonde hair, curly hair, fair-skinned, caucasian, european, one person, small, tiny, holding, looking, dreamy, carefree, beautiful, pretty, youth, childhood, recreation, leisure, well-being, season",13,2025-03-27
234473_23f918ce-9207-4ffd-821c-1e5b22f54f0d.jpg,Bowl of Fresh Mixed Berries with Almonds and Dried Apricots on a Rustic Wooden Table by the Window,Bowl of Fresh Mixed Berries with Almonds and Dried Apricots on a Rustic Wooden Table by the Window,"fruit, berry, berries, mixed berries, fresh berries, bowl, fruit bowl, berries in bowl, nuts, almonds, almond, hazelnuts, hazelnut, raspberry, raspberries, strawberry, strawberries, blueberry, blueberries, blackberry, blackberries, dried apricot, dried apricots, healthy, healthy eating, healthy food, vegan, vegetarian, breakfast, snack, dessert, nutritious, nutrition, wooden table, table, kitchen, indoors, daylight, window, plant, still life, close-up, macro, vibrant, colorful, natural, rustic, antioxidant, vitamin, food photography",7,2025-03-27
234468_61a15a50-d748-47e9-a504-620d87ee2120.jpg,Elevated Still Life: Assorted Cosmetic Products with Natural Botanical Elements Displayed on Stone Surface,Elevated Still Life: Assorted Cosmetic Products with Natural Botanical Elements Displayed on Stone Surface,"beauty products, cosmetics, skincare, beauty, product photography, cosmetic products, beauty photography, cosmetics photography, skincare products, natural cosmetics, organic skincare, bottles, containers, packaging, serum, cream, lotion, oil, essential oil, cosmetic bottles, skincare bottles, minimalist, clean, stone, slate, botanical, spa, wellness, health, alternative medicine, aroma, aromatherapy, ingredients, plant extracts, natural ingredients, mockup, presentation, still life, studio shot, product shot, cosmetic ingredient, beauty treatment, facial care, dropper bottles, pump bottles, jars, white caps, amber bottles, glass bottles",12,2025-03-27
234475_72518946-264b-4570-96e5-24a89744bb45.jpg,"Watercolor botanical illustration of plants, flowers, foliage, and herbs on a white background.","Watercolor botanical illustration of plants, flowers, foliage, and herbs on a white background.","botanical illustration, watercolor illustration, floral illustration, watercolor floral, botanical art, watercolor art, watercolor painting, botanical drawing, watercolor drawing, floral art, floral drawing, watercolor plant, botanical plant, watercolor leaf, botanical leaf, watercolor foliage, botanical foliage, plant illustration, leaf illustration, foliage illustration, watercolor flower, botanical flower, flower illustration, herb illustration, watercolor herb, botanical herb, green leaves, green foliage, golden leaves, golden foliage, green plant, blue flower, blue blossom, isolated plants, isolated leaves, isolated flowers, isolated herbs, nature illustration, organic illustration, herbal, herbal remedy, herbal medicine, medicinal plant, herb, botany, flora, foliage, leaves, botanical",14,2025-03-27
234471_4aa99bd6-a3a5-4643-94d7-b48170cd515b.jpg,"Zen Stone Cairn at Sunset on a Beach, Seaside Rock Balancing Art on Sandy Shoreline","Zen Stone Cairn at Sunset on a Beach, Seaside Rock Balancing Art on Sandy Shoreline","stone stacking, rock balancing, stone balance, rock stack, cairn, balancing stones, stacked stones, zen stones, pebble stack, stone tower, beach stones, ocean stones, sea stones, sunset, sunrise, beach sunset, beach sunrise, ocean sunset, ocean sunrise, seascape, coastal, shoreline, seashore, sandy beach, sandy shore, peaceful, tranquil, serene, calm, relaxing, meditative, mindfulness, well-being, harmony, balance, stability, equilibrium, nature, coastal scenery, beach scene, ocean view, sand, horizon, sky, water, coastline, seaside, vacation, travel, outdoor",11,2025-03-27
234472_ed3570e7-ec8a-485b-b3aa-7cec58424485.jpg,Lush Green Rice Terraces on Rolling Hills at Sunrise - Scenic Agricultural Landscape,Lush Green Rice Terraces on Rolling Hills at Sunrise - Scenic Agricultural Landscape,"rice terraces, rice field, terraced fields, agricultural landscape, agriculture, farming, cultivation, crop, harvest, green terraces, rural scene, rural, countryside, landscape, nature, outdoors, scenic, hillside, mountain, valley, sunlight, golden hour, aerial view, top view, elevation, contours, pattern, texture, rows, layers, earth, soil, farm, plant, growth, fertile, lush, vibrant, tranquil, peaceful, serene, sustainable, food production, agrarian, eco-friendly, Asia, Asian, travel, tourism, rural tourism",11,2025-03-27
234479_f8998553-8737-489f-b9e3-359742dbe491.jpg,"Loving mother holding her newborn baby in gentle light, sharing a tender moment of motherhood and happiness.","Loving mother holding her newborn baby in gentle light, sharing a tender moment of motherhood and happiness.","mother, baby, newborn, infant, child, kid, cute, adorable, love, care, family, parent, mom, mum, woman, female, girl, person, people, portrait, face, eyes, hair, skin, soft, tender, sweet, happy, joy, happiness, home, house, bedroom, light, sunlight, window, bed, blanket, cozy, warm, indoor, togetherness, parenthood, motherhood, lifestyle, close-up, profile, daytime, domestic life",13,2025-03-27
234478_c450f7d4-c830-40c9-8f9a-f6f70761353e.jpg,Vibrant Abstract Curves: Modern 3D Render with Fluid Motion and Iridescent Colors on a Dark Background,Vibrant Abstract Curves: Modern 3D Render with Fluid Motion and Iridescent Colors on a Dark Background,"abstract, abstract design, modern abstract, contemporary abstract, futuristic abstract, fluid, fluid motion, flowing, flow, wave, wavy, colorful, vibrant, bright, iridescent, holographic, curves, curved, lines, line, 3d, 3d render, rendering, digital art, digital illustration, background, backdrop, wallpaper, gradient, color gradient, mesh, geometric, texture, smooth, elegant, artistic, creative, design element, decorative, ornate, pattern, illustration, graphic, presentation, banner, poster, cover, web design, backdrop",8,2025-03-27
234476_22e05fc7-e063-4e8e-b17b-56766059532b.jpg,"Zen Garden with Raked Sand, Rocks, and Tranquil Atmosphere","Zen Garden with Raked Sand, Rocks, and Tranquil Atmosphere","zen garden, japanese garden, tranquil garden, peaceful garden, serene garden, miniature landscape, sand garden, rock garden, meditation garden, contemplative garden, spiritual garden, traditional garden, raked sand, patterns in sand, garden design, landscape design, zen, Japanese, tranquility, peace, serenity, miniature, sand, rocks, meditation, contemplation, spirituality, tradition, raked, patterns, design, landscaping, Asian garden, Asian landscape, nature, outdoors, trees, plants, foliage, architecture, building, house, wooden structure, garden art, decorative garden, garden stones, outdoor decor, zen art, cultural, travel",11,2025-03-27
234482_930af526-d7ad-4493-af2b-a10ee91355b4.jpg,"Fragrant Herbal Tea with Open Book, Cozy Still Life, Relaxation Time, Warm Sunlight, and Minimal Style","Fragrant Herbal Tea with Open Book, Cozy Still Life, Relaxation Time, Warm Sunlight, and Minimal Style","herbal tea, flower tea, tea, hot tea, cup of tea, drink, beverage, hot beverage, clear cup, cup, glass cup, book, open book, reading, education, knowledge, literature, page, study, learn, almond, nuts, snack, refreshment, table, desk, wooden table, wooden desk, window light, sunlight, morning, relax, relaxation, calm, peace, peaceful, still life, indoor, warm, cozy, aroma, fragrant, refreshing, tea break, close-up, minimal, simple, macro, still, serene",7,2025-03-27
234485_d6f5730e-b8cf-4ce3-bbaa-f5f2d49b2ddd.jpg,Equilibrium concept: an egg balances with small wooden bowls on a small seesaw against a nature background.,Equilibrium concept: an egg balances with small wooden bowls on a small seesaw against a nature background.,"balance, equilibrium, harmony, symmetry, stability, poise, counterbalance, egg, food, diet, protein, nutrition, breakfast, ingredient, raw, uncooked, organic, healthy, wooden, wood, rustic, table, seesaw, scale, balancing act, still life, outdoors, macro, studio shot, close-up, neutral, minimalism, simple, zen, contemplation, meditation, wellness, well-being, health, concept, symbol, lifestyle, nature, plants, daylight, neutral background, soft focus, blurred background, green background",3,2025-03-27
234469_8ebc2722-1b29-4ea0-a917-d833a8767ca7.jpg,"Modern Kitchen Still Life with Copper Tap, Parsley, and Food Bowl - Interior, Countertop","Modern Kitchen Still Life with Copper Tap, Parsley, and Food Bowl - Interior, Countertop","kitchen, modern kitchen, interior, kitchen interior, modern kitchen interior, tap, modern tap, kitchen tap, water, flowing water, kitchenware, countertop, wooden countertop, kitchen countertop, bowl, food bowl, dish, kitchen dish, window, kitchen window, houseplant, kitchen houseplant, parsley, fresh parsley, sink, kitchen sink, counter, kitchen counter, still life, still life photography, kitchen still life, table, wood table, interior design, home interior, home decor, clean, hygiene, domestic, indoors, residence, appliance, fixture, domestic kitchen, cookery, nutrition, prepared food, home, lifestyle",7,2025-03-27
234487_92fab573-9037-4902-aad4-e48708dc2d9f.jpg,"Person Gazing at Mountain Lake View from Window, Lost in Thought, Seeking Serenity and Tranquility","Person Gazing at Mountain Lake View from Window, Lost in Thought, Seeking Serenity and Tranquility","contemplation, introspection, pondering, reflection, solitude, serenity, peacefulness, tranquility, quiet, calm, thoughtful, window view, scenic view, mountain view, lake view, natural beauty, scenery, landscape, vista, person, man, student, writer, artist, creative, indoor, room, window, daydreaming, meditative, inspiration, escape, retreat, relaxation, recreation, lifestyle, back view, silhouette, shadow, chair, table, mug, pens, books, curtains, home, interior, still life, mood, atmosphere",12,2025-03-27
234488_8ce5b048-57c8-47be-ab5d-c83d57ff8425.jpg,"Vibrant Fruit Bowl: Strawberries, Grapes, Mango, Apple & Melon Medley","Vibrant Fruit Bowl: Strawberries, Grapes, Mango, Apple & Melon Medley","fruit, fruits, fresh fruit, fruit platter, fruit bowl, healthy, healthy eating, healthy lifestyle, food, fresh food, strawberries, strawberry, grapes, green grapes, black grapes, mango, sliced mango, lemon, apple, red apple, cantaloupe, melon, wooden bowl, bowl, vitamins, antioxidants, nutrition, nutritious, diet, dieting, wellness, well-being, vegetarian, vegan, sweet, delicious, tasty, macro, close-up, still life, table, wooden table, produce, organic, natural, raw, refreshing, arrangement, colorful",7,2025-03-27
234489_9d01d91a-e6e6-41ac-9256-a98b6e31a457.jpg,"Pastel Abstract Waves: Soft, Smooth, and Dreamy Background Texture","Pastel Abstract Waves: Soft, Smooth, and Dreamy Background Texture","abstract, abstraction, soft, smooth, pastel, gradient, color gradient, color, colorful, vibrant, illuminated, illumination, light, lighting, bright, texture, textured, wavy, waves, flowing, flow, fabric, textile, material, pink, coral, salmon, peach, orange, blue, cyan, turquoise, aqua, modern, contemporary, artistic, design, backdrop, background, surface, pattern, delicate, gentle, elegant, dreamy, ethereal, fantasy, surreal, art",8,2025-03-27
234491_ee08ac8c-3225-4e1a-8a92-b03b963a5d04.jpg,Mature doctor explaining diagnosis to female patient in office during consultation.,Mature doctor explaining diagnosis to female patient in office during consultation.,"doctor, physician, medical professional, health care provider, patient, woman, adult, medical consultation, medical examination, checkup, healthcare, medicine, diagnosis, treatment, hospital, clinic, office, white coat, stethoscope, tablet computer, digital tablet, technology, electronic device, consultation, communication, discussion, advice, elderly man, senior man, gray hair, facial hair, window, daylight, plant, indoor, room, appointment, professional, expertise, knowledge, trust, empathy, support, well-being, prevention, recovery, lifestyle, wellness, healthy lifestyle, healthcare system",13,2025-03-27
234495_9837ae10-f163-446a-8de4-9d97d5f3e1ef.jpg,Striking Abstract Sphere Painting with Contrasting Textures on Canvas,Striking Abstract Sphere Painting with Contrasting Textures on Canvas,"abstract art, abstract painting, modern art, contemporary art, artistic, artwork, canvas art, textured art, visual art, painting, texture, painted surface, surface, sphere, celestial body, celestial, globe, orb, round, duality, yin and yang, opposites, contrast, balance, harmony, red, crimson, scarlet, gold, golden, amber, blue, navy, azure, ocean, sea, water, wave, fluid, liquid, reflection, light, crack, fissure, split, illustration, creative, art, backdrop, background",8,2025-03-27
234500_6b37ddf6-e199-46b9-9166-f1da68b564b5.jpg,Snowboarder Jumping High Against a Clear Blue Sky in the Mountains on a Sunny Winter Day,Snowboarder Jumping High Against a Clear Blue Sky in the Mountains on a Sunny Winter Day,"snowboarding, snowboard, snow, snowy, winter sport, winter sports, extreme sport, extreme sports, freestyle, outdoors, activity, action, athlete, jumping, jump, sky, mountain, mountains, mountain range, alpine, helmet, snowboarder, winter, day, sun, sport, sports, adventure, snow slope, slopes, snowdrift, cold, recreation, fun, exercise, snowy mountains, snow mountain, winter activity, winter season, snow landscape, landscape, view, scenic, background, person, people, orange jacket, altitude, lifestyle, active",18,2025-03-27
234499_733f9a76-e9a1-4ceb-a524-1c647cbaac5e.jpg,Young Plant in Cracked Pot Against Urban Skyline at Sunset,Young Plant in Cracked Pot Against Urban Skyline at Sunset,"plant, sapling, seedling, young plant, small plant, green plant, sprout, growth, growing, new growth, urban, city, cityscape, skyline, buildings, blurred background, blur, out of focus, sunset, sunrise, dawn, dusk, evening, morning, light, sun, pot, flowerpot, cracked pot, broken pot, terracotta pot, damaged, fragile, soil, dirt, gardening, horticulture, nature, environment, sustainability, resilience, hope, new beginnings, restart, indoor plant, houseplant, close-up, macro, still life",5,2025-03-27
234501_4d4950e2-2f73-46b0-8829-4d3f0811e3d1.jpg,"Creative mind with glowing lightbulbs. Conceptual brain activity and innovative thinking, imagination.","Creative mind with glowing lightbulbs. Conceptual brain activity and innovative thinking, imagination.","brain, thinking, thought process, ideas, innovative, creativity, knowledge, learning, understanding, bright ideas, brainstorming, inspiration, insight, concept, intelligence, mind, mental, human head, artificial intelligence, machine learning, neural network, neurons, connections, connectivity, innovation, invention, invention concept, lightbulb, glowing, illumination, power, energy, imagination, ingenuity, vision, solution, discovery, psyche, consciousness, cognitive, psychology, science, technology, futuristic, digital, network, abstract, symbolic, symbolism",13,2025-03-27
234493_f75e5371-b9cc-48b1-884e-db35cce22550.jpg,"Close-up Illustration of Neurons and Nerve Cells in the Brain, Biology, Scientific and Medical Illustration","Close-up Illustration of Neurons and Nerve Cells in the Brain, Biology, Scientific and Medical Illustration","neuron, neurons, nerve cell, nerve cells, cell, cells, brain cell, brain cells, biology, science, scientific, medical, medicine, research, microbiology, microscopic, microscope, scientific research, pharmaceutical, healthcare, anatomy, physiology, neural, neurology, neurological, nerve, nerves, neural network, nervous system, dendrite, dendrites, synapse, synapses, axon, axons, spinal cord, brain, mind, thinking, cognitive, cognition, nervous, illness, disease, infection, virus, bacterium, pathogen, microorganism",16,2025-03-27
234503_3fc7e522-40d9-43e0-aba7-c4f9758b0abf.jpg,Relaxing cup of chamomile tea with dried flowers on a sunny day.,Relaxing cup of chamomile tea with dried flowers on a sunny day.,"herbal tea, flower tea, chamomile tea, tea, cup, glass, drink, beverage, hot beverage, herbal drink, floral drink, infusion, decoction, tea time, relaxation, calming, soothing, aromatherapy, wellness, healthcare, medicine, alternative medicine, natural medicine, herb, flower, chamomile, floral, plant, flora, garden, nature, outdoors, sunlight, zen, still life, closeup, macro, detail, blur, background, backdrop, surface, stone, table, botanical, organic, healthy, fresh, aroma",7,2025-03-27
234502_71d8390b-46c2-439b-9805-6afd837255a1.jpg,"Tranquil Zen Garden with Bonsai Tree, Sand Ripples, and Soft Sunlight. A scene of meditation, harmony, and nature.","Tranquil Zen Garden with Bonsai Tree, Sand Ripples, and Soft Sunlight. A scene of meditation, harmony, and nature.","zen garden, japanese garden, peaceful garden, serene garden, tranquil garden, miniature tree, bonsai tree, small tree, dwarf tree, garden art, garden design, sand garden, raked sand, sand pattern, moss, mossy, zen, peace, harmony, tranquility, meditation, mindfulness, nature, outdoors, landscape, scenery, sunlight, sunrise, sunset, morning light, evening light, soft light, light, shadow, rocks, stones, pebbles, bamboo, plant, flora, botany, environment, ecology, wellness, well-being, spiritual, spirituality, zen buddhism, buddhism",5,2025-03-27
234505_c33b0a2b-599b-413c-ae08-7f601249f26c.jpg,"Salmon fillet with avocado and greens on a plate, a culinary delight for a healthy and delicious meal.","Salmon fillet with avocado and greens on a plate, a culinary delight for a healthy and delicious meal.","salmon, fish, seafood, fillet, dish, plate, food, meal, nutrition, recipe, cuisine, gourmet, culinary, restaurant, dining, ingredient, fresh, healthy, balanced, diet, organic, natural, greens, salad, arugula, spinach, lettuce, vegetables, herbs, parsley, seasoning, condiment, avocado, tomato, sauce, wooden, table, rustic, fork, kitchen, cooking, preparation, studio shot, close-up, presentation, artistic, arrangement, still life, tasty, delicious",7,2025-03-27
234504_2dc26e34-eb51-44ee-8e4d-f5be2ae44ba6.jpg,"Winter Cabin in a Snowy Forest at Dusk, Illuminated. Tranquil Scenery","Winter Cabin in a Snowy Forest at Dusk, Illuminated. Tranquil Scenery","winter, snow, snowy, forest, trees, pine trees, evergreen trees, coniferous trees, cabin, log cabin, house, winter landscape, landscape, scenery, winter scenery, seasonal, cold, frost, frosty, twilight, evening, night, dusk, remote, secluded, tranquil, peaceful, quiet, nature, outdoors, wood, wooden, architecture, building, rural, countryside, rustic, cozy, warm, light, illumination, idyllic, dreamy, serene, winter wonderland, escape, getaway, holiday, vacation, travel",11,2025-03-27
234506_1c6565a1-56c7-471e-a084-d8c834f39981.jpg,"Silhouette Man Contemplating Mountain Sunrise Landscape: Tranquil Scenery, Golden Light, Serene Vista","Silhouette Man Contemplating Mountain Sunrise Landscape: Tranquil Scenery, Golden Light, Serene Vista","man, male, person, silhouette, mountains, mountain range, mountain, peak, ridge, hills, hillside, hill, landscape, scenery, vista, view, sunrise, sunset, golden hour, golden light, sunlight, sun, sky, clouds, orange sky, red sky, horizon, dawn, dusk, outdoors, nature, environment, tranquil, tranquility, serene, peaceful, contemplation, meditation, reflection, pondering, spiritual, travel, wanderlust, adventure, exploration, escape, remote, secluded, quiet, scenic",11,2025-03-27
234508_ec1a5b46-e08b-415b-a27f-019576f33144.jpg,"Aromatic tea moment with spa essentials, sunlight, and a peaceful view.","Aromatic tea moment with spa essentials, sunlight, and a peaceful view.","cup, tea, beverage, drink, aroma, towel, spa, wellness, relaxation, candle, treatment, massage, therapy, health, healthy, lifestyle, room, window, interior, table, plant, zen, blur, home, fresh, natural, organic, care, wood, stone, day, sun, morning, still life, cozy, calm, serene, tranquil, simple, minimal, bright, well-being, lifestyle, indoors, decorative, vessel, container, clean, soft, warm",12,2025-03-27
234509_fb08597e-f00c-4cc0-9cad-1599a50003cf.jpg,Aromatic Essential Oils in Amber Bottles with Lilac Flowers and Decorative Autumnal Setup,Aromatic Essential Oils in Amber Bottles with Lilac Flowers and Decorative Autumnal Setup,"essential oils, aromatherapy, fragrance oils, healing oils, natural remedies, alternative medicine, wellness, well-being, relaxation, spa, massage, skincare, beauty, amber bottles, glass bottles, dropper bottles, oil bottles, small bottles, assorted sizes, lilac flowers, purple flowers, blue flowers, floral arrangement, flower bouquet, decorative flowers, linen cloth, blue linen, fabric drape, soft fabric, plant pot, green plant, indoor plant, home decor, still life, close-up, indoor setting, calm, serene, soothing, peaceful, therapeutic, aromatic, natural, organic, holistic, pumpkin decor, autumnal, seasonal, table setting, decorative",14,2025-03-27
234511_8e94e4e4-29b9-4d55-adbf-b8e4e1dd8ce8.jpg,Cozy Cabin in Mountainous Landscape with Fog and Sunrise,Cozy Cabin in Mountainous Landscape with Fog and Sunrise,"cabin, log cabin, mountain cabin, chalet, mountain chalet, alpine cabin, alpine chalet, mountains, mountain range, mountain landscape, mountain view, alpine mountains, landscape, scenery, nature, fog, foggy, mist, misty, clouds, cloudy, sunrise, sunset, dawn, dusk, morning, evening, trees, forest, grass, grassland, hill, hillside, slope, rural, countryside, outdoors, exterior, architecture, building, wood, wooden, idyllic, peaceful, serene, quiet, remote, secluded, travel, tourism",11,2025-03-27
234512_7a44847e-2b69-4367-a30e-2ba5c480b859.jpg,"Young Woman Practicing Mindfulness Meditation at Home for Well-being, Balance and Calm","Young Woman Practicing Mindfulness Meditation at Home for Well-being, Balance and Calm","woman, yoga, meditation, mindfulness, practice, calm, serene, serenity, wellness, well-being, health, healthy, lifestyle, indoor, studio, pose, exercise, fitness, spiritual, spirituality, zen, peaceful, peace, harmony, relaxation, relax, namaste, gratitude, gratful, home, apartment, apartment, sunlight, window, plants, potted plants, brunette, ponytail, casual, eyes closed, smiling, happy, content, joy, gentle, warm, light, harmony, balance",12,2025-03-27
234514_06732bb4-c590-48af-8203-fcfd94a98083.jpg,"Grilled Salmon with Avocado and Greens on a Plate: Healthy Cuisine, Nutritious Meal","Grilled Salmon with Avocado and Greens on a Plate: Healthy Cuisine, Nutritious Meal","salmon, grilled salmon, cooked salmon, salmon fillet, fish, seafood, cooked fish, avocado, sliced avocado, greens, green salad, fresh greens, healthy, healthy eating, healthy food, healthy lifestyle, diet, dieting, food, cuisine, dish, meal, lunch, dinner, plate, wooden table, table, organic, nutrition, delicious, tasty, gourmet, restaurant, fresh, herb, parsley, cilantro, leaf, meal prep, balanced diet, vitamins, antioxidants, omega 3, nutritious, well being, food photography, culinary, recipe, plating",7,2025-03-27
234516_124ef6c4-9477-4bf0-aee5-e42e5b232d5e.jpg,"Fresh Tucum Fruit Pile with Leaves, A Culinary Ingredient from the Amazon Region","Fresh Tucum Fruit Pile with Leaves, A Culinary Ingredient from the Amazon Region","tucum, tucuma, fruit, Amazonian fruit, exotic fruit, tropical fruit, Amazon, exotic, tropical, food, ingredient, cuisine, Brazilian cuisine, Amazonian cuisine, regional cuisine, regional food, dish, Amazonian dish, typical food, snack, seed, plant, native, flora, local, nature, agriculture, harvest, vegan, vegetarian, healthy, nutrition, raw, fresh, leaf, surface, background, macro, closeup, still life, arrangement, table, texture, brown, green, detail, organic, natural, culinary, gastronomy",7,2025-03-27
