Filename,Title,Description,Keywords,Category,Release(s)
241957_0c6a2be1-9edd-4f8a-9e2d-96bf760f81fa.jpg,"Urban Skyline with Modern Green Buildings at Sunset, Cityscape with Road and Skyline","Urban Skyline with Modern Green Buildings at Sunset, Cityscape with Road and Skyline","cityscape, urban landscape, city skyline, metropolitan area, downtown, city, buildings, modern architecture, contemporary architecture, architectural design, skyscrapers, high-rise buildings, urban buildings, green buildings, eco-friendly buildings, sustainable architecture, vertical garden, green roof, urban greenery, nature in the city, trees, urban trees, road, city road, urban road, highway, city highway, urban highway, traffic, urban traffic, sunset, sunrise, dawn, dusk, evening, twilight, sky, clouds, pink sky, purple sky, aerial view, bird's-eye view, city overview, modern city, futuristic city, urban planning, city living, travel, urban travel, city travel",11,2025-03-30
241972_6bbf15e6-9ab0-48c4-a84a-7447086a60dd.jpg,Detailed Tooth Anatomy Illustrative Cross Section for Dental Education and Science,Detailed Tooth Anatomy Illustrative Cross Section for Dental Education and Science,"tooth, teeth, dental, dentistry, anatomy, cross section, section, cutaway, medical, healthcare, oral hygiene, hygiene, enamel, dentin, pulp, root, crown, gingiva, periodontal, illustration, diagram, science, biology, medicine, healthcare, treatment, structure, human, body, healthy, whitening, protection, care, anatomy, cross-section, close-up, dental care, health, diagram, healthcare, medical, oral, human teeth, anatomy, biological, scientific, anatomical, biological",16,2025-03-30
241979_5fadee0a-7644-4c03-b19d-9735fbaa2b2a.jpg,Close-up of Fresh Green Aloe Vera Plant with Spiky Leaves in Natural Sunlight,Close-up of Fresh Green Aloe Vera Plant with Spiky Leaves in Natural Sunlight,"aloe vera, aloe, succulent, succulents, plant, plants, green, leaf, leaves, cactus, botanical, nature, herb, herbal, medicine, medical, natural, organic, fresh, healthy, health, wellness, spa, beauty, skincare, closeup, macro, background, texture, pattern, detail, garden, gardening, flora, foliage, tropical, botany, sharp, pointed, sunlight, growth, vibrant, bright, dew, water droplets, elixir, alternative medicine, healing, therapeutic, ingredient",14,2025-03-30
241982_006a3050-4cf2-4d35-ba2e-f681311d392a.jpg,Close-Up Portrait of a Beautiful Smiling Woman with Curly Hair and Green Eyes indoors,Close-Up Portrait of a Beautiful Smiling Woman with Curly Hair and Green Eyes indoors,"portrait, woman, female, smiling, smile, happy, cheerful, joyful, curly hair, brunette, brown hair, eyes, eye, green eyes, face, facial, skin, skincare, healthy skin, teeth, white teeth, indoor, indoors, home, at home, background, blurred, blurred background, lighting, light, bokeh, natural light, close-up, closeup, headshot, lifestyle, wellness, well-being, positive, positivity, happiness, joy, friendly, beautiful, pretty, attractive, youthful, confidence, self-care, self-love",13,2025-03-30
241964_33f79ae0-254b-4a86-9d54-39383153f68d.jpg,Group of diverse women enjoying a healthy salad at a bright dining table during a sunny day.,Group of diverse women enjoying a healthy salad at a bright dining table during a sunny day.,"friends, friendship, gathering, togetherness, group, community, women, woman, female, cheerful, happy, happiness, joyful, joy, smiling, smiles, dining, dinners, meal, meals, nutrition, wholesome, food, freshness, fresh, healthy, health, salad, salads, vegetable, vegetables, vegetarian, vegan, tomato, tomatoes, lunch, breakfast, cuisine, table, indoors, kitchen, daytime, day, window, bright, sunlight, sunshine, positive, well-being",13,2025-03-30
241969_a5d7dcd9-f77b-4797-9225-8220f1e4b017.jpg,Detailed Dental Anatomy: A Cross-Sectional View of a Human Molar Structure,Detailed Dental Anatomy: A Cross-Sectional View of a Human Molar Structure,"tooth, teeth, dental, dentistry, anatomy, human anatomy, cross section, molar, enamel, dentine, pulp, gum, root, nerve, vessel, illustration, diagram, medical, healthcare, science, biology, medicine, oral, hygiene, structure, internal, tissue, gingiva, odontology, odontology, cross-section, dental care, dental health, human, healthcare, gingival, oral hygiene, body, part, diagram, anatomy, scientific, biological, microscopic, closeup, cutaway, educational, image, closeup",16,2025-03-30
241967_f6c82936-7efc-446a-9c71-29e9dc40e526.jpg,Close-up Portrait of a Smiling Young Woman with Green Eyes in a Natural Outdoor Setting,Close-up Portrait of a Smiling Young Woman with Green Eyes in a Natural Outdoor Setting,"woman, female, portrait, young woman, young female, face, smiling, happy, cheerful, beautiful, pretty, attractive, beauty, green eyes, hazel eyes, eye, eyes, skin, skincare, natural, natural beauty, wellness, well-being, health, healthy, lifestyle, people, person, caucasian, brunette, hair, hairstyle, makeup, cosmetics, outdoors, nature, park, garden, summer, daylight, day, sunlight, soft lighting, close-up, headshot, one person, looking at camera, serene, calm, relaxed",13,2025-03-30
241987_8208b137-ee0f-4727-af6b-52c45843d939.jpg,"Anatomical cross-section of a molar tooth, showcasing enamel, dentin, and pulp in a 3D rendering.","Anatomical cross-section of a molar tooth, showcasing enamel, dentin, and pulp in a 3D rendering.","tooth, teeth, dental, dentistry, anatomy, cross section, molar, human tooth, healthcare, medicine, dental care, oral hygiene, pulp, enamel, dentin, root, illustration, structure, diagram, medical, health, scientific, biological, educational, study, learning, healthcare, diagram, anatomy, body, biology, science, clinical, research, analysis, cutaway, dental anatomy, tooth structure, oral health, dental hygiene, dentist, clinic, medical diagram, healthcare illustration, medical illustration, anatomy illustration, tooth model, 3D rendering, 3D illustration",16,2025-03-30
241986_10ad3225-a97d-4df0-a7c3-e4ea3f775e52.jpg,"Fresh hygiene products arranged on a marble surface, with an orchid plant, for healthy and beauty lifestyle.","Fresh hygiene products arranged on a marble surface, with an orchid plant, for healthy and beauty lifestyle.","bathroom, hygiene, personal care, oral hygiene, toothbrush, toothpaste, dental care, skincare, beauty products, cosmetics, lotion, cream, soap, cleanser, treatment, essential, routine, wellness, health, self care, lifestyle, marble, surface, countertop, clean, fresh, modern, minimalist, still life, indoor, composition, arrangement, display, presentation, product, advertisement, marketing, orchid, flower, plant, decoration, elegant, style, contemporary, design, domestic, home, residence, studio",12,2025-03-30
241984_ed7d672c-cacb-4603-b1a4-a4350092448b.jpg,"Anatomical Model: Detailed Human Jawbone, Teeth and Skull Rendering","Anatomical Model: Detailed Human Jawbone, Teeth and Skull Rendering","jaw, mandible, anatomical model, anatomical, anatomy, human anatomy, mouth, open mouth, teeth, human teeth, tooth, dentition, dentistry, dental, gingiva, gum, maxilla, bone, jawbone, cranium, skull, skeleton, body, human body, part of body, medical, medicine, healthcare, science, scientific, biology, biological, healthcare, diagram, illustration, rendering, 3D, 3D rendering, cutout, close-up, studio shot, isolated, white background, beige, neutral color, neutral colour, model, structure, macro",16,2025-03-30
241991_29ab3591-49d7-4a3b-b885-e1dab6e26f78.jpg,"Elegant Gold and Silver Ribbons on Dark Blue Backdrop: Festive, Celebration, and Holiday Decoration","Elegant Gold and Silver Ribbons on Dark Blue Backdrop: Festive, Celebration, and Holiday Decoration","gold ribbon, silver ribbon, ribbon, decorative ribbon, sparkly ribbon, metallic ribbon, gold, silver, metallic, sparkly, glitter, shimmer, shine, luxury, elegant, festive, celebration, holiday, party, decoration, ornament, design element, background, abstract, texture, pattern, surface, blue, navy blue, dark blue, bokeh, light, blur, defocused, macro, close-up, detail, backdrop, wallpaper, graphic, art, creative, modern, stylish, contemporary, curve, swirl, twisted, intertwined, flowing",8,2025-03-30
241990_5b027919-53c5-4b26-a206-f42c67a002da.jpg,"Fresh Fruit Still Life: Apples, Berries, Bananas and Oranges on a Wooden Table in a Bright Kitchen","Fresh Fruit Still Life: Apples, Berries, Bananas and Oranges on a Wooden Table in a Bright Kitchen","fruit, fresh fruit, healthy fruit, fruits, fresh fruits, healthy fruits, berries, fresh berries, raspberries, blueberries, blackberries, mixed berries, apples, red apples, green apples, bananas, citrus, oranges, produce, fresh produce, healthy produce, food, healthy food, ingredients, kitchen, table, wooden table, countertop, window, sunlight, daylight, still life, nutrition, diet, vitamins, healthy eating, well-being, vegetarian, vegan, raw, raw food, organic, natural, natural light, indoor, home, house, culinary, cuisine, close-up",7,2025-03-30
241988_9cf83fc7-a54c-418e-ada0-acda35bb6f8d.jpg,"Picturesque Meadow with Stream, Grassy Hills, and Flowers in Full Bloom on a Sunny Day","Picturesque Meadow with Stream, Grassy Hills, and Flowers in Full Bloom on a Sunny Day","meadow, stream, brook, creek, river, grass, grassland, pasture, verdant, foliage, greenery, flower, blossom, bloom, floral, pink flower, rural, countryside, idyllic, scenic, tranquil, serene, peaceful, sunlight, sunshine, daylight, hill, slope, bank, knoll, valley, dale, glen, landscape, environment, nature, outdoor, scenery, summer, spring, season, trees, foliage, clear sky, daytime, fresh, horizon, dreamy, AI generated",11,2025-03-30
241994_f2285088-841b-41e1-8d3a-c2ac5bb65f14.jpg,"Steaming cup of herbal tea on open book, with leaves scattered. A calming and serene still life","Steaming cup of herbal tea on open book, with leaves scattered. A calming and serene still life","tea, herbal tea, hot tea, cup of tea, tea leaves, loose leaf tea, tea time, beverage, hot beverage, drink, hot drink, glass cup, clear cup, glassware, book, open book, book pages, reading, writing, manuscript, literature, steam, vapor, aroma, warm, cozy, relaxing, relaxation, still life, table, tabletop, window, daylight, indoor, indoors, home, domestic, calming, peaceful, serene, herbs, natural, organic, healthy, wellness, antioxidant, afternoon tea, refreshment, transparent, close-up",7,2025-03-30
241996_38845811-75ae-42f2-990d-d3fa5241f4a5.jpg,Woman practices yoga pose outside in peaceful natural park at sunset,Woman practices yoga pose outside in peaceful natural park at sunset,"yoga, yoga pose, outdoor yoga, woman, female, adult, young adult, yogini, practice, exercise, fitness, wellness, well being, health, healthy, lifestyle, mindfulness, meditation, spiritual, tranquility, serenity, peace, peaceful, namaste, balance, body, nature, park, green, grass, tree, outdoors, sunlight, morning, summer, warm, natural light, relaxation, calm, asana, pose, stretch, flexible, strength, determination, serene, quiet, harmony, connection",18,2025-03-30
242001_cc600a8b-4431-4bf6-b4d8-b718444be061.jpg,"Aloe vera, glass of water with sunlight, wooden table. Concept for wellness, spa, healthy lifestyle. ","Aloe vera, glass of water with sunlight, wooden table. Concept for wellness, spa, healthy lifestyle. ","aloe vera, aloe, plant, succulent, herbal, medicine, natural, water, glass, drink, hydration, pure, clean, refreshment, still life, zen, wellness, spa, healthy, lifestyle, balance, harmony, stone, pebble, stack, tranquility, calm, nature, outdoors, sunlight, blur, background, wooden, table, liquid, transparent, botanical, flora, green, well-being, relaxation, therapy, minimal, simplicity, peace, summer, bright, day, garden, fresh",7,2025-03-30
241997_4ebbb2a2-1bca-4d56-840b-0bdc8d333ff4.jpg,"Invigorating Detox: Lemon Ginger Infusion with Ice, a Refreshing and Healthy Beverage.","Invigorating Detox: Lemon Ginger Infusion with Ice, a Refreshing and Healthy Beverage.","detox drink, refreshment, hydration, beverage, ginger, lemon, water, ice, slices, glass, citrus fruit, health, healthy, wellness, homemade, refreshing, cold, ingredient, food, sweet, tasty, tropical, raw, ripe, yellow, close-up, macro, shot, background, wooden, table, summer, cool, lifestyle, still life, transparent, juicy, nutrition, diet, vitamin, antioxidant, natural, nature, drink, healthcare, therapy, aroma, tea, nutritionist, kitchen",7,2025-03-30
242004_521e0d07-e6d2-4707-b6d5-650975d4656c.jpg,"Close-up of a Bright, Happy Smile on a Young Woman with Healthy White Teeth","Close-up of a Bright, Happy Smile on a Young Woman with Healthy White Teeth","smile, smiling, bright smile, happy, happiness, joy, joyful, woman, young woman, teeth, white teeth, healthy teeth, dental, dentistry, oral hygiene, lips, pink lips, glossy lips, face, facial, close-up, portrait, headshot, beauty, beautiful, skin, skincare, fresh, freshness, clean, cleanliness, person, caucasian, female, girl, lady, model, attractive, pretty, youth, young, positive, positivity, cheerful, well-being, lifestyle, natural light, outdoors, health",13,2025-03-30
242006_ace7b1ad-dd9c-4a6c-bade-97b456d74966.jpg,"Refreshing Fruit Juice Arrangement with Banana, Oranges, Apple, and Mint","Refreshing Fruit Juice Arrangement with Banana, Oranges, Apple, and Mint","fruit juice, juice, healthy juice, fruit drink, drink, beverage, glass of juice, fresh juice, natural juice, orange, orange fruit, orange slice, banana, yellow banana, apple, red apple, raspberry, mint, mint leaf, mint leaves, stone, stone base, table, tabletop, kitchen table, window, window light, sunlight, indoor, indoor plant, plant, healthy, healthy lifestyle, healthy eating, wellness, refreshment, refreshing, nutrition, nutritious, vitamin, ingredients, food photography, still life, still life photography, macro, close up, bright, vibrant, flora, botany",7,2025-03-30
242009_d4d472a8-7729-49d9-afe5-257fa8815919.jpg,"Fresh ingredients on a kitchen counter with raw meat, fruits, and vegetables on a bright tabletop","Fresh ingredients on a kitchen counter with raw meat, fruits, and vegetables on a bright tabletop","food, fresh food, ingredients, food ingredients, cooking, culinary, food preparation, cuisine, healthy, healthy eating, balanced diet, diet, nutrition, nutritious, produce, fresh produce, vegetables, fresh vegetables, fruits, fresh fruits, meat, raw meat, broccoli, orange, tomato, lettuce, pear, pepper, grains, kitchen, kitchen setting, kitchen interior, countertop, tabletop, window, daylight, natural light, still life, still-life, indoors, indoor, table, wooden table, cutting board, plants, kitchenware, nutrition concept, eating, well-being, food photography",7,2025-03-30
242011_66f5c53a-f5ca-4461-9430-f24519a50ffe.jpg,Serene Woman Meditating at Home with Plants in Sunlight-filled Room. Practicing Mindfulness for Wellbeing,Serene Woman Meditating at Home with Plants in Sunlight-filled Room. Practicing Mindfulness for Wellbeing,"woman, yoga, meditation, meditating, mindfulness, wellbeing, wellness, health, healthy, lifestyle, relaxation, calm, peace, peaceful, serene, serenity, home, indoors, interior, room, window, light, sunny, sunlight, plant, houseplant, green, flora, namaste, pose, portrait, brunette, hair, eyes closed, smile, smiling, tank top, hands, spiritual, spirituality, balance, exercise, fitness, zen, tranquil, tranquility, domestic, cheerful, joyful, content, carefree",12,2025-03-30
242021_dd5ee937-afa3-4db9-95a0-db0e42a575db.jpg,"Healthy Kiwi Smoothie with Mint on Wood Table by Window, Fresh Refreshing Drink","Healthy Kiwi Smoothie with Mint on Wood Table by Window, Fresh Refreshing Drink","kiwi smoothie, kiwi, smoothie, green smoothie, healthy smoothie, fresh smoothie, kiwi fruit, fruit smoothie, vegan smoothie, detox smoothie, homemade smoothie, natural smoothie, mint, mint leaves, leaf, leaves, drink, beverage, glass, fresh, refreshing, healthy, vegan, vegetarian, diet, nutrition, detox, antioxidant, vitamins, nutrients, raw, clean eating, superfood, wood, wooden, table, kitchen, food, close-up, macro, indoor, still life, wellness, lifestyle, plant, herbs, background, window, daylight",7,2025-03-30
242018_cd342f86-65d6-4ea5-9bc3-29f6576a26cc.jpg,Woman Enjoying Outdoor Meal with Salad and Beer at Sunset with Mountain Views,Woman Enjoying Outdoor Meal with Salad and Beer at Sunset with Mountain Views,"outdoor dining, outdoor meal, outdoor lunch, al fresco dining, al fresco meal, woman, female, girl, happy, smiling, table, picnic table, red checkered tablecloth, checkered tablecloth, tablecloth, food, meal, salad, fresh salad, healthy, healthy eating, beer, beer glass, glass of beer, mountains, mountain view, scenery, landscape, golden hour, sunset, fruits, vegetables, tomatoes, bananas, summer, vacation, travel, getaway, relaxation, leisure, lifestyle, enjoyment, cheerful, positive, appetizing, delicious, culinary, refreshment, garden party",7,2025-03-30
242014_e16eff36-ade2-4275-9e4d-3d6c7138c357.jpg,Vibrant Display of Fresh Fruits and Vegetables: A Celebration of Healthy Eating on Wooden Surface,Vibrant Display of Fresh Fruits and Vegetables: A Celebration of Healthy Eating on Wooden Surface,"fresh produce, fruit, vegetables, healthy eating, nutrition, wellness, diet, vitamins, antioxidants, colorful, variety, still life, food photography, culinary, ingredients, cooking, raw, natural, organic, farm fresh, locally grown, seasonal, ripe, juicy, delicious, tasty, nutritious, wholesome, goodness, vibrant, bright, freshness, garden, harvest, table, kitchen, broccoli, bananas, tomatoes, grapes, strawberries, orange, lemon, apple, pear, bell peppers, lettuce, parsley, vegetarian, vegan",7,2025-03-30
242022_8752c5a7-622b-4a03-9380-8885a08f3d1b.jpg,"Delicious food still life with tomatoes, carrots, grapes, shredded cheese and a refreshing beverage ","Delicious food still life with tomatoes, carrots, grapes, shredded cheese and a refreshing beverage ","food, cuisine, culinary, dish, meal, recipe, ingredients, preparation, presentation, arrangement, still life, tomatoes, tomato slices, tomato preparation, carrot, carrots preparation, pasta, shredded cheese, cheese, grapes, red grapes, fruits, mint, mint leaves, herbs, juice, fruit juice, orange juice, beverage, drink, healthy, fresh, slate, slate plate, kitchen, background, indoors, table, delicious, gourmet, tasty, appetizing, nutrition, food styling, close-up, arrangement, studio shot, daytime",7,2025-03-30
242028_3391aa6e-f995-403e-a2c9-779bde660715.jpg,"Colorful Microscopic Organisms: Bacteria, Viruses, and Cells Under the Microscope","Colorful Microscopic Organisms: Bacteria, Viruses, and Cells Under the Microscope","microscopic life, microscopic organisms, microbiology, bacterial culture, bacteria, bacterium, virus, viruses, microbe, microbes, microorganism, microorganisms, pathogen, pathogens, cell, cells, biology, scientific, biological, scientific research, medical, medicine, disease, infection, illness, germs, germ, health, healthcare, research, pharmaceutical, vaccine, vaccination, immunity, immune system, science, abstract, graphic, background, illustration, digital art, render, 3d, blue, bright, colorful, closeup, macro, artistic",16,2025-03-30
242031_1168b89e-9104-40e6-aa2e-3ee05b0ac83f.jpg,Dew-Kissed Spiderweb Among Dandelions in a Sunny Meadow,Dew-Kissed Spiderweb Among Dandelions in a Sunny Meadow,"spiderweb, cobweb, web, dew, dewdrops, water drops, nature, natural, outdoors, dandelion, dandelions, flower, flowers, flora, field, meadow, grass, greenery, leaf, leaves, plant, plants, summer, spring, season, seasonal, sun, sunlight, morning, macro, close-up, detail, intricate, pattern, background, backdrop, texture, delicate, fragile, environment, botany, botanical, growth, vibrant, fresh, rural, scenic, beauty, beautiful",5,2025-03-30
242033_4292a34e-e652-4a2a-ab61-148301383d2e.jpg,Futuristic Cityscape with Modern Architecture and Waterfront Skyline under a Bright Blue Sky,Futuristic Cityscape with Modern Architecture and Waterfront Skyline under a Bright Blue Sky,"futuristic city, cityscape, modern architecture, skyline, urban landscape, future, buildings, skyscrapers, waterfront, city view, architectural design, metropolis, blue sky, clouds, innovation, development, urban planning, city living, futuristic design, contemporary architecture, modern cityscape, future city, tall buildings, cloudscape, water, reflections, bright, daytime, city district, metropolitan area, downtown, urban scene, sky, urban environment, town, future world, business district, city lights, water reflection, architecture, modern buildings, exterior, high-rise, real estate, modern, commercial, property, financial district, city center",11,2025-03-30
242037_24950f65-af71-4825-bb78-072143e62bff.jpg,"Woman's Hands Holding Bowl of Fresh Strawberries, Raspberries, and Blueberries on a Wooden Table","Woman's Hands Holding Bowl of Fresh Strawberries, Raspberries, and Blueberries on a Wooden Table","berries, mixed berries, fresh berries, berry mix, strawberries, raspberries, blueberries, strawberry, raspberry, blueberry, fruit, fresh fruit, bowl, bowl of fruit, fruit bowl, hand, holding, hands holding, healthy, healthy food, healthy eating, healthy lifestyle, nutrition, superfood, antioxidants, vitamins, delicious, tasty, sweet, organic, vegan, vegetarian, snack, dessert, wooden table, table, closeup, macro, food photography, still life, summer, spring, breakfast, ingredient, raw food, natural, culinary, recipe, diet",7,2025-03-30
242040_a4388205-157a-4350-8410-884242400463.jpg,"Idyllic River Landscape with Greenery, Wildflowers, and Rolling Hills Under a Blue Sky","Idyllic River Landscape with Greenery, Wildflowers, and Rolling Hills Under a Blue Sky","river, riverbank, riverside, stream, water, flowing water, clear water, clean water, nature, landscape, scenery, greenery, grass, grassy, grassland, wild grass, wildflowers, daisies, wild daisies, hills, rolling hills, sky, blue sky, clouds, trees, foliage, green trees, fresh, outdoors, daylight, daytime, sunny, sunlight, light, bright, summer, spring, idyllic, peaceful, serene, quiet, calm, relaxation, environment, natural, flora, rural, countryside, vista",11,2025-03-30
242032_9332a925-a84e-4b9a-a11c-163260446a30.jpg,Viral Infection: Microscopic View of Pathogens Infecting Cells,Viral Infection: Microscopic View of Pathogens Infecting Cells,"virus, viruses, viral, infection, microscopic, microbiology, virology, pathogen, pathogens, disease, illness, contagion, pandemic, epidemic, coronavirus, flu, influenza, cold, sickness, cells, cell, microorganism, microorganisms, bacteria, bacterium, immune system, immunity, vaccine, medical, medicine, research, science, healthcare, biology, scientific, closeup, anatomy, membrane, surface, structure, 3d, render, rendering, illustration, abstract, art, pink, red, background, health",16,2025-03-30
242036_bdc1beba-f0e8-47a2-8335-30b2311ff915.jpg,"Invigorating Lemon Water, Fresh Towels, and Indoor Plant in a Naturally Lit, Calm Spa Setting","Invigorating Lemon Water, Fresh Towels, and Indoor Plant in a Naturally Lit, Calm Spa Setting","lemon water, infused water, detox water, healthy drink, refreshing drink, hydration, glass of water, lemon slices, citrus fruit, water, clean towels, fresh towels, folded towels, stack of towels, white towels, soft towels, spa towels, bathroom towels, laundry, textile, plant, houseplant, green leaves, indoor plant, window, natural light, sunlight, curtains, home decor, interior, room, table, wicker basket, still life, relaxation, wellness, health, lifestyle, refreshment, simple, minimalist, bright, airy, calm, domestic, daylight, indoors, neutral colors, well-being",12,2025-03-30
242042_ff2401f9-f173-4fc4-996c-f42b6f8c70db.jpg,"Nutritious Still Life: Oatmeal Bowls, Fresh Fruits and Vegetables on Rustic Wooden Table","Nutritious Still Life: Oatmeal Bowls, Fresh Fruits and Vegetables on Rustic Wooden Table","healthy, wellness, well-being, wholesome, nutritious, nutrition, nourishment, balanced diet, diet, food, food and drink, still life, still life photography, oatmeal, rolled oats, oats, cereal, grain, fruit, fruits, fresh fruit, apples, red apples, pears, fresh pears, oranges, fresh oranges, grape, grapes, red grapes, cherry, cherries, fresh cherries, broccoli, vegetables, greens, leaves, leafy, wooden, table, rustic, wooden table, wooden surface, background, backdrop, flora, ingredient, ingredients, macro, close-up",7,2025-03-30
242045_aad71ebb-e2f6-45b1-b876-530e42008bb5.jpg,Human Anatomy Diagram Featuring Internal Organs Including Digestive System,Human Anatomy Diagram Featuring Internal Organs Including Digestive System,"human anatomy, human body, body, internal organs, anatomy, organs, biological, biology, human, internal, medicine, health, healthcare, medical, science, scientific, digestive system, digestive, system, brain, esophagus, stomach, intestines, colon, small intestine, organ system, physiology, physiological, illustration, diagram, graphic, cutout, cut-out, medical illustration, scientific illustration, education, educational, learning, teaching, study, healthcare concept, medical concept, scientific concept, concept, healthcare design, medical design, design, background, copy space",16,2025-03-30
