Filename,Title,Description,Keywords,Category,Release(s)
232397_7172a12d-c9a8-45cd-9fbf-88f89370bddb.jpg,"Elegant Ballerina Performing Gracefully Under a Spotlight, Dance, Art, and Beauty in Motion","Elegant Ballerina Performing Gracefully Under a Spotlight, Dance, Art, and Beauty in Motion","ballerina, ballet dancer, ballet, dance, dancer, performance, stage, classical, grace, elegance, art, artistic, studio, pose, young, woman, female, tutu, dress, pointe shoes, shoes, costume, skill, training, practice, rhythmic, movement, beautiful, beauty, figure, body, gymnastics, flexible, balance, strength, health, lifestyle, leisure, fun, indoors, spotlight, lighting, shadow, classic, fashion, professional, artist, talent, performance art",18,2025-03-27
232410_6169960b-0dfb-4441-8db8-4ed87b3e0798.jpg,Anatomical illustration of a spine in blue lighting highlighting health and human skeletal system,Anatomical illustration of a spine in blue lighting highlighting health and human skeletal system,"human anatomy, anatomy, body, spine, spinal cord, backbone, vertebrae, vertebral column, human body, skeletal system, skeleton, medical, medicine, health, healthcare, science, biology, osteology, chiropractic, orthopedics, radiology, diagnosis, treatment, therapy, research, education, illustration, diagram, x-ray, scan, 3d rendering, render, graphic, design, visualization, scientific, laboratory, clinical, anatomical, lumbar, thoracic, cervical, sacrum, coccyx, structure, detail, information, educational, study, blueprint",16,2025-03-27
232398_9650eaf7-7f5f-4f9e-a3f0-931cfff530d8.jpg,Detailed microscopic view of a nerve cell transmitting electrical impulses.,Detailed microscopic view of a nerve cell transmitting electrical impulses.,"neuron, nerve cell, nerve, neural, brain, cell, microscopic, biology, science, medicine, medical, research, healthcare, anatomy, physiology, synapse, dendrite, axon, nerve impulse, neuroscience, neurology, nervous system, spinal cord, cerebral, cerebellum, brainstem, neuron structure, neuron function, cell body, nodes of ranvier, myelin sheath, neural network, brain activity, brain cell, cognitive function, synaptic transmission, neurotransmitter, brain health, neural communication, nervous system function, cellular biology, cellular structure, close up, abstract, detailed, illustration, scientific, background, macro",16,2025-03-27
232401_aed7a385-afab-4daa-a376-d4892ccc547b.jpg,"Close-up of Microscopic Cells: Biological, Scientific, and Medical Rendering","Close-up of Microscopic Cells: Biological, Scientific, and Medical Rendering","cell, cells, cellular, microscopic, microscopic view, biology, biological, science, scientific, medical, medicine, research, biotechnology, biotech, laboratory, lab, disease, illness, infection, virus, viruses, bacterium, bacteria, pathogen, pathogens, immunology, immunological, virology, virological, microbiology, microbiological, healthcare, health, anatomy, tissue, organ, body, human, abstract, pattern, structure, closeup, macro, pink, orange, sphere, spherical, round, rendering, 3d, model",16,2025-03-27
232400_0d32a0e1-14d8-428d-bff8-97da7e806339.jpg,Athletic Surfer Riding Ocean Wave on Sunny Day: Experiencing Tropical Watersport Adventure,Athletic Surfer Riding Ocean Wave on Sunny Day: Experiencing Tropical Watersport Adventure,"surfer, surfing, wave, ocean, sea, water, surfboard, sports, man, male, athlete, activity, summer, tropical, travel, vacation, recreation, adventure, lifestyle, nature, outdoors, sky, sun, sunny, day, blue, aqua, turquoise, sea wave, ocean wave, water sport, extreme sport, action, motion, energy, power, balance, skill, strength, healthy, fitness, exercise, holiday, shore, coast, coastal, seascape, island, tropical island, paradise",18,2025-03-27
232422_183385b2-e28c-4b4c-b6ca-929559076a1c.jpg,Woman's feet relaxing with spa stones in water for a wellness and relaxation retreat.,Woman's feet relaxing with spa stones in water for a wellness and relaxation retreat.,"feet, foot, stones, spa stones, massage stones, hot stones, black stones, smooth stones, water, aqua, clear water, clean water, wellness, well being, self-care, pedicure, nails, toes, relaxation, relaxing, calm, tranquil, serene, therapy, massage, spa, body care, beauty, beautiful, skincare, healthcare, treatment, zen, lifestyle, close-up, macro, detail, indoor, indoors, health, human, caucasian, female, woman, girl, young, elegant, cool, warm, stone arrangement",12,2025-03-27
232425_582aaa1a-f60a-4322-8990-06e10c2c6bc0.jpg,"Strong Woman Doing Squats in Gym: Athletic Female Focused on Fitness, Strength Training and Intense Workout","Strong Woman Doing Squats in Gym: Athletic Female Focused on Fitness, Strength Training and Intense Workout","athletic, athlete, fitness, exercise, workout, gym, training, bodybuilding, strength, power, squat, squats, woman, female, model, muscular, strong, healthy, lifestyle, sport, sports, active, determination, motivation, effort, commitment, goal, discipline, intensity, focus, concentration, indoors, gym interior, fitness center, weight training, strength training, personal trainer, exercise equipment, wellness, well-being, health, body, physical fitness, tone, toned, fit, body shape, portrait, determined, serious",18,2025-03-27
232435_0d3f773e-9e40-4816-ba48-ba6a1da1569e.jpg,"Radiant abstract background with flowing lines in harmonious teal and gold hues, bursting with energy and light.","Radiant abstract background with flowing lines in harmonious teal and gold hues, bursting with energy and light.","abstract, modern, contemporary, art, design, background, illustration, artistic, graphic, artwork, texture, element, style, backdrop, wallpaper, bright, creative, decorative, concept, detail, fantasy, futuristic, wave, line, pattern, curve, swirl, ripple, energy, motion, light, glowing, radiant, flare, burst, sparkle, vibrant, dynamic, colorful, smooth, gradient, dreamy, ethereal, spiritual, calming, serene, fluid, celestial, aura, illumination",8,2025-03-27
232441_82d54ce8-c245-4279-83b5-0791f2d53a5c.jpg,Fitness Training: Woman Running on Beach at Sunrise. Athletic Female Exercising Outdoor. Wellness Concept,Fitness Training: Woman Running on Beach at Sunrise. Athletic Female Exercising Outdoor. Wellness Concept,"running, run, runner, jogging, jog, athlete, athletic, exercise, fitness, workout, training, cardio, sunrise, sunset, morning, evening, beach, shore, coast, ocean, sea, sand, water, legs, foot, feet, shoes, sneakers, sport, activity, active, lifestyle, healthy, well-being, wellness, outdoors, nature, person, woman, female, health, motivation, inspiration, determination, strength, power, energy, vitality, vacation, travel",18,2025-03-27
232442_536f05fd-0bef-431a-b37f-9ed1e714a4f1.jpg,"Relaxing Soak in Geothermal Lagoon: Serene water, misty mountains, & rejuvenating mineral waters","Relaxing Soak in Geothermal Lagoon: Serene water, misty mountains, & rejuvenating mineral waters","legs, feet, water, geothermal, hot spring, spring, pool, landscape, lagoon, lake, blue, turquoise, azure, relax, relaxation, wellness, travel, tourism, vacation, journey, wanderlust, scenic, destination, outdoors, nature, mist, fog, steaming, foggy, atmospheric, cloudy, mountains, rocks, cliff, volcanic, basalt, lava, moss, algae, minerals, sulfur, silica, therapeutic, healing, calm, peaceful, rejuvenation, escape, solitude, tranquility",21,2025-03-27
232427_1eeb5957-a28f-4d51-8afe-e26faa76eed8.jpg,"Close-up of Hands Shaping Clay for Art Project, Crafting Pottery in Studio, Creating Ceramics","Close-up of Hands Shaping Clay for Art Project, Crafting Pottery in Studio, Creating Ceramics","clay, clay modeling, modeling clay, ceramics, ceramic, pottery, handcraft, handcrafts, craft, crafts, handmade, art, arts, sculpture, sculpting, sculptor, artist, artwork, creative, creation, create, hobby, hobbies, leisure, activity, activities, hands, finger, fingers, woman, female, person, people, workshop, studio, table, surface, gray, grey, beige, indoor, indoors, closeup, macro, detail, skills, skill, pastime, relaxation, relaxing",9,2025-03-27
232459_14d4b5de-c0c1-4395-a13e-c5b8ee8663c9.jpg,"Athletic Man with Muscular Physique Training, Bodybuilding and Fitness in Gym, Sport and Healthy Lifestyle","Athletic Man with Muscular Physique Training, Bodybuilding and Fitness in Gym, Sport and Healthy Lifestyle","bodybuilding, bodybuilder, muscle, muscular, fitness, workout, gym, exercise, training, strength, strong, power, powerful, athlete, athletic, man, male, torso, biceps, portrait, determined, determination, intense, intensity, serious, face, body, health, healthy, lifestyle, sport, sports, gymnasium, indoor, indoors, weight, weights, lifting, bench, human, adult, caucasian, european, young, shorts, apparel, clothing, equipment, contemporary, modern",18,2025-03-27
232461_baf563af-8761-4b16-bc93-38383b8dd34f.jpg,"Female Ballet Dancer Mid-Air Performing a Leap in the Studio, showcasing grace, skill, and athleticism","Female Ballet Dancer Mid-Air Performing a Leap in the Studio, showcasing grace, skill, and athleticism","dancer, ballerina, ballet dancer, ballet, dance, dancing, performance, performing, art, artistic, artist, graceful, elegance, grace, elegant, professional, studio, young woman, woman, female, jump, jumping, leaping, leap, fly, flying, raised arms, arm, pose, movement, motion, body, figure, classical, modern, contemporary, pointe shoes, shoes, white, background, skill, skilled, performer, creative, indoor, slim, fit, strength, strong, sport, training",13,2025-03-27
232463_c845ad4a-ba59-4908-bd75-c12ae143a65f.jpg,Woman in Goddess Pose Practicing Yoga at Home with Sunlight Streaming Through the Windows. ,Woman in Goddess Pose Practicing Yoga at Home with Sunlight Streaming Through the Windows. ,"yoga, yogi, yoga pose, yoga posture, yoga mat, pose, posture, fitness, exercise, workout, wellness, well being, health, healthy, lifestyle, indoors, home, woman, female, person, adult, arms raised, arms up, back view, sunlight, sunshine, light, window, room, interior, plant, houseplant, relaxation, mindfulness, calm, serene, tranquil, peaceful, balance, strength, body, studio shot, sport, training, spiritual, zen, floor, apartment, well-being",18,2025-03-27
232464_6ccb36a7-6e5d-4d2f-8d0e-f74f4258509a.jpg,"Female Gymnast Performing Floor Exercise with Arms Outstretched, Back View, Leaping for Balance and Artistry","Female Gymnast Performing Floor Exercise with Arms Outstretched, Back View, Leaping for Balance and Artistry","gymnastics, gymnast, artistic gymnastics, female gymnast, woman gymnast, gymnastic, athletic, acrobatic, gym, gymnasium, athlete, woman, female, sport, sports, exercise, workout, training, competitive, competition, arena, balance, strength, skill, motion, jump, jumping, leap, leaping, floor exercise, performance, performing, art, artistic, uniform, leotard, activewear, studio, indoor, audience, spectators, coach, arms outstretched, back view, rear view, determination, focus, dedication, discipline, talent",18,2025-03-27
232466_4b124a62-8968-4868-8c42-ebef4e9343da.jpg,"Soccer Player Ready to Kick Ball on Field in Stadium. Sports, action and competition on vibrant grass.","Soccer Player Ready to Kick Ball on Field in Stadium. Sports, action and competition on vibrant grass.","soccer, football, soccer player, football player, athlete, sports, team sport, ball, soccer ball, football ball, stadium, grass, field, game, match, competition, action, sportswear, cleats, uniform, socks, goal, kick, player, legs, crowd, audience, arena, outdoors, daytime, professional, championship, tournament, event, exercise, physical activity, training, practice, skill, agility, strength, fitness, health, wellness, lifestyle, recreation, leisure, activity, challenge, success",18,2025-03-27
232467_9ddf6712-0506-49b9-b2e9-c4c0e71ba59b.jpg,Athlete on Bench with Ankle Support: Injury Recovery and Fitness Training at the Gym,Athlete on Bench with Ankle Support: Injury Recovery and Fitness Training at the Gym,"ankle support, ankle brace, foot support, foot brace, injury, treatment, recovery, athletic, gym, exercise, workout, fitness, sports, training, athlete, gymnasium, weightlifting, dumbbells, bench, sitting, barefoot, human foot, skin, toe, short pants, abdomen, torso, male, man, body, health, wellness, healthcare, physical therapy, rehabilitation, protection, pain relief, muscles, strength, determination, confidence, well-being, active lifestyle, healthy lifestyle, gym equipment, training equipment, exercise equipment, indoor, studio, neutral background",18,2025-03-27
232468_1cd7b4a2-b289-465b-8a5e-210ec0cee6ac.jpg,Elegant Ballerina's Performance: Graceful Dance on Stage for Spectators,Elegant Ballerina's Performance: Graceful Dance on Stage for Spectators,"ballerina, ballet dancer, ballet performer, ballet, dance, dancing, stage, performance, theater, theatre, audience, spectators, classical, elegance, grace, graceful, art, artistic, culture, cultural, entertainment, entertainment event, show, skill, professional, pointe shoes, tutu, costume, dress, spotlight, lighting, back view, woman, female, young woman, studio shot, indoor, harmony, motion, movement, rhythm, position, pose, arms raised, hand gestures, art form, artistic expression, theatrical, venue",13,2025-03-27
232404_a1b269cb-d116-4717-9705-cc5d7ce0b292.jpg,"Gentle abstract 3D wave pattern in blue and pink. Modern, smooth background rendering for design and decoration","Gentle abstract 3D wave pattern in blue and pink. Modern, smooth background rendering for design and decoration","abstract, wave, wavy, waves, smooth, 3D, three dimensional, render, rendering, background, backdrop, texture, pattern, illustration, design, graphic, art, artistic, gradient, color gradient, colorful, modern, futuristic, digital, digital art, wallpaper, backdrop, decorative, decoration, presentation, template, banner, poster, website, landing page, mockup, cover, backdrop, shape, curve, illustration, soft, light, bright, clean, simple, elegant, style, surface",8,2025-03-27
232476_deb477d8-a794-4d99-aba6-bbdb2dd82713.jpg,"Minimalist cosmetic products: skincare cream, lotion, and oil on a gray background","Minimalist cosmetic products: skincare cream, lotion, and oil on a gray background","cosmetics, cosmetic, skincare, skin care, beauty, beauty product, beauty products, cream, face cream, body cream, moisturizer, lotion, face lotion, body lotion, essential oil, face oil, body oil, serum, skin serum, face serum, cosmetic jar, cream jar, oil bottle, lotion bottle, spray bottle, minimalist, minimal, modern, wellness, well-being, spa, aromatherapy, natural, organic, homemade, do it yourself, diy, bowl, container, product, still life, gray background, grey background, studio shot, indoors, inside, shadow, daylight, day, facial",12,2025-03-27
232437_45b4f650-c3de-4317-bdbe-59628369cd4b.jpg,Fresh Salmon Slices with Vegetables on a Cutting Board: Healthy Eating Still Life,Fresh Salmon Slices with Vegetables on a Cutting Board: Healthy Eating Still Life,"salmon, raw salmon, fresh salmon, fish, raw fish, fresh fish, food, raw food, fresh food, seafood, healthy food, healthy eating, nutrition, balanced diet, diet, lettuce, leafy greens, green leaf, salad, salad greens, lemon, citrus, citrus fruit, tomato, red tomato, cherry tomato, apple, red apple, fruit, fresh fruit, onion, red onion, purple onion, vegetable, fresh vegetable, parsley, herb, walnuts, nuts, wooden board, cutting board, wooden table, table, still life, still-life, cuisine, ingredient, ingredients, close-up",7,2025-03-27
232477_9bc1f022-df04-47f2-938d-1e0fe71c634c.jpg,"Close-up of bare female feet on white textile, showcasing clean skin and well-groomed toenails.","Close-up of bare female feet on white textile, showcasing clean skin and well-groomed toenails.","feet, foot, barefoot, toes, toenails, pedicure, skin, smooth skin, clean, beauty, care, personal care, closeup, health, wellness, body, female, woman, legs, soft, cleanliness, hygiene, fresh, relaxation, spa, massage, well-being, self-care, moisturized, healthy, dermatology, textile, fabric, white, background, texture, macro, detail, minimal, simple, light, shadow, tone, natural, aesthetic, human, anatomy, nail, cut",12,2025-03-27
232481_f33e1b8d-4b9b-4e6f-b6f0-47757d70cf40.jpg,Soaking Feet in Floral Water for Relaxation and Pedicure at Home Spa,Soaking Feet in Floral Water for Relaxation and Pedicure at Home Spa,"foot soak, foot bath, pedicure, foot care, skin care, spa, wellness, relaxation, self-care, beauty, woman, feet, toes, nails, water, bowl, flower petals, petals, flowers, candles, aroma, fragrant, wooden, domestic, closeup, treatment, beauty treatment, well-being, health, healthy, lifestyle, personal care, female, natural, cosmetics, aromatherapy, zen, calm, soothing, pampering, indulgence, hygiene, clean, fresh, home, indoors, table, photography, studio",12,2025-03-27
232483_ad9c9e41-3c24-4e18-8a84-eac429ffc9cd.jpg,Smiling Senior Man Enjoying Water Therapy in Indoor Swimming Pool for Health and Relaxation,Smiling Senior Man Enjoying Water Therapy in Indoor Swimming Pool for Health and Relaxation,"senior man, elderly man, older man, aged man, mature man, senior, elderly, older, aged, mature, man, male, pool, swimming pool, indoor pool, water, swimming, relaxation, leisure, active lifestyle, health, wellness, exercise, aquatic exercise, water exercise, therapy, hydrotherapy, rehabilitation, portrait, close-up, face, head, shoulders, gray hair, white hair, beard, smile, happy, cheerful, relaxed, indoors, daytime, calm, clear water, healthy lifestyle, well-being, aqua, retirement, recreation",13,2025-03-27
232485_380b2583-6237-4472-8bce-cf704722757d.jpg,Joyful Preschoolers Play Together with Colorful Balls in Bright Classroom during Playtime (99 char),Joyful Preschoolers Play Together with Colorful Balls in Bright Classroom during Playtime (99 char),"children, kids, childhood, preschool, daycare, kindergarten, early learning, preschoolers, toddlers, cute, adorable, happy, joyful, smiling, laughing, playing, playtime, learning, education, development, colorful, bright, vibrant, toys, balls, plastic balls, indoor, classroom, daylight, diversity, group, togetherness, friendship, interaction, activity, fun, childcare, nursery, developmental, creative, discovery, playgroup, youth, school, pre-k, elementary, students, young, innocence, happiness",13,2025-03-27
232487_7f271b75-1755-42f1-a24a-ef4f63307a99.jpg,"Group of Mature People Practicing Yoga and Meditation for Well-Being, Peaceful and Relaxing","Group of Mature People Practicing Yoga and Meditation for Well-Being, Peaceful and Relaxing","yoga, yoga class, meditation, group meditation, mindfulness, well-being, wellness, healthy lifestyle, exercise, fitness, men, women, group of people, indoors, studio, yoga mat, gym, training, workout, pose, posture, balance, serenity, relaxation, mental health, concentration, focus, spiritual, mind, body, health, lifestyle, activity, active, togetherness, unity, harmony, calmness, peace, peaceful, practice, adult, contemporary, sport, leisure, center, sitting, cross-legged, barefoot, floor",18,2025-03-27
232488_a7599c27-e1af-44a0-86dc-a042f3c6a9a1.jpg,Trail Runner's Shoes on a Mountain Path during a Sunny Day with Mountain Scenery,Trail Runner's Shoes on a Mountain Path during a Sunny Day with Mountain Scenery,"trail running, mountain running, outdoor fitness, mountain trail, mountain path, trail path, running shoes, trail shoes, hiking shoes, athletic shoes, outdoor shoes, sports shoes, active lifestyle, healthy lifestyle, outdoor activity, fitness activity, mountain landscape, mountain scenery, scenic view, nature trail, nature path, wilderness, backcountry, adventure, exploration, trekking, hiking, legs, calf muscles, human legs, lower body, leg muscles, athlete, runner, jogger, exercising, exerciser, training, fitness, health, wellness, well-being, outdoors, daytime, daylight, sunny, pathway, foothill, foots, footgear",18,2025-03-27
232489_ce095927-058a-4937-8c6f-52570e5ab428.jpg,Hydrotherapy session: Woman Walking Barefoot in Pool for Aquatic Rehabilitation and Physical Therapy,Hydrotherapy session: Woman Walking Barefoot in Pool for Aquatic Rehabilitation and Physical Therapy,"hydrotherapy, aquatic therapy, water therapy, therapeutic exercise, rehabilitation, physical therapy, aquatic rehabilitation, pool therapy, exercise pool, swimming pool, water exercise, hydro, aquatic, water, therapy, rehab, pool, exercises, physical, barefoot, feet, foot, walking, walker, woman, patient, health, healthcare, medical, wellness, treatment, recovery, hydrotherapy pool, aquatic center, rehabilitation center, hospital, clinic, indoor, inside, equipment, stainless steel, handrail, grab bar, modern, clinical, clean, light, blue, tile, tiled, person",12,2025-03-27
232492_68054c4c-890c-46e7-a182-7e78e5244f85.jpg,Colorful Medical Illustration of a Human Foot Anatomy with Bones Structure and Joints on a Blue Background,Colorful Medical Illustration of a Human Foot Anatomy with Bones Structure and Joints on a Blue Background,"foot, anatomy, medical, human, structure, biology, science, body, bone, leg, health, skeletal, system, joint, illustration, diagram, organ, healthcare, part, detail, internal, cross section, section, segment, member, cellular, tissue, biological, scientific, medicine, anatomical, osteology, morphology, clinic, healthcare, tibial, fibula, tibia, talus, calcaneus, navicular, cuboid, cuneiform, metatarsal, phalanx, skeleton, foot bones, body part, sketch, graphic",16,2025-03-27
232493_656fe2b0-ad4b-4ae8-a2f6-fdfeeff773d6.jpg,Woman bonding with her horse in a golden field at sunset. A serene moment of friendship and connection.,Woman bonding with her horse in a golden field at sunset. A serene moment of friendship and connection.,"horse, equine, mare, stallion, animal, domestic animal, livestock, mammal, woman, girl, person, human, female, friendship, bond, connection, care, tenderness, affection, outdoor, outdoors, meadow, field, grassland, pasture, rural, countryside, sunset, sunrise, golden hour, warm light, scenic, landscape, nature, equestrian, equestrianism, riding, horse riding, farm, ranch, agriculture, lifestyle, leisure, recreation, relaxation, peace, calm, tranquility, serenity, portrait",1,2025-03-27
232496_06c4e7be-92d5-4816-885c-ca9ca65c0ca8.jpg,"Abstract Fluid Art Painting with Gold Glitter Highlights in Blue, Green, and Yellow Hues","Abstract Fluid Art Painting with Gold Glitter Highlights in Blue, Green, and Yellow Hues","abstract, abstract art, fluid art, fluid acrylic, alcohol ink, ink, acrylic, paint, painting, backdrop, background, modern, modern art, contemporary, contemporary art, design, art design, graphic, graphic design, texture, textured, artistic, illustration, watercolor, colorful, colourful, blue, light blue, dark blue, green, yellow, gold, golden, glitter, shiny, shimmering, wave, waves, wavy, flow, flowing, ripple, rippling, curves, streaks, swirl, swirling, ornate, elegant, artwork",8,2025-03-27
232497_9873bca3-7970-44be-882d-1dda17dc7f53.jpg,"Group of women enjoying an art class, painting together in a creative workshop, fostering teamwork and friendship","Group of women enjoying an art class, painting together in a creative workshop, fostering teamwork and friendship","art class, painting class, art workshop, painting workshop, art studio, paint studio, art lesson, paint lesson, art instruction, paint instruction, art course, paint course, group activity, creative activity, artistic activity, social activity, art project, paint project, team building, leisure activity, recreational activity, hobby, artwork, art, paint, painting, artist, painter, canvas, easel, brush, paint brush, paint palette, color, colorful, women, friends, diversity, collaboration, teamwork, indoor, indoors, classroom, workshop, studio, happy, smiling, laughing, fun, enjoyment",12,2025-03-27
232499_1448d5ed-7f07-4f3f-aa13-3c97d25a0e6d.jpg,Athletic Woman Doing Squats on Mat Indoors in Gym in Sportswear,Athletic Woman Doing Squats on Mat Indoors in Gym in Sportswear,"woman, sporty, athletic, fitness, exercise, workout, training, gym, active, lifestyle, healthy, wellness, strong, muscular, body, female, adult, people, person, fit, athlete, gymwear, sportswear, leggings, sports bra, shoes, sneakers, yoga, mat, studio, indoors, squatting, squat, pose, looking away, determined, concentration, health, wellbeing, physical activity, cardio, strength, bodybuilding, toned, exercise mat, sport, working out, train, gym session",18,2025-03-27
232500_b50ec74b-c88a-4904-a2cf-c00ced983c13.jpg,Smiling senior woman hiking on a trail in the mountains during a sunny day.,Smiling senior woman hiking on a trail in the mountains during a sunny day.,"woman, female, senior woman, senior female, elderly woman, elderly female, older woman, older female, hike, hiking, trek, trekking, walk, walking, outdoor activity, outdoor recreation, adventure, travel, traveling, traveler, mountains, mountain range, mountain landscape, mountain peak, mountain scenery, scenery, landscape, nature, backpack, backpacking, rucksack, daypack, trekking poles, walking sticks, hat, sun hat, outfit, clothing, sportswear, activewear, smile, smiling, happiness, happy, sunlight, daylight, sunny, hillside, grassland, meadow",21,2025-03-27
