Filename,Title,Description,Keywords,Category,Release(s)
233672_4b4504e8-59fa-493a-ae87-d7d8abb4e06d.jpg,"Close-up of Green Leaf with Water Droplets in Sunlight, Capturing Natural Beauty and Tranquility ","Close-up of Green Leaf with Water Droplets in Sunlight, Capturing Natural Beauty and Tranquility ","leaf, leaves, green leaf, green leaves, leaf with water drops, foliage, plant, plants, droplet, water droplets, water drop, dew, dewdrop, nature, natural, environment, close up, macro, fresh, vibrant, growth, botany, botanical, flora, floral, veins, leaf veins, texture, detail, macro photography, clear, clean, purity, transparent, sunlight, sun, garden, forest, outdoor, spring, summer, life, organic, eco, ecology, background, wallpaper, calm, serene, tranquil",14,2025-03-27
233705_f175a7f7-e5ca-4658-9aa4-6713b73af61e.jpg,Beautiful woman sleeping peacefully on a cloud under a starry night sky,Beautiful woman sleeping peacefully on a cloud under a starry night sky,"sleeping, sleep, dreaming, dream, dreamy, woman, girl, female, young woman, young girl, beautiful woman, pretty woman, lying down, cloud, clouds, sky, night sky, starry sky, stars, celestial, space, fantasy, ethereal, calm, tranquil, peaceful, serene, relaxation, relaxing, rest, resting, night, good night, sweet dreams, bedroom, soft, cozy, comfortable, bed, bedtime, pajamas, nightwear, gown, heaven, angel, divine, spiritual, meditation, wellness, well being",13,2025-03-27
233709_74312472-c248-42ed-b43c-3a11405c4d21.jpg,Glass of Milk and Sleep Mask on Nightstand for Bedtime Relaxation,Glass of Milk and Sleep Mask on Nightstand for Bedtime Relaxation,"glass of milk, milk, dairy, drink, beverage, sleep mask, eye mask, bedtime, nighttime, sleep, rest, relax, bedroom, bed, pillows, sheets, comfort, cozy, warm, soft, calm, peaceful, tranquil, serene, quiet, evening, night, table lamp, lamp, light, furniture, nightstand, table, tray, inside, indoors, still life, health, wellness, nutrition, refreshment, drinkable, lifestyle, domestic, home, apartment, hotel, vacation, getaway",7,2025-03-27
233714_4edbaeff-5691-43d4-8459-7b6cb3b3730a.jpg,"Serene bedroom interior with modern design, a city view, and a hanging mobile of moon, stars, clouds, and feathers","Serene bedroom interior with modern design, a city view, and a hanging mobile of moon, stars, clouds, and feathers","bedroom, interior, design, modern, apartment, city view, window, furniture, luxury, urban, architecture, stylish, contemporary, night, home, decor, lighting, cozy, carpet, lamp, bed, pillow, blanket, art, mobile, moon, stars, clouds, feathers, dream catcher, silhouette, wall, curtains, armchair, books, plants, sunset, evening, building, skyscraper, dusk, soft, elegant, comfortable, serene, chill, domestic, indoor, nobody",2,2025-03-27
233710_6b0727d9-7909-4d81-882a-d1507b58fee9.jpg,"Peaceful sleep: serene redhead woman rests comfortably in bed, bathed in soft morning light","Peaceful sleep: serene redhead woman rests comfortably in bed, bathed in soft morning light","sleeping, sleep, asleep, rest, resting, nap, napping, woman, female, girl, young woman, dream, dreaming, bedroom, bed, bedtime, morning, wake up, waking up, cozy, comfort, comfortable, relaxation, relax, peaceful, serene, quiet, redhead, red hair, ginger hair, hair, pillow, soft, blanket, sheets, white, blue, bedroom decor, window, curtains, light, daylight, indoor, indoors, lifestyle, wellness, well being, health, healthy, home",12,2025-03-27
233706_0d9a38b0-2641-4ff2-8554-6b703b4e4d5c.jpg,Relaxed ginger tabby cat sweetly sleeps on a soft blanket with bokeh lights illuminating background.,Relaxed ginger tabby cat sweetly sleeps on a soft blanket with bokeh lights illuminating background.,"cat, kitten, kitty, feline, domestic cat, pet, animal, mammal, cute, sleeping, sleep, nap, dreaming, relaxed, relaxation, cozy, comfortable, soft, ginger cat, tabby cat, orange tabby, striped cat, furry, fur, portrait, close-up, indoors, domestic animal, resting, content, peaceful, calm, warm, blanket, textile, bokeh, lights, illumination, blurred, background, home, house, adorable, domesticated, companion, friend, affectionate, loving, sweet, small cat",1,2025-03-27
233716_4904a591-4664-4469-b2ea-09fde2d9d993.jpg,"Good morning routine with tea, digital alarm clock, and sleep mask on the bed side table","Good morning routine with tea, digital alarm clock, and sleep mask on the bed side table","morning, wake up, wakeup, alarm clock, digital clock, clock, time, 7 am, seven am, early, early morning, tea, cup of tea, hot tea, tea cup, steaming, steam, bed, bedside, bedroom, sleep mask, eye mask, sleeping mask, rest, relaxation, relaxing, cozy, comfortable, comfort, table, nightstand, plant, houseplant, indoor plant, leaves, home, apartment, interior, window, curtain, daylight, lifestyle, routine, daily routine, day, beginnings, start, wake, leisure, still life",12,2025-03-27
233718_da52f924-f7e3-4776-80af-1d830c8a4ac0.jpg,"Luminous Bloom in Mystical Forest: Enchanted glowing flower blossoms in lush, green woodland scenery","Luminous Bloom in Mystical Forest: Enchanted glowing flower blossoms in lush, green woodland scenery","glowing flower, illuminated blossom, luminescent flora, radiant plant, shining bloom, enchanted forest, magic woodland, mystical woods, fairy tale setting, fantasy landscape, mossy ground, lush moss, green moss, soft moss, forest floor, undergrowth, verdant, botany, leaf, petals, stem, foliage, flora, botanical, natural world, plant life, outdoors, environment, ecology, conservation, wildlife, nature, scenic, tranquil, serene, peaceful, calm, soothing, relaxing, idyllic, dreamy, ethereal, otherworldly, surreal, artistic, creative, moody, atmospheric, dark, lighting, macro",14,2025-03-27
233722_5ebf3047-34c1-43f6-8099-99a290a1ece9.jpg,Golden Retriever Sleeping by Fireplace in Cozy Cabin During Winter,Golden Retriever Sleeping by Fireplace in Cozy Cabin During Winter,"dog, golden retriever, domestic animal, pet, mammal, sleeping, nap, resting, relaxed, cozy, warm, fireplace, fire, window, winter, snow, indoors, home, house, comfort, domestic, relaxation, tranquil, calm, peaceful, still, soft, cushion, pillow, candle, light, evening, night, interior, room, cute, adorable, sweet, sleepy, dream, bed, blanket, cover, cozy home, log cabin, rustic, idyllic, serene, happy, domesticated, companion",1,2025-03-27
233723_65090ac6-b791-45c8-826a-fbf487ba0f14.jpg,Woman in Dress in Underwater Cave with Jellyfish and Light Beams,Woman in Dress in Underwater Cave with Jellyfish and Light Beams,"underwater, undersea, sea, ocean, cave, grotto, cavern, woman, female, girl, dress, gown, wedding dress, bride, jellyfish, glowing jellyfish, bioluminescent, bioluminescence, illuminated, illumination, light, beams, sunbeams, sunlight, water, blue water, turquoise water, sand, beach, shore, coastal, marine, aquatic, nature, scenic, landscape, tranquil, serene, dreamy, ethereal, fantasy, magical, mystical, atmosphere, dreamscape, underwater scene, undersea world, ocean scenery, sea life, peaceful, lonely",11,2025-03-27
233724_14882cb1-1b5e-4f1f-ba39-c0d17c1aaaad.jpg,"Vibrant lavender field in the morning fog at sunrise, scenic landscape with rows of lavender flowers","Vibrant lavender field in the morning fog at sunrise, scenic landscape with rows of lavender flowers","lavender field, lavender farm, lavender, purple, sunrise, sunset, dawn, dusk, morning, evening, sun, sky, landscape, scenery, nature, rural, countryside, fog, mist, atmospheric, dreamy, tranquil, serene, peaceful, calm, row, rows, field, fields, horizon, mountains, hills, trees, country, France, Provence, floral, bloom, blossom, aromatic, fragrant, perfume, purple flowers, violet, violet flowers, mauve, lilac, scenic, summer, spring",11,2025-03-27
233727_46a623e6-d90c-416b-8ce4-bc951e1f5773.jpg,Astronaut adrift in a celestial cloudscape with a wormhole. Surreal space exploration and cosmic travel theme.,Astronaut adrift in a celestial cloudscape with a wormhole. Surreal space exploration and cosmic travel theme.,"astronaut, cosmonaut, spaceman, space suit, outer space, space exploration, space travel, interstellar, galactic, galaxy, nebula, universe, cosmos, celestial, astronomy, astrophysics, space, cloudscape, cloudy, cloud, atmosphere, sky, heaven, dream, dreamy, surreal, ethereal, imagination, fantasy, futuristic, future, science, scientific, discovery, exploration, adventure, voyage, flight, floating, weightless, zero gravity, stars, starlight, constellation, nebulae, light, sky, night, dark",19,2025-03-27
233732_3438d655-b78f-4e86-9361-4e0570475880.jpg,Serene Lotus Blossom on Water: A Tranquil Reflection of Nature's Beauty,Serene Lotus Blossom on Water: A Tranquil Reflection of Nature's Beauty,"lotus, water lily, flower, bloom, blossom, floral, petal, leaf, pond, water, reflection, surface, aquatic, nature, plant, botany, botanical, flora, zen, meditation, peace, peaceful, tranquil, serene, calm, harmony, spiritual, wellness, well-being, mindfulness, relaxation, spa, therapy, healing, light, sunlight, sunshine, glow, soft, delicate, fresh, purity, clean, ripple, ripple effect, ripple water, ripple surface, garden, park, environment",14,2025-03-27
233684_59203a53-9dab-4e6e-b73c-c4be971784dc.jpg,Elegant serum bottle featuring skincare in luxurious minimalist style for beauty promotion.,Elegant serum bottle featuring skincare in luxurious minimalist style for beauty promotion.,"serum, face serum, skincare, skin care, beauty, cosmetics, bottle, dropper, liquid, hydration, moisturizer, facial, beauty product, anti-aging, wellness, health, treatment, youth, radiant, nourishing, clear, transparent, product, packaging, mockup, presentation, minimalist, clean, modern, luxury, elegant, style, black, dark, still life, studio shot, professional, advertising, marketing, science, medicine, pharmaceutical, healthcare, research, development, laboratory, scientific, innovation, biotechnology, medical",12,2025-03-27
233748_ccd2b89e-d937-474d-9aba-9ffdc694e213.jpg,"Lush Tropical Rainforest with Sunbeams and Vibrant Flora, Path Through Dense Green Foliage","Lush Tropical Rainforest with Sunbeams and Vibrant Flora, Path Through Dense Green Foliage","tropical, tropical forest, rainforest, lush rainforest, exotic, exotic forest, trees, tree, forest, foliage, dense foliage, verdant, vibrant, green, flora, plant life, vegetation, plants, leafy, leaves, sunbeams, sun rays, sunlight, sunshine, light, bright, pathway, trail, footpath, path, jungle, dense, woods, natural, nature, environment, conservation, botany, botanical, wild, wilderness, landscape, scenery, outdoors, destination, travel, tourism, secluded, remote, orange flowers",11,2025-03-27
233750_3868a4a3-e5bd-4874-aeef-f1f819648e9d.jpg,Still Mountain Lake Reflecting Snow-Capped Peaks and Forest Under Clear Blue Sky in Peaceful Wilderness,Still Mountain Lake Reflecting Snow-Capped Peaks and Forest Under Clear Blue Sky in Peaceful Wilderness,"lake, mountain lake, calm lake, serene lake, still lake, mountains, snowy mountains, mountain range, mountain landscape, snow covered mountains, reflection, water reflection, mountain reflection, landscape reflection, scenic, scenery, nature, nature landscape, natural, natural scenery, tranquil, tranquility, peaceful, peace, calm, serenity, horizon, skyline, clear sky, bright sky, blue sky, daylight, daytime, light, sunlight, morning, vista, view, beautiful view, forest, pine forest, trees, woods, remote, isolated, wilderness, clean, pristine, clean environment, travel",11,2025-03-27
233749_2bac5a05-8efe-4716-86a6-e1d47b3e6483.jpg,Microscopic Neuron and Brain Cell with Glowing Neural Network Connections,Microscopic Neuron and Brain Cell with Glowing Neural Network Connections,"neuron, nerve cell, brain cell, cell, brain, nervous system, neural, biology, neurology, science, medicine, research, microscopic, anatomy, physiology, dendrite, axon, synapse, neuroscience, biomedical, healthcare, molecular, cellular, tissue, nerve, spinal cord, ganglion, glia, myelin, neurotransmitter, receptor, signal, electrical, chemical, connection, pathway, network, system, human, animal, mammal, body, health, disease, illness, treatment, cure, diagnosis, technology, abstract",16,2025-03-27
233765_f568315d-12db-45bf-972a-5ca2f0fe3890.jpg,Senior Man Relaxing and Napping with a Book in an Armchair at Home in Front of the Bookshelf,Senior Man Relaxing and Napping with a Book in an Armchair at Home in Front of the Bookshelf,"senior, elderly, older, man, male, reading, reader, book, literature, novel, story, library, bookcase, bookshelf, knowledge, information, education, learning, home, house, indoors, interior, room, comfortable, cozy, relaxation, relaxing, peaceful, serene, calm, rest, resting, sleep, sleeping, napping, nap, chair, armchair, furniture, lamp, lampshade, light, window, daylight, blanket, quilt, cover, brown, wool",12,2025-03-27
233767_2c84429c-8e07-4cbb-ae3f-7f0057d92b88.jpg,"Cute ginger cat sleeping in a sunbeam on a window sill with flowers outside, cozy and adorable pet.","Cute ginger cat sleeping in a sunbeam on a window sill with flowers outside, cozy and adorable pet.","cat, kitten, kitty, feline, domestic cat, pet, animal, mammal, cute, adorable, sleeping, sleep, nap, dreaming, rest, relaxing, cozy, window, window sill, sunbeam, sunlight, light, bright, warm, orange cat, ginger cat, tabby cat, striped cat, domestic animal, house cat, companion animal, fur, fluffy, soft, whisker, paw, tail, ear, eye, nose, face, portrait, close-up, indoor, home, domestic, comfort, peaceful, tranquil",1,2025-03-27
233754_3be475cf-8e58-48d8-8da3-db58924d6ada.jpg,"Majestic whale in deep blue ocean with sunlight, swimming in its natural environment, an ocean wildlife ","Majestic whale in deep blue ocean with sunlight, swimming in its natural environment, an ocean wildlife ","whale, mammal, ocean, underwater, sea, marine, aquatic, water, animal, wildlife, nature, deep, blue, depth, swimming, swim, life, creature, giant, large, mysticete, cetacean, baleen whale, fin whale, krill, filter feeder, environment, habitat, aquatic habitat, oceanic, aquatic animal, sea animal, marine life, ocean depths, deep sea, sea water, undersea, submarine, sea wildlife, ocean wildlife, water wildlife, bubbles, sunlight, rays, light, wild, underwater life, peaceful, relaxing, calm",1,2025-03-27
233769_33c90189-53e5-4ebd-b9bd-516275929fbd.jpg,Conceptual Visualization of Human Brain with Neural Activity and Mental Processes,Conceptual Visualization of Human Brain with Neural Activity and Mental Processes,"brain, mind, human brain, thinking, intelligence, consciousness, mental, thought, idea, perception, awareness, knowledge, cognitive, psyche, understanding, intellect, reasoning, intellectual, wisdom, learning, memory, creative, imagination, inspiration, vision, insight, innovation, neural, neural network, connections, artificial intelligence, ai, technology, future, science, medicine, neurology, research, healthcare, innovation, digital, futuristic, abstract, conceptual, graphic, design, background, illustration, artwork",16,2025-03-27
233772_5cb0ca3f-c5fe-4b05-a717-dea77fd342a9.jpg,"Open book, coffee cup, and steam on a wooden table in a cozy room with sunlight coming from the window","Open book, coffee cup, and steam on a wooden table in a cozy room with sunlight coming from the window","book, reading, literature, novel, study, open book, coffee, tea, cup, hot drink, steam, table, wooden table, interior, home, room, window, plant, bookshelf, books, library, daylight, sunlight, shadow, still life, relax, relaxation, leisure, quiet, peaceful, cozy, warm, vintage, antique, retro, classic, education, knowledge, learn, literacy, publication, text, pages, paper, old, history, story, narrative, scene",12,2025-03-27
233771_958407b2-2115-4830-aa2e-f7a29f7c688a.jpg,Ladybug Crawling on Grass Blade with Dew Drops in Macro View,Ladybug Crawling on Grass Blade with Dew Drops in Macro View,"ladybug, ladybird, insect, beetle, small insect, dew, water drop, water droplets, droplet, drop, plant, blade of grass, grass, leaf, green, nature, macro, close-up, wildlife, spring, summer, environment, flora, natural, outdoors, detail, dewy, fresh, clean, bright, vibrant, closeup, lawn, foliage, botany, botanical, beauty, beautiful, harmony, peace, calm, serene, tranquil, idyllic, scenic, background, backdrop, wallpaper, red, spotted",1,2025-03-27
233775_6a3d8ba7-977c-473c-b4f0-60a1f65377a9.jpg,"Bright and Cozy Bedroom Interior with Bed, Pillows, and Natural Light","Bright and Cozy Bedroom Interior with Bed, Pillows, and Natural Light","bedroom, bed, pillows, bedding, comforter, linen, bedroom interior, home, house, apartment, window, curtains, sheer curtains, light, sunlight, sunshine, daylight, morning, bright, plant, potted plant, green plant, houseplant, furniture, nightstand, minimalist, minimalism, simplicity, calm, peaceful, serene, relaxing, rest, sleep, cozy, comfortable, clean, modern, domestic, domestic life, interior, indoor, inside, soft, white, beige, neutral colors, warm, home decor",12,2025-03-27
233777_1731d242-72b8-4469-bf2c-96eaeecc95cf.jpg,Silhouette of Woman Practicing Yoga on Dock at Twilight with City Skyline Reflection,Silhouette of Woman Practicing Yoga on Dock at Twilight with City Skyline Reflection,"woman, silhouette, yoga, yogi, pose, cityscape, skyline, urban, city, reflection, water reflection, night, nighttime, evening, sunset, dusk, dawn, horizon, landscape, seascape, lake, sea, ocean, buildings, skyscrapers, architecture, modern, travel, tourism, relaxation, mindfulness, meditation, health, wellness, well being, exercise, outdoors, nature, calm, serene, peaceful, tranquil, lifestyle, leisure, recreation, dock, pier, wooden, yoga mat, practice",12,2025-03-27
233779_6b7a15b8-b489-4890-b596-f1b53b757e2f.jpg,"Refreshing drink with kiwi, almonds and oats on a rustic wood table, promoting healthy eating and wellness.","Refreshing drink with kiwi, almonds and oats on a rustic wood table, promoting healthy eating and wellness.","healthy, wellness, well-being, nutrition, nutritious, wholesome, organic, natural, fresh, refreshing, detox, detoxification, cleansing, beverage, drink, juice, tea, fruit, kiwi, kiwifruit, almonds, nuts, grain, oats, oatmeal, ingredients, food, wooden, table, rustic, still life, books, jar, pitcher, glass, cup, plate, brown, green, beige, plant, indoors, daylight, blur, close-up, macro, arrangement, composition, style, horizontal",7,2025-03-27
233778_1c365f56-c34d-46e6-b6de-e18544e198db.jpg,"Anatomical Illustration of Human Body with Celestial Gears in Space, Science, Medicine","Anatomical Illustration of Human Body with Celestial Gears in Space, Science, Medicine","human anatomy, anatomy, human body, body, anatomical, biological, biology, human, skeleton, organs, organ, internal organs, brain, intestines, torso, skull, ribcage, physiology, physiological, medical, medicine, healthcare, scientific, science, research, illustration, diagram, artwork, celestial, stars, star, galaxy, universe, outer space, space, night sky, cog, cogs, gear, gears, cogwheel, cogwheels, mechanism, clockwork, futuristic, abstract, design, backdrop, background",16,2025-03-27
233780_1418223b-97a0-402a-9215-8202c8b70402.jpg,"Spa Still Life with Stones, Candles, and Lavender for Relaxation and Wellness","Spa Still Life with Stones, Candles, and Lavender for Relaxation and Wellness","spa, wellness, well-being, relaxation, zen, massage, therapy, treatment, health, lifestyle, stones, stacked stones, balance, stack, harmony, meditation, calm, serenity, peace, peaceful, candles, candlelight, aroma, lavender, essential oil, flower, floral, purple, towel, clean, bamboo, mat, wood, wooden, table, still life, blur, blurred, background, soft, warm, light, illuminated, glow, tranquil, nature, closeup, indoors, interior, arrangement",12,2025-03-27
233784_2eaade48-01d1-4baf-a2a4-74f8b8b24420.jpg,"Elegant Tea Still Life with Steaming Cup, Fresh Herbs, and Aroma","Elegant Tea Still Life with Steaming Cup, Fresh Herbs, and Aroma","tea, cup of tea, hot tea, herbal tea, tea time, tea ceremony, aromatic tea, fresh tea, drink, beverage, hot beverage, steaming beverage, cup, tea cup, porcelain cup, cup on saucer, white cup, saucer, steam, rising steam, hot steam, aroma, fragrance, scent, still life, minimal, minimalist, purity, simplicity, relaxation, wellness, well-being, health, healthy, spa, aromatherapy, herbs, fresh herbs, herb garnish, floral, flower, purple flower, plant, leaves, small leaves, table, window light, background, indoor, tranquil",7,2025-03-27
233782_0577763c-3a57-4614-ba64-062a132c1df1.jpg,"Abstract Teal, Blue, and Gold Alcohol Ink Pattern - A luxurious and stylish watercolor design for creative projects.","Abstract Teal, Blue, and Gold Alcohol Ink Pattern - A luxurious and stylish watercolor design for creative projects.","watercolor, alcohol ink, ink, stain, fluid, abstract, background, backdrop, texture, art, artistic, decorative, graphic, illustration, design, element, blue, teal, aqua, turquoise, green, gold, glitter, sparkle, shimmer, luxury, modern, contemporary, stylish, elegant, creative, artwork, template, banner, poster, card, invitation, cover, branding, wallpaper, backdrop, header, pattern, smoky, clear, paper, frame, effect, wavy",8,2025-03-27
233785_b628d48b-934d-40f3-83f7-c0ecc32ef24a.jpg,"Pouring Tea into a Glass Cup with Daisies and Lavender on a Table, Aromatic and Refreshing Herbal Beverage","Pouring Tea into a Glass Cup with Daisies and Lavender on a Table, Aromatic and Refreshing Herbal Beverage","tea, herbal tea, hot tea, cup of tea, pouring tea, beverage, drink, hot beverage, teapot, glass cup, steam, aroma, daisy, daisies, flowers, chamomile, lavender, herbs, floral, nature, table, refreshment, relaxation, calming, warm, healthy, wellness, morning, afternoon, garden, sunny, daylight, still life, transparent, clear glass, saucer, elegant, minimalist, simplicity, peaceful, serene, tranquil, closeup, macro, golden, liquid, infusion, decoction, teatime, break",7,2025-03-27
233798_c508c0ef-db00-4fe3-b879-780cdced93d4.jpg,Silhouette of a woman doing yoga tree pose during a vibrant sunset on a rocky coast overlooking the sea,Silhouette of a woman doing yoga tree pose during a vibrant sunset on a rocky coast overlooking the sea,"yoga, woman, silhouette, sunset, sunrise, ocean, sea, beach, tree pose, vrksasana, balance, meditation, relaxation, mindfulness, wellness, well being, health, healthy, lifestyle, spiritual, serenity, zen, nature, outdoors, exercise, fitness, sport, female, person, body, practice, pose, asana, stretch, strength, tranquility, calm, harmony, peace, vacation, travel, coast, seascape, sky, sun, water, horizon, scenic, landscape, twilight",18,2025-03-27
233794_1c4c1032-7b47-4b74-827c-96d580185147.jpg,Abstract Neural Network of Nerve Cells with Glowing Connections for Science and Medical Visualization,Abstract Neural Network of Nerve Cells with Glowing Connections for Science and Medical Visualization,"nerve, nerves, neural, neuron, neurons, brain, nerve cell, nerve cells, neurology, neuroscience, connection, connections, pathway, pathways, system, biology, biological, science, scientific, medical, medicine, research, anatomy, cellular, cell, cells, microscopic, microbiology, molecular, abstract, pattern, background, structure, illustration, design, healthcare, pharmaceutical, pharmacy, technology, digitally generated, 3d rendering, futuristic, complex, detail, glowing, glowing particles, blue, red, network, data",16,2025-03-27
233799_91cb216e-f061-4269-a5b4-5ebc65f8435a.jpg,Silhouette of a Hiker at Sunset Overlooking Mountains,Silhouette of a Hiker at Sunset Overlooking Mountains,"hiker, trekking, hiking, outdoor, adventure, mountain, landscape, scenery, nature, sunrise, sunset, sun, backpacker, backpacking, climbing, peak, hill, sky, travel, tourism, exploration, silhouette, sport, active, lifestyle, journey, destination, vacation, holiday, recreation, wanderlust, freedom, challenge, achievement, success, inspiration, motivatation, positivity, well-being, healthy, outdoorsman, gear, equipment, rocks, stones, vegetation, vegetation, terrain, scenic, vista",21,2025-03-27
233800_670312d6-931e-439c-ba90-af6d93d7b6a5.jpg,"Woman relaxing in a spa with candles, stones, and soft towels, enjoying wellness and peace of mind","Woman relaxing in a spa with candles, stones, and soft towels, enjoying wellness and peace of mind","woman, female, girl, model, face, profile, relaxed, relaxation, wellness, well-being, spa, massage, therapy, treatment, body care, skincare, beauty, beautiful, health, healthy, lifestyle, serene, calm, peaceful, peace, candles, candlelight, stones, aromatherapy, massage table, towel, soft, warm, interior, indoors, day spa, stone wall, health spa, self-care, taking care, caucasian, brunette, eyes closed, rejuvenation, rest, resting, spiritual, mindfulness, zen, studio",12,2025-03-27
233787_d2802ca5-ab15-4c97-8912-7c59dac7ad56.jpg,"Serene woman lies on yoga mat at home, enjoying the cityscape view in relaxation and wellness.","Serene woman lies on yoga mat at home, enjoying the cityscape view in relaxation and wellness.","woman, female, young woman, attractive woman, slim woman, beautiful woman, fit woman, adult, lifestyle, well being, yoga, relaxing, relaxation, yoga mat, exercise, exercising, fitness, sport, sporty, wellness, healthy lifestyle, health, healthy, meditation, mindfulness, urban, city, cityscape, skyline, buildings, apartment, sunset, indoor, indoors, window, view, serene, peaceful, calm, tranquil, balance, body, core, pose, headband, leisure, evening, domestic, home",12,2025-03-27
