Filename,Title,Description,Keywords,Category,Release(s)
238746_03ff63de-dae6-4af9-9d9d-d98de1de1b7f.jpg,Lotus Blossoms in a Peaceful Pond with Dew-Kissed Leaves in the Morning Light,Lotus Blossoms in a Peaceful Pond with Dew-Kissed Leaves in the Morning Light,"lotus, lotuses, water lily, water lilies, aquatic plant, aquatic plants, sacred lotus, indian lotus, nelumbo nucifera, flower, flowers, bloom, blooms, blossom, blossoms, flora, floral, petal, petals, leaf, leaves, foliage, green, growth, natural, nature, botany, botanical, pond, water, dew, dewdrop, dewdrops, morning dew, fresh, vibrant, serene, peaceful, tranquil, zen, meditation, asian, oriental, plant, plants, outdoor, macro, close-up, detail",14,2025-03-29
238761_07e19b8a-1da7-4955-a042-749ec4a21040.jpg,Cozy Kitchen Scene with Steaming Tea Cup and Daisies on Wooden Table in Sunlight,Cozy Kitchen Scene with Steaming Tea Cup and Daisies on Wooden Table in Sunlight,"tea, cup of tea, herbal tea, hot tea, drink, beverage, warm beverage, cup, glass cup, tea cup, saucer, white saucer, daisy, daisies, flower, flowers, chamomile, kitchen, kitchen scene, kitchen interior, window, window light, sunlight, morning, table, wooden table, wooden surface, steam, steam effect, hot, fresh, refreshment, relax, relaxation, cozy, calm, still life, indoor, indoors, tabletop, countertop, home, house, domestic, simple, minimal, closeup, macro, blur background, tea time",7,2025-03-29
238748_3078822d-0418-497b-b1cf-bfb5712f888b.jpg,"Close-up of a Smiling Woman with Perfect White Teeth, Outdoors, Sunlight, Dental Care and Health, Beauty and Wellness","Close-up of a Smiling Woman with Perfect White Teeth, Outdoors, Sunlight, Dental Care and Health, Beauty and Wellness","woman, female, girl, person, human, face, mouth, smile, teeth, dentistry, dental, oral hygiene, tooth, white teeth, bright smile, healthy smile, beautiful smile, happy, joy, cheerful, positive, wellness, well-being, care, health, healthcare, fresh, clean, cosmetic, lips, close-up, macro, portrait, headshot, outdoor, daylight, sunlight, background, bokeh, blurred, nature, garden, park, youth, young adult, caucasian, fair skin, blond hair, lifestyle, beauty",13,2025-03-29
238754_6d584906-d91a-4748-9530-1ba9b920dd06.jpg,"Fresh Fruits and Vegetables: Healthy Eating on a Wooden Table, Apple, Cucumber, Orange, Celery","Fresh Fruits and Vegetables: Healthy Eating on a Wooden Table, Apple, Cucumber, Orange, Celery","fruits, vegetables, healthy, food, fresh, nutrition, apple, cucumber, orange, celery, parsley, lettuce, red apple, yellow apple, citrus fruit, healthy eating, vegetarian, vegan, diet, wellness, ingredient, wooden table, kitchen, window, still life, table, close up, macro, produce, raw, ripe, refreshing, natural, sweet, tasty, delicious, arrangement, colorful, vibrant, vitamins, antioxidants, juicy, garden, harvest, farm, background, wallpaper, desktop, artwork, illustration",7,2025-03-29
238749_601515d4-1b00-4c2b-ba2d-e23cc722d268.jpg,"Abstract Architectural Interior with Sculpture, Minimalist Design and Sunlight, Contemporary Art Space","Abstract Architectural Interior with Sculpture, Minimalist Design and Sunlight, Contemporary Art Space","minimalism, minimalist, minimal, contemporary, modern, interior, architecture, design, architectural, geometric, geometry, shape, abstract, structure, building, empty, space, room, clean, concrete, wall, surface, texture, plaster, smooth, gray, grey, light, sunlight, shadow, art, sculpture, artwork, round, circle, oval, podium, base, presentation, exhibition, backdrop, background, bright, daylight, indoor, inside, still life, installation, artistic, decorative",2,2025-03-29
238751_edfa221d-1b9e-4bed-9c5f-84e419ab7aa2.jpg,"Pastoral Vista: Golden Field, Rolling Hills, and Rustic Fence Under a Sunny Sky","Pastoral Vista: Golden Field, Rolling Hills, and Rustic Fence Under a Sunny Sky","landscape, idyllic landscape, scenic landscape, rural landscape, countryside, open field, grassland, golden field, wheat field, grain field, farm, agriculture, harvest, rolling hills, distant hills, hillside, mountain view, mountain range, blue sky, clouds, cloudscape, clear sky, sunny day, sunshine, wooden fence, rustic fence, farm fence, field boundary, pasture fence, fence post, wildflowers, grass, flora, nature, natural, outdoor, daylight, daytime, tranquil, peaceful, serene, scenic, rural, country, environment, vista, horizon, farmland, rustic charm, calm",11,2025-03-29
238753_f9108323-d2b2-4cf2-beee-64b08541a8cb.jpg,"Night Cityscape with Car Trails: Modern urban architecture, skyscrapers, and vibrant traffic light streaks","Night Cityscape with Car Trails: Modern urban architecture, skyscrapers, and vibrant traffic light streaks","cityscape, urban landscape, city view, city skyline, metropolis, downtown, buildings, skyscrapers, architecture, urban architecture, modern architecture, city lights, street lights, night photography, long exposure, traffic, traffic trails, road, street, urban road, urban street, transportation, cars, vehicles, urban transport, urban traffic, city life, urban lifestyle, modern life, business district, financial district, urban scene, city scene, city center, city district, urban environment, urban setting, town, evening, twilight, dusk, night, nighttime, night scene, night view, blue hour, urban exploration, travel, tourism, urban travel",11,2025-03-29
238766_c32882d2-c7c1-4bfe-97d4-eac87e7641d2.jpg,Bowl of Delicious Mango Dessert with Passion Fruit on a Wooden Table in Kitchen,Bowl of Delicious Mango Dessert with Passion Fruit on a Wooden Table in Kitchen,"mango, mango dessert, tropical dessert, fruit dessert, dessert, sweet dessert, passion fruit, passionfruit, tropical fruit, fruit, bowl, fruit bowl, dessert bowl, kitchen table, table, wooden table, smoothie, fruit smoothie, mango smoothie, tropical smoothie, leaf, leaves, plant, green plant, houseplant, kitchen, indoor, healthy, sweet, delicious, refreshing, vegetarian, vegan, diet, nutrition, food, bright, yellow, window light, sunlight, summer, breakfast, lunch, snack, tabletop, countertop, cuisine, dish, tropical",7,2025-03-29
238767_9c6243dd-ba7b-4690-92f2-6fb7a605d24f.jpg,"Fresh green juice pouring into glass for healthy diet and nutrition; wellness, and vegetarian","Fresh green juice pouring into glass for healthy diet and nutrition; wellness, and vegetarian","green juice, juice, green smoothie, smoothie, healthy juice, healthy smoothie, vegetable juice, vegetable smoothie, celery juice, celery smoothie, pouring juice, pouring smoothie, fresh juice, fresh smoothie, organic juice, organic smoothie, detox juice, detox smoothie, vegan juice, vegan smoothie, raw juice, raw smoothie, nutritious juice, nutritious smoothie, beverage, drink, glass, liquid, refreshing, ingredient, healthy, nutrition, diet, wellness, lifestyle, vegetarian, raw food, detoxification, vitamins, antioxidants, superfood, plant-based, natural, freshness, health, well-being, celery, leafy greens, parsley, kale",7,2025-03-29
238765_f778acc8-453b-4cb1-90d9-d0be0b6bb791.jpg,Refreshing Lemon Water in Glass on Kitchen Countertop with Sliced Lemons Inside,Refreshing Lemon Water in Glass on Kitchen Countertop with Sliced Lemons Inside,"lemon, lemonade, lemon water, water, fruit, citrus fruit, citrus, drink, refreshment, beverage, glass, clear glass, kitchen, countertop, modern kitchen, interior, home, domestic, still life, fresh, healthy, wellness, lifestyle, marble, table, white, minimal, minimalist, simplicity, cooking, food, ingredient, plant, cutting board, kettle, appliance, window, sunlight, indoor, nutrition, diet, summer, cool, transparent, liquid, juice, vitamin, well-being, relaxation, clean",7,2025-03-29
238762_9071544b-38ec-4188-bae1-87e1fcbc19df.jpg,Lush Green Mint Plants Along a Stone Pathway in a Sunlit Garden,Lush Green Mint Plants Along a Stone Pathway in a Sunlit Garden,"mint, mint leaves, greenery, green leaves, foliage, garden, gardening, herb, herbal, fresh, aromatic, plant, botany, botanical, pathway, path, stone path, walkway, nature, outdoor, sunlight, sunshine, bright, vibrant, lush, growth, growing, spring, summer, countryside, rural, scenic, tranquil, peaceful, serene, calm, relaxing, environment, ecology, natural, wellness, well-being, alternative medicine, organic, sustainable, leaf, leaves, leafy, closeup, macro",14,2025-03-29
238768_7cf73668-934c-4159-8f15-4e1e47fb1e7f.jpg,Smiling Woman Enjoying Orange Juice After Workout at Gym for Healthy Lifestyle,Smiling Woman Enjoying Orange Juice After Workout at Gym for Healthy Lifestyle,"woman, smiling, fitness, gym, healthy, drink, orange juice, juice, workout, lifestyle, sport, exercise, wellness, health, nutrition, refreshment, beverage, glass, hydration, energy, vitamins, antioxidants, fresh, natural, body, fit, active, training, people, indoor, happy, young, adult, beautiful, caucasian, female, sportswear, sweat, post-workout, recovery, well-being, gym-goers, gym atmosphere, gym environment, sunlight, sunshine, window, background, blur",12,2025-03-29
238769_ef277eb9-e42d-47d6-ad57-9a861167ca37.jpg,Assorted Citrus Fruits and Ginger Flat Lay Composition on White Tabletop,Assorted Citrus Fruits and Ginger Flat Lay Composition on White Tabletop,"citrus, citrus fruit, assorted citrus, variety of citrus, grapefruit, orange, lemon, lime, mandarin orange, fruit, fresh fruit, sliced fruit, cut fruit, still life, flat lay, overhead shot, food photography, healthy, wellness, antioxidant, vitamin c, refreshing, tropical, ingredient, food, produce, raw, vegan, vegetarian, whole food, natural, spring onion, scallion, ginger, herb, spice, cooking ingredient, culinary, flavoring, aromatic, white background, studio shot, vibrant, colorful, bright, macro, close up, minimalist, simplicity, clean",7,2025-03-29
238770_d9745a53-7aae-49aa-8914-a9cbe5c64d13.jpg,Invigorating Carrot Juice with Natural Elements for a Healthy Lifestyle,Invigorating Carrot Juice with Natural Elements for a Healthy Lifestyle,"carrot juice, fresh juice, healthy drink, vitamin drink, beverage, refreshment, glass, carrot, vegetable, produce, stone, pebble, still life, zen, bamboo, smooth, garden, plant, flora, wellness, nutrition, juice, drink, orange, close-up, macro, arrangement, horizontal, indoor, table, wood, minimal, simple, clean, fresh, health, therapy, diet, detox, vegetarian, vegan, organic, natural, background, backdrop, food, ingredient, vibrant, bright",7,2025-03-29
238773_4ece6a56-26b5-4287-b2ea-07235dd434e4.jpg,Refreshing Mango Smoothie with Mint on Wooden Table. A Tropical Delight,Refreshing Mango Smoothie with Mint on Wooden Table. A Tropical Delight,"mango smoothie, mango juice, tropical smoothie, fruit smoothie, healthy drink, refreshing drink, summer drink, beverage, fruit drink, glass, mango fruit, fresh, mint garnish, wooden table, organic, vegan, vegetarian, natural, sweet, delicious, tropical, antioxidant, vitamin, nutritious, plant, still life, food photography, tabletop, studio shot, indoor, dark background, shadows, wooden surface, cut mango, whole mango, mango slice, mint leaves, tropical flavor, smoothie, juice, fruit, drink, beverage, food, refreshment, health, diet, nutrition, sweetness, yellow",7,2025-03-29
238771_c20c715d-3737-45bd-a8f2-e05ea804b625.jpg,Freshly Made Tomato Sauce in a Jar with Basil and Whole Tomatoes,Freshly Made Tomato Sauce in a Jar with Basil and Whole Tomatoes,"tomato sauce, tomato, sauce, homemade, canned, mason jar, jar, preserve, canning, food, fresh, cooking, healthy, rustic, ingredient, vegetable, recipe, italian, organic, vegan, vegetarian, cuisine, raw, table, still life, nature, studio shot, overhead, hand, holding, basil, plant, leaves, brown, red, glass, delicious, gourmet, seasoning, condiment, flavor, vitamin, close-up, nutrition, diet, natural, garden, harvest, flat lay, country",7,2025-03-29
238774_f5d63176-6983-4058-94fc-b540ddc6b19d.jpg,"Fresh Apple Juice with Ripe Red Apples and Autumn Leaves, Healthy Autumnal Still Life","Fresh Apple Juice with Ripe Red Apples and Autumn Leaves, Healthy Autumnal Still Life","apple juice, apple cider, fruit juice, juice, apple beverage, beverage, drink, healthy drink, healthy beverage, red apples, apples, fresh apples, organic apples, fresh fruit, organic fruit, fruit, apple still life, still life, autumn still life, autumn composition, fall still life, fall composition, glass of juice, glass, leaves, autumn leaves, fall leaves, dried leaves, table, wooden table, indoor, window light, sunlight, nutrition, wellness, healthy eating, healthy lifestyle, close-up, macro, food photography, drink photography, apple photography, refreshment, delicious, sweet, tasty, autumn, fall, season, harvest",7,2025-03-29
238775_2db5015f-fee9-453c-9364-ebe059f20fd3.jpg,Smiling Woman Holding Berry Smoothie Bowl with Strawberries and Blueberries at Cafe,Smiling Woman Holding Berry Smoothie Bowl with Strawberries and Blueberries at Cafe,"woman, smoothie bowl, acai bowl, fruit bowl, berry bowl, healthy eating, healthy food, wellness, nutrition, breakfast, delicious, strawberries, blueberries, fresh fruit, superfood, vegan, vegetarian, diet, vitamins, antioxidants, refreshing, lifestyle, casual, smiling, happy, cheerful, portrait, indoor, restaurant, cafe, table, friends, gathering, summertime, daylight, blond hair, caucasian, young adult, female, holding, bowl, berry, plant, food, fruit, tableware, produce, recipe, sweetness, ingredient",7,2025-03-29
238776_7662c7cb-0a0b-4340-8ced-7909b8de9a77.jpg,"Zen Garden with Rock Fountain, Raked Sand, Bamboo and Stones. A Peaceful Oasis","Zen Garden with Rock Fountain, Raked Sand, Bamboo and Stones. A Peaceful Oasis","zen garden, Japanese garden, rock garden, sand garden, miniature garden, meditation garden, serene garden, peaceful garden, calm garden, tranquil garden, zen, balance, harmony, relaxation, mindfulness, serenity, peace, calm, tranquility, well-being, wellness, spa, therapy, massage, healing, nature, garden, outdoors, stones, rocks, sand, patterns, lines, circles, art, design, minimalism, simplicity, aesthetics, bamboo, plants, foliage, water feature, fountain, bowl, spiritual, contemplation, Japanese culture, Asian culture, still life",11,2025-03-29
238778_6e5318ff-6781-4661-955b-f350b404b930.jpg,Radiant Pink Lotus Blossom Reflecting Peacefully on Calm Waters in Natural Light,Radiant Pink Lotus Blossom Reflecting Peacefully on Calm Waters in Natural Light,"lotus, lotus flower, aquatic plant, water lily, sacred lotus, indian lotus, nelumbo nucifera, flower, floral, bloom, blossom, petal, pink, magenta, plant, flora, nature, water, pond, lake, reflection, surface, leaf, lily pad, aquatic, dew, droplet, macro, close-up, botany, botanical, zen, tranquil, serene, peaceful, meditation, mindfulness, yoga, wellness, spa, beauty, beautiful, fresh, vibrant, bright, garden, asian, oriental, background",14,2025-03-29
238784_623de323-eeeb-48ef-987f-cec5963d2af3.jpg,"Stylish geometric arrangement with circles, squares and rectangles in pastel shades and earth tones","Stylish geometric arrangement with circles, squares and rectangles in pastel shades and earth tones","geometric, geometry, shapes, shape, circle, square, rectangle, block, 3D, abstract, minimal, design, modern, graphic, element, illustration, rendering, composition, arrangement, pastel, color, background, backdrop, copy space, mockup, template, presentation, scene, stage, platform, display, product, still life, studio, shadow, light, clean, simple, soft, muted, earth tone, earthy, trendy, decorative, backdrop, website, banner, wallpaper, decorative, decorative",8,2025-03-29
238780_fa272722-5dee-4ccd-a4c0-2ebb308c1870.jpg,Bonsai Tree on Books with Candle on Wooden Table Against Neutral Wall for Minimalist Still Life Home Decor,Bonsai Tree on Books with Candle on Wooden Table Against Neutral Wall for Minimalist Still Life Home Decor,"still life, minimalist, bonsai, small tree, potted plant, indoor plant, houseplant, books, stack of books, book stack, candle, wax candle, glass candle, home decor, decoration, table, wood table, wooden table, desk, wood desk, wooden desk, interior, room, indoors, modern, simplicity, calm, peaceful, cozy, soft, minimal, beige, brown, green, white, lifestyle, domestic, home, workspace, tabletop, arrangement, composition, studio shot, copy space, design space, blank space, clean, neutral background, plant",12,2025-03-29
238779_0595c51d-9a6e-4d43-aea8-8e47cd651abf.jpg,Joyful Blonde Woman Laughing in Cafe Sunlight,Joyful Blonde Woman Laughing in Cafe Sunlight,"woman, beautiful woman, attractive woman, smiling woman, laughing, joyful, cheerful, positive emotion, happiness, daytime, outdoor cafe, cafe, table, coffee cup, drink, blonde, long hair, curly hair, hair, sunlight, sun, golden hour, evening, sunset, city, urban, town, building, architecture, plant, foliage, ivy, lifestyle, leisure, relaxation, ring, jewelry, accessory, casual, pretty, female, person, human, outside, day, light, bright, warm, outdoor, close-up",13,2025-03-29
238781_a2bf12fe-9d35-4962-b88b-ee3883490ac1.jpg,"Modern electric toothbrush with succulents on marble countertop, a lifestyle image highlighting personal hygiene","Modern electric toothbrush with succulents on marble countertop, a lifestyle image highlighting personal hygiene","electric toothbrush, toothbrush, oral hygiene, dental care, dental hygiene, clean teeth, teeth cleaning, healthy teeth, personal care, oral care, bathroom, morning routine, hygiene, clean, modern, minimalist, minimalism, white, marble, countertop, succulent, plant, potted plant, small plant, green, indoor plant, home decor, decoration, still life, wellness, well-being, health, lifestyle, domestic life, daily routine, home, closeup, macro, studio shot, isolated, product shot, product photography, beauty, appliance, device, technology, electronics, household, domestic",12,2025-03-29
238782_52820270-5b83-4d9a-8bd1-f29df03438ea.jpg,"Healthy Fruit Still Life with Apples, Grapes, Oranges, Stones, and Succulent Plant","Healthy Fruit Still Life with Apples, Grapes, Oranges, Stones, and Succulent Plant","fruit, fruits, fresh fruit, healthy fruit, apple, apples, red apple, green apple, orange, oranges, tangerine, mandarin, grape, grapes, green grapes, fruit bowl, bowl of fruit, glass bowl, stack of stones, stacked stones, stone stack, succulent, succulents, plant, plants, still life, food photography, table, wooden table, wood, wooden, health, healthy, wellness, well-being, nutrition, nutrient, vitamin, vitamins, antioxidant, antioxidants, diet, dieting, vegetarian, vegan, background, dark background, indoors",7,2025-03-29
238786_1de8c2f6-3d58-4069-bbbb-005b5f8001db.jpg,"Close-up of a woman's mouth with perfect white teeth, tongue, and pink lips, representing dental care and oral hygiene","Close-up of a woman's mouth with perfect white teeth, tongue, and pink lips, representing dental care and oral hygiene","teeth, tooth, dentistry, dentist, oral hygiene, dental care, mouth, smile, laugh, tongue, lips, pink lips, face, beautiful smile, white teeth, perfect teeth, close-up, dental, healthy, health, healthcare, wellness, well-being, clean, fresh, attractive, young, woman, girl, person, human, caucasian, european, indoor, studio, medical, medicine, treatment, procedure, clinic, office, room, interior, background, blur, modern, dental clinic, dental office, dental hygiene, dental health",13,2025-03-29
238790_8e1d0d1a-58d4-47d9-acf7-0a06befd8fbf.jpg,"Petri Dishes with Bacterial Cultures: Microbiology Research, Science and Medicine","Petri Dishes with Bacterial Cultures: Microbiology Research, Science and Medicine","petri dish, petri dishes, culture, cultures, bacterial culture, microbiology, agar, agar plate, bacteria, bacterium, microbe, microbes, microorganism, microorganisms, germ, germs, pathogen, pathogens, organism, organisms, scientific, science, medical, medicine, research, laboratory, lab, experiment, growth, biology, biological, specimen, analysis, analyzing, scientific research, scientific study, pharmaceutical, pharmacy, health, healthcare, disease, illness, infection, virus, virology, sample, closeup, close-up, still life, still-life",16,2025-03-29
238788_f4a8a823-628f-4176-ac84-75e4224189e2.jpg,Iced Drink with Mint on Wooden Table Against Green Background. Refreshing Iced Beverage for a Hot Summer Day,Iced Drink with Mint on Wooden Table Against Green Background. Refreshing Iced Beverage for a Hot Summer Day,"refreshing drink, ice beverage, iced drink, cold refreshment, beverage, drink, ice water, water, ice, mint leaf, mint, clear glass, glass, wooden table, table, outdoor setting, summer drink, summer, leaf, blue flower, flower, floral, garden, fresh, nature, clear, transparent, cool, cooling, relaxation, blurred background, out of focus, bokeh, sunlight, sunny, bright, daylight, still life, eco-friendly, natural, simple, minimalist, clean, aesthetic, rustic, countryside, wellness, healthy, well-being, tranquil",4,2025-03-29
238797_9a6a4c60-0aac-4072-b4de-aef8b9ce0bde.jpg,"Scales of Justice, Magnifying Glass and Antique Books on Wooden Desk","Scales of Justice, Magnifying Glass and Antique Books on Wooden Desk","scales of justice, justice, law, legal, legislation, law books, books, magnifying glass, antique books, vintage books, stack of books, old books, book, ancient books, study, wisdom, knowledge, research, education, reading, literature, library, bookcase, court, lawyer, attorney, judge, judgment, constitution, rights, government, authority, regulation, policy, ethics, morality, principles, truth, honesty, integrity, balance, equilibrium, order, jurisprudence, history, classic, retro, magnification, investigation, intellect",3,2025-03-29
238792_c87050f8-be10-45bb-9d7d-1c6d4c3b2db9.jpg,"Cheese, Chopped Tomatoes & Cream Cheese on a Wooden Board for Food Preparation in an Outdoor Setting","Cheese, Chopped Tomatoes & Cream Cheese on a Wooden Board for Food Preparation in an Outdoor Setting","cheese, grated cheese, shredded cheese, cheese heap, cheese pile, dairy product, condiment, flavor enhancer, food, food garnish, food styling, food presentation, tomato, chopped tomatoes, diced tomatoes, tomato pieces, red, vegetable, produce, nutrition, healthy food, fresh, freshness, background, outdoor, garden, wooden table, table, cutting board, culinary, cooking, recipe, ingredient, side dish, appetizer, gourmet, still life, meal, lunch, dinner, dish, preparation, close-up, detail, macro, studio shot, arrangement, composition, organic, natural",7,2025-03-29
238800_3da5e40e-24fd-4c2d-a67f-602e0996e837.jpg,"Monarch Butterfly on an Orange Flower, Close-Up Portrait with Vibrant Wings and Natural Background","Monarch Butterfly on an Orange Flower, Close-Up Portrait with Vibrant Wings and Natural Background","butterfly, monarch butterfly, insect, lepidoptera, flower, orange flower, yellow flower, bloom, blossom, floral, flora, garden, close-up, macro, nature, wildlife, outdoors, wings, wing pattern, beautiful, vibrant, colorful, orange, yellow, black, detailed, antennae, pollination, pollen, nectar, spring, summer, warm, sunny, daylight, natural light, environment, ecological, seasonal, fresh, growth, botany, botanical, seasonal, floral background, garden background, natural background, isolated",1,2025-03-29
238787_fe718660-67fd-40b0-a88e-d35e1c5934bb.jpg,"Liquid Serenity: Waves of Water with Sparkling Drops in an Abstract, Fresh Blue Environment","Liquid Serenity: Waves of Water with Sparkling Drops in an Abstract, Fresh Blue Environment","water, wave, liquid, fluid, splash, clean, fresh, aqua, transparent, purity, motion, texture, surface, blue, abstract, background, nature, drop, sea, ocean, ripple, clear, refreshing, dynamic, flowing, sparkling, shiny, glossy, wet, cool, natural, element, refreshment, purity, energy, movement, environmental, environment, detail, macro, illustration, art, design, graphic, artistic, backdrop, modern, simplicity, pattern, elemental",5,2025-03-29
238806_d2ac6d63-19f4-4c0e-9804-5fd5319b0cf1.jpg,Microscopic View of a Tumor with Cellular Structures and Orange Glow,Microscopic View of a Tumor with Cellular Structures and Orange Glow,"tumor, cancer, malignancy, neoplasm, growth, cell, cells, cellular, biology, biological, disease, illness, ailment, medical, medication, medicine, healthcare, treatment, diagnosis, research, science, scientific, laboratory, microscopic, microscopy, anatomy, body, human body, organ, tissue, health, wellness, prevention, cure, immunity, immune system, virus, infection, pathogen, microbe, bacteria, diagnosis, genetic, mutation, abnormality, abnormal, development, scientific research, pharmaceutical, pharmacy",16,2025-03-29
238809_698c99ae-22ce-4088-b547-d0df4b2320b6.jpg,"Detailed Microscopic Image of Cells, Perfect for Medical, Science or Pharmaceutical Background","Detailed Microscopic Image of Cells, Perfect for Medical, Science or Pharmaceutical Background","cell, cellular, microscopic, biology, biological, science, scientific, medical, medicine, research, laboratory, scientific research, healthcare, biotechnology, pharmaceutical, molecular, biochemistry, microbiology, genetics, virology, immunology, pathology, physiology, anatomy, histology, cytology, biomedical, pharmacology, diagnosis, treatment, prevention, disease, illness, infection, virus, bacteria, organism, microbe, tissue, structure, detail, magnification, closeup, abstract, pink, purple, texture, surface, background, artistic",16,2025-03-29
