Filename,Title,Description,Keywords,Category,Release(s)
241433_7382da6a-2398-4464-a9e8-919dab315f2b.jpg,"Microscopic View of Living Cells: Biology, Medicine, and Scientific Research","Microscopic View of Living Cells: Biology, Medicine, and Scientific Research","cell, cells, living cell, biology, cellular, biological, microbiology, microscopic, molecule, biotechnology, biotech, science, scientific, medical, medicine, health, healthcare, pharmaceutical, pharmacy, research, laboratory, disease, virus, illness, infection, blood, bloodstream, tumor, cancer, anatomy, physiological, physiology, organism, membrane, nucleus, cytoplasm, division, dna, rna, microorganism, pathogen, immune system, immunity, antibody, treatment, diagnosis, healthcare, biomedical, microscopic view, human biology",16,2025-03-30
241434_cfb0d589-2771-4b47-8846-c2e9df0bd2b7.jpg,"Conceptual image of neuron, nerve cells transmitting signals. Brain and neurological activity","Conceptual image of neuron, nerve cells transmitting signals. Brain and neurological activity","nerve cell, neuron, nerve, brain cell, neural, neural network, nervous system, nerve fiber, neuroscience, neurology, axon, dendrite, synapse, cell body, myelin sheath, glia, nodes of Ranvier, nerve impulse, neurotransmitter, neurotransmission, brain, spinal cord, central nervous system, peripheral nervous system, biology, medicine, science, research, anatomy, physiology, health, healthcare, disease, diagnosis, treatment, medical, pharmaceutical, pharmacy, biotechnology, genetic, genome, chromosome, dna, microbiology, virus, bacteria, infection, immunity, antibody, vaccine",16,2025-03-30
241435_69186faa-6f4b-4084-b033-b5a088adf3f3.jpg,Detailed Microscopic View of Viral Pathogen for Science and Medical Background,Detailed Microscopic View of Viral Pathogen for Science and Medical Background,"virus, viruses, viral, microbiology, microscopic, pathogen, disease, infection, contagion, pandemic, epidemic, illness, sickness, health, medical, medicine, research, science, scientific, laboratory, biology, biological, closeup, macro, organism, cell, cells, structure, molecular, anatomy, biotechnology, pharmaceutical, healthcare, diagnosis, treatment, vaccine, immunology, spike protein, membrane, replication, mutation, variant, outbreak, microbe, germ, toxic, toxicology, contaminate, contamination",16,2025-03-30
241440_9f34015f-022d-4289-a20c-2a9ad59b1208.jpg,"Neurons conveying signals in the brain, depicting the nervous system and communication network","Neurons conveying signals in the brain, depicting the nervous system and communication network","neuron, nerve cell, nerve, brain, neural, neurology, cell, biology, science, medicine, anatomy, dendrite, synapse, axon, spinal cord, nervous system, human, body, healthcare, research, scientific, medical, microscopic, microbiology, molecular, biotechnology, pharmaceutical, pharmacy, disease, illness, treatment, diagnosis, health, wellness, connection, network, communication, signal, transmit, neural network, artificial intelligence, ai, machine learning, technology, digital, abstract, futuristic, background, illustration, render",16,2025-03-30
241441_191e6e68-9e0a-4ee4-b58d-749c6a2dd140.jpg,Group of Native People in Traditional Dress with Feather Headdresses at Mountain Scene,Group of Native People in Traditional Dress with Feather Headdresses at Mountain Scene,"native people, native american, native, indigenous people, indigenous culture, cultural heritage, cultural tradition, cultural, tradition, traditional, traditional clothing, traditional dress, traditional costume, clothing, costume, dress, traditional headdress, headdress, feather headdress, feather, feathers, headwear, headpiece, flower crown, flower, flowers, jewelry, necklace, earrings, portrait, people, group of people, group, women, woman, mountains, mountain range, mountain, snowy mountains, snowy mountain, outdoor, outdoors, scenic, landscape, nature, sunlight, bright, daylight, day",15,2025-03-30
241442_b6fcf4f4-d380-461c-91de-fae37a72ce69.jpg,Fresh Produce Display with People Preparing Healthy Food in Kitchen,Fresh Produce Display with People Preparing Healthy Food in Kitchen,"fresh produce, garden harvest, organic food, farm to table, healthy eating, wholesome, nutritious, raw, vegetarian, vegan, plant based diet, ingredients, broccoli, tomatoes, carrots, raspberries, blueberries, oranges, citrus fruits, berries, root vegetables, garden greens, parsley, leafy greens, food preparation, cooking, kitchen, people, preparing food, chef, cook, culinary, dining, table, window, countertop, shelf, indoor, daylight, nutrition, diet, wellness, vibrant, colorful, still life, health, freshness, natural, abundance, community",7,2025-03-30
241443_c1f2aa4f-e561-46b4-9e1f-1d32442d413c.jpg,Detailed Microscopic Render of Cells for Scientific Research and Medical Visualization,Detailed Microscopic Render of Cells for Scientific Research and Medical Visualization,"cell, cells, cellular, biological cell, human cell, microscopic, microscopy, science, scientific, biology, biologic, medicine, medical, research, scientific research, nucleus, nuclei, membrane, cellular membrane, cytoplasm, DNA, molecule, molecules, molecular, biotechnology, biotech, genetic, genetics, genome, biomedical, healthcare, pharmaceutical, pharmacy, disease, illness, infection, virus, bacteria, microorganism, anatomy, physiology, diagnosis, treatment, therapy, laboratory, healthcare innovation, microbiology, pathology",16,2025-03-30
241447_b4070625-4431-4860-8bb5-ad0c945ccf12.jpg,"Diverse group gardening together in a sunny urban garden,planting seedlings & promoting community","Diverse group gardening together in a sunny urban garden,planting seedlings & promoting community","gardening, garden, community garden, urban gardening, volunteers, volunteerism, group, teamwork, planting, seedlings, plants, vegetables, herbs, soil, earth, tending, cultivating, cultivation, horticulture, sustainable living, organic gardening, eco-friendly, environmental, nature, outdoors, sunlight, daylight, park, city park, urban, community, people, men, women, adults, young adults, smiling, happy, cheerful, positive, growth, developing, nurturing, caring, togetherness, collaboration, cooperation, lifestyle, healthy lifestyle, well-being",12,2025-03-30
241456_2e6675e6-9256-474e-a366-8e20cfcb465d.jpg,"Team of Volunteers Cleaning Beach from Waste, Environmental Protection, Ocean Conservation, Pollution Reduction. ","Team of Volunteers Cleaning Beach from Waste, Environmental Protection, Ocean Conservation, Pollution Reduction. ","beach cleanup, beach clean, ocean cleanup, environmental cleanup, community cleanup, beach conservation, ocean conservation, environmental conservation, volunteer work, community service, eco-friendly, environmental awareness, sustainability, responsible tourism, eco-tourism, beach pollution, ocean pollution, plastic pollution, waste management, recycling, environmental protection, conservation efforts, group effort, teamwork, community involvement, social responsibility, environmental stewardship, beachgoers, ocean lovers, nature enthusiasts, clean environment, pristine beach, clear water, sunny day, coastal landscape, sand, shoreline, ocean, sea, coast, waste, litter, garbage, trash, plastic, bags, gloves, volunteers, people, adults",5,2025-03-30
241449_3186c2fe-1152-42aa-beb5-ca4696f8340a.jpg,"Diverse group of school children practice meditation to promote relaxation, focus, and mental well-being.","Diverse group of school children practice meditation to promote relaxation, focus, and mental well-being.","children, kids, students, pupils, classroom, school, meditation, mindfulness, relaxation, calm, concentration, focus, inner peace, well-being, health, wellness, learning, education, elementary school, primary school, youth, young, group, class, harmony, serenity, quiet, silence, awareness, present moment, mindful, contemplation, reflection, introspection, peaceful, tranquil, balanced, centered, conscious, spiritual, inner self, mental health, emotional health, stress relief, coping, classroom setting, school environment, childhood, youth development, student life",13,2025-03-30
241461_1973dd82-426f-44cb-ba18-550abb3358ee.jpg,Volunteers Collect Waste Glass For Recycling To Support Environment - Environmental Awareness And Eco-Friendly Lifestyle,Volunteers Collect Waste Glass For Recycling To Support Environment - Environmental Awareness And Eco-Friendly Lifestyle,"cleanup, recycling, garbage collection, waste management, environmental stewardship, sustainability, community involvement, volunteer work, park cleanup, eco-friendly, going green, responsible disposal, conservation, protecting nature, public service, environmental awareness, ecological balance, glass recycling, collecting trash, waste reduction, litter removal, park maintenance, civic duty, environmental action, recyclable materials, pollution control, eco-conscious, environmental health, green living, dumping trash, eco-system, community, family, people, group, outdoors, park, grass, nature, summer, daylight, sunlight, sunshine, environment, volunteer, donation, collect, gathering, teamwork",5,2025-03-30
241448_1ffbe7b7-a762-45aa-abbf-22675b5cee88.jpg,Vibrant fresh produce on display at bustling outdoor farmers market ,Vibrant fresh produce on display at bustling outdoor farmers market ,"farmers market, outdoor market, fresh produce, local market, food market, vegetables, fresh vegetables, organic vegetables, tomatoes, cherry tomatoes, red tomatoes, ripe tomatoes, cucumbers, green cucumbers, small cucumbers, potatoes, red potatoes, new potatoes, yellow tomatoes, green tomatoes, ripe produce, food, healthy food, fresh food, organic food, farm fresh, locally grown, local produce, seasonal produce, harvest, market stall, market vendor, people, shopping, customer, daylight, daytime, summer, grocery, nutrition, diet, culinary, ingredients, food photography, healthy lifestyle, vegetarian, vegan, farmers, selling, basket",7,2025-03-30
241452_edcb568a-2fd6-46ed-8365-d29157a1ad69.jpg,"Community Volunteers Cleaning Park: Group Collects Trash, Environmental Stewardship","Community Volunteers Cleaning Park: Group Collects Trash, Environmental Stewardship","community cleanup, park cleanup, environmental cleanup, volunteer work, volunteering, group activity, outdoor activity, community service, trash collection, waste removal, litter removal, garbage collection, park maintenance, public service, environmental protection, conservation, eco-friendly, ecological, green initiative, clean environment, environmental awareness, sustainability, responsible citizenship, community involvement, public park, green space, park landscape, urban park, city park, outdoor recreation, sunny day, sunlight, daylight, people gathering, group of people, public event, community event, volunteer event, outdoor gathering, wearing sunglasses, casual wear, denim jeans, jacket, green bag, plastic bag, trash bag, collecting trash, picking up litter, earth day",12,2025-03-30
241463_038ed371-d53d-416c-be75-48d849efa06a.jpg,Eco-Friendly Cityscape: Wind Turbines and Green Spaces for a Sustainable Future,Eco-Friendly Cityscape: Wind Turbines and Green Spaces for a Sustainable Future,"wind turbines, wind farm, renewable energy, clean energy, green energy, sustainable energy, alternative energy, eco-friendly, environmentally friendly, energy conservation, sustainability, green technology, ecological, ecology, eco, conservation, environmental, cityscape, urban landscape, city skyline, metropolis, downtown, skyscrapers, high-rise buildings, modern architecture, urban environment, built environment, green space, park, trees, nature, landscape, scenic, outdoors, daylight, daytime, sunshine, sky, clouds, horizon, future, futuristic, innovation, technology, progress, development, advancement, modern, contemporary",5,2025-03-30
241468_b2946cc3-0ab3-4899-ae4f-52e7b9355332.jpg,People preparing fresh vegetables for a meal together in kitchen.,People preparing fresh vegetables for a meal together in kitchen.,"cooking, cookery, food preparation, preparing food, culinary, kitchen, chef, chefs, cook, cooks, vegetables, produce, fresh vegetables, ingredients, food ingredients, healthy, healthful, wellness, wholesome, nutrition, nutritious, diet, dieting, salad, salads, tomato, tomatoes, cherry tomato, cherry tomatoes, lettuce, leafy greens, knife, cutting, chop, chopping, cutting board, food, cuisine, dining, eat, eating, meal, nourishment, close-up, indoors, people, table, counter, apron, organic",7,2025-03-30
241470_68208a69-6a74-4406-be94-dd5f8923fce6.jpg,Earth and Gas Giants: A Cosmic Gathering of Worlds in the Vast Expanse of Outer Space,Earth and Gas Giants: A Cosmic Gathering of Worlds in the Vast Expanse of Outer Space,"planet, planets, solar system, universe, outer space, space, Earth, Earth-like planet, Earth-like, Jupiter, Jupiter-like planet, Jupiter-like, gas giant, gas giants, world, worlds, celestial body, celestial bodies, astronomy, science, scientific, cosmic, cosmos, planetary, globe, globes, sphere, spheres, orbit, orbits, galaxy, galaxies, exploration, discovery, nebula, stars, starfield, atmosphere, surface, orbital, cosmology, astrophysics, exploration, scientific, abstract, artistic, background, backdrop, backdrop",11,2025-03-30
241464_6bb6566f-7671-4469-9d3a-c649c7e8fbde.jpg,Volunteers Pack Fresh Produce and Canned Goods for Food Bank Charity Drive,Volunteers Pack Fresh Produce and Canned Goods for Food Bank Charity Drive,"volunteers, food bank, food drive, charity, community, donation, nonprofit, giving, assistance, aid, support, help, fresh produce, vegetables, fruits, healthy food, nutrition, tomatoes, broccoli, zucchini, parsley, peppers, citrus fruits, canned goods, food items, groceries, food, distribution, packing, sorting, boxes, warehouse, indoors, people, men, women, teamwork, collaboration, effort, diversity, aprons, uniforms, generosity, kindness, compassion, hope, well-being, giving back, social responsibility, nutrition assistance",7,2025-03-30
241472_7f59da6b-846a-474e-82ef-5df78f0f6a9c.jpg,"Cosmic Nebula with Interstellar Planets and Energy Streams, Abstract Sci-Fi Universe Background","Cosmic Nebula with Interstellar Planets and Energy Streams, Abstract Sci-Fi Universe Background","space, universe, cosmic, cosmos, galaxy, interstellar, planetary system, celestial, astronomy, outer space, exploration, science, science fiction, sci-fi, futuristic, abstract, planet, planets, orbital, sphere, spherical, nebula, starfield, star, stars, light, energy, plasma, glow, glowing, radiant, sparkle, sparkling, connection, network, neural network, technology, digital, artificial intelligence, ai, futuristic technology, background, backdrop, wallpaper, design, art, illustration, render, creative, dreamlike",11,2025-03-30
241466_939efb51-52e0-4f66-b878-98316cc28429.jpg,People Gardening Together in Raised Flower Beds with Colorful Blossoms Under Sunlight,People Gardening Together in Raised Flower Beds with Colorful Blossoms Under Sunlight,"gardening, garden, community garden, urban gardening, flower bed, raised bed, raised garden bed, flowers, colorful flowers, orange flowers, purple flowers, planting, garden plants, garden flora, horticulture, cultivation, hands, gardener, gardeners, group, group of people, teamwork, collaboration, cooperation, growing, growth, cultivate, garden soil, garden ground, fresh, spring, summer, outdoors, daylight, sunny, sunshine, natural, nature, environment, sustainable, sustainability, organic, eco-friendly, healthy lifestyle, well-being, agriculture, botany, flora, rural, seasonal",14,2025-03-30
241477_ee5340b4-eba8-467c-91bb-c304ed7f49c1.jpg,"Detailed 3D Render of Virus Cells: Microbiology, Disease, Scientific Visualization","Detailed 3D Render of Virus Cells: Microbiology, Disease, Scientific Visualization","virus, viruses, microscopic, microbiology, virology, infection, pandemic, epidemic, disease, illness, contagion, pathogen, germ, microbe, organism, cell, cells, biology, science, scientific, research, medical, medicine, healthcare, pharmaceutical, diagnosis, treatment, laboratory, molecule, molecular, anatomy, physiology, toxic, toxicology, threat, hazard, risk, danger, flu, cold, sickness, ailment, contaminate, contamination, spread, replication, immune, immunity, prevention, vaccine",16,2025-03-30
241476_f587def3-eb00-49fb-90b2-d0295afc2b80.jpg,"Microscopic View of Cells: Biological, Scientific, Medical Research, and Biotechnology Illustration","Microscopic View of Cells: Biological, Scientific, Medical Research, and Biotechnology Illustration","cell, cells, cellular, microscopic, microbiology, biological, biology, science, scientific, medical, medicine, research, biotechnology, biotech, laboratory, anatomy, human anatomy, body, human body, tissue, organ, membrane, nucleus, cytology, cytological, immunology, virology, bacteriology, pathology, disease, illness, health, healthcare, pharmaceutical, pharmacy, vaccine, virus, infection, diagnosis, therapy, treatment, microorganism, molecule, dna, rna, gene, genes, genome, genetic",16,2025-03-30
241474_78fe307e-ba6d-48a7-91de-f5256a1f055d.jpg,"Vision of a futuristic eco-city with green buildings, renewable energy, and modern sustainable architecture.","Vision of a futuristic eco-city with green buildings, renewable energy, and modern sustainable architecture.","futuristic city, eco-city, sustainable city, green city, ecological city, eco-friendly city, cityscape, urban landscape, city view, modern architecture, futuristic architecture, sustainable architecture, green architecture, eco-architecture, building, skyscraper, high-rise building, vertical garden, green building, ecological building, urban greenery, city park, green space, river, water canal, urban river, bridge, pedestrian bridge, sky bridge, renewable energy, wind turbine, clean energy, sustainable energy, eco-power, solar panels, future technology, innovation, development, eco-friendly, sustainability, environmental, ecology, urban planning, city planning, landscape design, architecture design, modern design, future, daylight",11,2025-03-30
241478_ab76f33e-ccbb-404e-9c30-608a74feeaee.jpg,Female Scientist Examining Digital Cell Hologram in Lab for Medical Research and Diagnosis,Female Scientist Examining Digital Cell Hologram in Lab for Medical Research and Diagnosis,"scientific research, scientific study, research, study, science, medical, medicine, biology, biotechnology, woman, female, scientist, researcher, doctor, laboratory, lab, experiment, analysis, cell, cells, nerve cell, neurons, neuron, digital, hologram, virtual, futuristic, technology, innovation, discovery, data, healthcare, pharmaceutical, pharmacy, diagnosis, treatment, genetic, molecular, dna, microscopic, microbiology, microscope, development, scientific equipment, equipment, modern, advanced, professional, expertise, clinic",16,2025-03-30
241480_195eaec0-4685-4e53-854f-e1e53287536c.jpg,Abstract DNA strand with double helix structure for science and medical research,Abstract DNA strand with double helix structure for science and medical research,"DNA, double helix, genetic code, gene, genes, genetics, strand, chromosome, chromosomes, molecular, molecule, molecules, biology, biochemistry, biotech, biotechnology, scientific, science, medical, medicine, research, laboratory, healthcare, pharmaceutical, diagnosis, helix, spiral, abstract, structure, pattern, cell, cellular, genome, microscopic, bacterial, viral, virus, anatomy, life, artificial, futuristic, digital, rendering, nanotechnology, nanotech, chemistry, scientific research, health, illustration",16,2025-03-30
241481_5cf4d134-b5a5-4bd7-8319-76747ace1f3e.jpg,"Diverse women mural, illustration. Female faces of different ethnicities. Beauty, unity, and inclusion.","Diverse women mural, illustration. Female faces of different ethnicities. Beauty, unity, and inclusion.","diversity, diverse women, women, woman, multiethnic, multicultural, female, girls, girl, people, person, portraits, portrait, face, faces, artwork, art, painting, illustration, wall art, street art, mural, urban art, creative, artistic, individuality, unique, culture, ethnicities, representation, empowerment, feminism, sisterhood, community, inclusion, humanity, beauty, beautiful, fashion, style, modern, contemporary, graphic, vibrant, colorful, friendship, togetherness, unity, support",13,2025-03-30
241483_e8a975e2-26f9-4f46-93cb-e977be2e1000.jpg,"Close-up visualization of virus infectious cell, microbiology medical science","Close-up visualization of virus infectious cell, microbiology medical science","virus, viruses, microscopic, microbiology, virology, disease, infection, pandemic, epidemic, contagion, illness, sickness, pathogen, germ, microorganism, cell, cells, molecule, scientific, science, medical, medicine, research, healthcare, biology, biotechnology, pharmaceutical, pharmacy, laboratory, analysis, diagnosis, treatment, cure, prevention, vaccine, immunity, immune system, antibodies, healthcare, anatomy, physiology, organism, structure, nucleus, membrane, replication, genetic, dna, rna",16,2025-03-30
241484_eddd009a-eaaf-4e43-9abb-e704694046cd.jpg,Diverse Community in a Sustainable Cityscape with Solar Panels and Green Spaces,Diverse Community in a Sustainable Cityscape with Solar Panels and Green Spaces,"community, neighborhood, cityscape, urban environment, sustainable city, eco-friendly, green living, eco-conscious, environmental awareness, solar panels, renewable energy, eco-buildings, green architecture, sustainable buildings, modern buildings, urban buildings, residential buildings, homes, houses, families, diversity, people, adults, children, happy people, multicultural, community gathering, urban park, green space, city life, healthy lifestyle, outdoor activities, street scene, friendly environment, urban community, town, city, buildings, architecture, trees, plants, nature, solar energy, urban planning, city planning, development, sustainable development, artwork, illustration",5,2025-03-30
241490_427c9552-506d-429c-b9ac-f6c00b3e8961.jpg,"Abstract Detailed DNA Molecule Double Helix Structure, Scientific Research, Biotech, Genetics, Genome Illustration","Abstract Detailed DNA Molecule Double Helix Structure, Scientific Research, Biotech, Genetics, Genome Illustration","DNA, molecular, molecule, strand, genetic, genome, genes, genetics, helix, spiral, double helix, science, scientific, research, biology, biological, biotechnology, biotech, medicine, medical, pharmaceutical, healthcare, genealogy, anatomy, structure, cellular, chromosome, nucleic acid, deoxyribonucleic acid, heredity, inheritance, code, information, data, pattern, abstract, futuristic, innovation, technology, digitally generated, rendering, illustration, close-up, macro, detail, complex, twisting, spiraling, orange, blue",16,2025-03-30
241485_1f4cd14d-49b0-4c98-a8da-44cff05df3df.jpg,"Microscopic View of Cells with Bioluminescent Centers in a Soft, Blue Environment","Microscopic View of Cells with Bioluminescent Centers in a Soft, Blue Environment","cell, cells, cellular, molecule, molecular, microscopic, science, scientific, research, medical, medicine, biology, biological, biotechnology, biotech, pharmaceutical, pharmacy, virus, viruses, bacterium, bacteria, infection, infectious, disease, illness, health, healthcare, microbiology, microbe, microbes, pathogen, pathogens, immune system, immunology, vaccine, vaccination, therapy, treatment, diagnosis, diagnostic, laboratory, experiment, blue, red, sphere, abstract, render, digital art",16,2025-03-30
241487_b441ba0e-7432-4594-9789-d55d6a67c29e.jpg,"Detailed Microscopic Rendering of Virus, Germ or Pathogen Under Magnification","Detailed Microscopic Rendering of Virus, Germ or Pathogen Under Magnification","virus, viruses, microbiology, virology, bacteriology, germ, germs, infection, infections, pathogen, pathogens, contagion, contagions, disease, diseases, illness, illnesses, sickness, sicknesses, medical, medicine, scientific, science, healthcare, healthcare, microscopic, closeup, closeup, cell, cells, molecule, molecules, biology, biological, scientific research, research, laboratory, lab, vaccine, vaccines, antibody, antibodies, immunity, immune system, epidemic, pandemic, microorganism, microorganisms, 3d rendering, rendering",16,2025-03-30
241486_b6277494-41c5-47b5-af15-cf185641a68c.jpg,"Bustling City Street Market with Crowds of People, Vendors, and Local Commerce in a Picturesque Urban Setting","Bustling City Street Market with Crowds of People, Vendors, and Local Commerce in a Picturesque Urban Setting","outdoor market, street market, farmers market, marketplace, market, city market, bazaar, pedestrian street, city street, urban street, main street, town square, cityscape, urban landscape, townscape, street scene, people, crowd, pedestrians, market stalls, market vendors, shopping, commerce, trade, local business, small business, city life, urban living, community, gathering, socializing, daytime, sunlight, sunny day, golden hour, street photography, architecture, buildings, urban buildings, brick buildings, street view, outdoor setting, open air, public space, tourism, travel, city travel, town travel, urban exploration",12,2025-03-30
