Filename,Title,Description,Keywords,Category,Release(s)
239395_79ba6cfc-30ae-4b4d-bbc2-c3f6561076ee.jpg,"Hot cup of blooming tea with steam on table. Herbal, aromatic beverage for wellness, relaxation and calmness","Hot cup of blooming tea with steam on table. Herbal, aromatic beverage for wellness, relaxation and calmness","tea, herbal tea, flower tea, blooming tea, cup, cup of tea, tea cup, drink, hot drink, beverage, hot beverage, spoon, tablespoon, table, wooden table, relax, relaxation, calm, wellness, well-being, health, healthy, healthcare, aroma, aromatic, fragrant, steam, steaming, hot, warm, cozy, comfort, refreshment, refreshing, saucer, porcelain, ceramic, minimal, minimalist, simplicity, bokeh, out of focus, background, backdrop, still life, indoor, closeup, nutrition, diet, lifestyle",7,2025-03-29
239391_b9e1852d-0558-4e0e-9680-d8ed81f316a1.jpg,Fresh and Colorful: A Vibrant Assortment of Fruits and Vegetables for a Healthy Diet,Fresh and Colorful: A Vibrant Assortment of Fruits and Vegetables for a Healthy Diet,"vegetables, produce, fresh produce, fresh vegetables, healthy food, healthy eating, healthy lifestyle, food, organic, colorful, nutrition, still life, still life photography, fruits, berries, pepper, bell pepper, red bell pepper, yellow bell pepper, tomato, red tomato, cherry tomato, parsley, curly parsley, lemon, orange, zucchini, cucumber, apple, red apple, strawberry, raspberries, blueberries, vegan, vegetarian, vitamins, antioxidants, raw, raw food, diet, dieting, ingredient, ingredients, culinary, culinary arts, food photography, studio shot, wooden surface, tabletop",7,2025-03-29
239390_e59cac8b-4feb-457c-b8e2-8dfe88f43530.jpg,"Two beautiful women doing yoga with eyes closed, promoting mindfulness, wellness, and serenity","Two beautiful women doing yoga with eyes closed, promoting mindfulness, wellness, and serenity","yoga, yogini, meditation, mindfulness, wellness, health, fitness, well-being, inner peace, balance, relaxation, serenity, harmony, calm, tranquility, spiritual, practice, asana, mudra, pose, exercise, women, two people, indoors, studio shot, lifestyle, healthy lifestyle, active lifestyle, zen, mind-body, consciousness, self-care, plant, home, room, light, window, floor, daylight, apartment, modern, interior, domestic life, portrait, face, close-up, sitting, eyes closed, beautiful",18,2025-03-29
239398_8053803c-0515-44cf-bfc0-03d80b1da202.jpg,Sun-Kissed Green Rolling Hills Landscape with Distant Mountains and Trees,Sun-Kissed Green Rolling Hills Landscape with Distant Mountains and Trees,"landscape, rolling hills, green hills, scenic landscape, idyllic landscape, pastoral landscape, rural scene, countryside, tranquil scene, serene, peaceful, morning light, golden hour, sunrise, sunshine, misty, haze, atmospheric, trees, grassland, meadow, fields, open field, valley, distant mountains, horizon, vista, view, nature, natural, outdoors, environment, ecology, conservation, sustainable, green, lush, vibrant, fresh, calm, quiet, solitude, escape, getaway, travel, tourism, destination, idyllic, harmony, beauty",11,2025-03-29
239399_64447d6f-853a-46c6-bf0c-583d1772d7c5.jpg,Medical Professionals Reviewing Patient Data in a Bright Hospital Environment.,Medical Professionals Reviewing Patient Data in a Bright Hospital Environment.,"doctors, physicians, healthcare professionals, medical staff, medical team, hospital staff, medical personnel, healthcare team, health workers, nurse, nurses, healthcare, patient care, medical care, health care, hospital, clinic, medical facility, doctor, physician, medical professional, health professional, examination, diagnosis, treatment, medical consultation, patient information, medical record, medical chart, medical report, medical document, medical paperwork, staff, team, collaboration, teamwork, discussing, discuss, conversation, talking, communication, white coat, stethoscope, uniform, indoor, indoors, man, woman, adult",13,2025-03-29
239402_99a3d8e3-9cd3-4810-a5c0-8d8c3bd1c426.jpg,Smiling Senior Woman Chatting with Relative in Bright Living Room with Natural Light,Smiling Senior Woman Chatting with Relative in Bright Living Room with Natural Light,"senior woman, senior citizen, elderly woman, mature woman, older woman, elderly people, senior adults, mature adults, older adults, aging gracefully, aging, ageing, senior lifestyle, senior living, retirement, grandparent, grandmother, family, relationship, conversation, communication, social interaction, home, indoors, interior, living room, sitting, chair, comfort, cozy, window, natural light, daytime, warmth, nostalgia, memories, reminiscing, happiness, joy, contentment, well-being, respect, caring, love, support, companionship, togetherness, portrait, face, smile",13,2025-03-29
239406_f76fd8d2-aab9-455e-a38e-ed1a9e8b81ff.jpg,Glowing Points and Particles with Bokeh Effect for Abstract Background Design,Glowing Points and Particles with Bokeh Effect for Abstract Background Design,"abstract, glowing, lights, illumination, sparkling, vibrant, blurred, bokeh, background, wallpaper, design, graphic, art, modern, futuristic, digital, illustration, pattern, texture, surface, element, backdrop, template, presentation, banner, cover, card, poster, web, page, creative, decorative, ornate, stylish, elegant, artistic, concept, fantasy, dreamlike, ethereal, celestial, space, universe, cosmos, night, dark, deep, scene, backdrop, display",8,2025-03-29
239411_16ffb729-5555-4fe0-a517-9355a30724bb.jpg,"Tranquil Lakeside Tree at Sunrise: Still Water Reflection, Serene and Peaceful Nature Landscape","Tranquil Lakeside Tree at Sunrise: Still Water Reflection, Serene and Peaceful Nature Landscape","tree, trees, single tree, solitary tree, lake, lakeside, waterside, reflection, water reflection, lake reflection, sunrise, sunset, morning, dawn, dusk, tranquil, serene, peaceful, calm, mist, fog, misty, foggy, silhouette, nature, landscape, scenic, idyllic, beautiful, horizon, sky, hillside, hill, grass, foliage, rural, countryside, outdoors, environment, light, golden light, sunlight, daylight, dreamy, atmospheric, twilight, season, woodland, backdrop, background",11,2025-03-29
239407_93aec443-c4d3-4cc5-af01-fa0c36561183.jpg,Spiderweb Covered in Dew Drops Shimmers in the Morning Sun,Spiderweb Covered in Dew Drops Shimmers in the Morning Sun,"spiderweb, spider web, cobweb, dew, dewdrops, water droplets, nature, outdoor, macro, close-up, morning, sunrise, sunlight, golden light, golden hour, light, shining, glowing, shiny, grass, green, meadow, field, flora, botany, natural, environment, webs, orb web, spider silk, arachnid, animal, wildlife, insect, insect web, arachnophobia, pattern, texture, background, detail, delicate, fragile, woven, trap, threads, geometric, design, art, artistic, garden",1,2025-03-29
239404_c0c26e1c-4e5a-4a0a-9d13-3967c91bd126.jpg,"Scientists conducting research in a modern laboratory, utilizing microscopes and analyzing data on display screens.","Scientists conducting research in a modern laboratory, utilizing microscopes and analyzing data on display screens.","scientists, researchers, medical professionals, lab, laboratory, research, scientific research, medical research, science, scientific, medicine, medical, microscope, technology, data, analysis, analytics, experiment, clinical trial, pharmaceutical, pharmaceuticals, healthcare, health, innovation, discovery, development, diagnosis, treatment, disease, modern, futuristic, high tech, team, collaboration, white coat, uniform, professional, expertise, expertise, learning, studying, education, university, college, graphs, charts, data visualization, screen, display, monitor",16,2025-03-29
239414_518fa20e-86f3-4f9d-8a23-98a2103b3735.jpg,"Serene Woman Enjoying Nature's Beauty, Basks in Sunlight Among Blooming Pink Flowers, Eyes Closed and Peaceful","Serene Woman Enjoying Nature's Beauty, Basks in Sunlight Among Blooming Pink Flowers, Eyes Closed and Peaceful","woman, asian woman, girl, young woman, young adult, relaxation, contentment, well-being, mindfulness, serenity, tranquility, peaceful, calm, zen, meditation, nature, outdoors, park, garden, flowers, pink flowers, floral, blossom, bloom, spring, summer, sunlight, sunshine, golden hour, light, soft light, dreamy, ethereal, beautiful, pretty, attractive, portrait, close-up, profile, eyes closed, smiling, happy, joyful, positive, healthy, wellness, lifestyle, daytime, background, scenery",13,2025-03-29
239423_90dcd048-7daa-4f1b-88b9-f3b93cd05a99.jpg,Woman meditating in a spa setting for wellness and mindfulness,Woman meditating in a spa setting for wellness and mindfulness,"woman, meditation, serenity, wellness, well being, calm, peace, mindfulness, relaxation, spiritual, health, healthy, spa, resort, retreat, robe, portrait, indoor, candlelight, candles, aroma, therapeutic, harmony, balance, inner peace, contemplation, consciousness, self-care, mental health, stress relief, holistic, lifestyle, beauty, beautiful, attractive, female, person, adult, young, caucasian, brunette, eyes closed, namaste, prayer, hands, zen, tranquil, spiritual practice, rejuvenation, positive energy",12,2025-03-29
239425_06a3ec0e-ac11-4247-b1dc-ae5ef7a284fb.jpg,"Natural Skincare Product Lineup on Wood with Botanical Accents, Serums, Creams, and Sustainable Packaging","Natural Skincare Product Lineup on Wood with Botanical Accents, Serums, Creams, and Sustainable Packaging","natural beauty, skincare, cosmetics, beauty products, organic beauty, natural skincare, green beauty, eco-friendly, sustainable beauty, clean beauty, beauty, skin, face care, body care, wellness, spa, aromatherapy, essential oils, botanical, herbal, aloe vera, plant based, vegan, cruelty free, natural ingredients, product photography, still life, wooden background, green background, nature, leaves, sunlight, serum, cream, lotion, moisturizer, packaging, bottles, jars, containers, label, branding, presentation, style, composition, copy space, health, lifestyle, well-being",12,2025-03-29
239415_9e3932be-6af0-4f71-97d7-8c63e80fb095.jpg,Abstract Watercolor Painting with Splashes and Drips on White Background Art Texture and Modern Design,Abstract Watercolor Painting with Splashes and Drips on White Background Art Texture and Modern Design,"abstract, watercolor, paint, art, background, texture, color, design, artistic, modern, illustration, creative, bright, colorful, pattern, graphic, image, backdrop, decorative, paper, ink, drawing, grunge, element, decoration, wall, vintage, style, surface, retro, template, art, canvas, art paint, artwork, stain, blot, smear, splash, dye, watercolor paint, water, wash, coloration, tinge, coloring material, pigment, fluid, stroke",8,2025-03-29
239418_71a3d17f-e0ba-4a9e-91ea-cd2c0c136e99.jpg,Sun Rays Through a Forest Path: A Golden Light Landscape,Sun Rays Through a Forest Path: A Golden Light Landscape,"forest, woods, woodland, trees, sunlight, sun, rays, sunbeams, light, golden light, path, trail, pathway, footpath, nature, landscape, scenery, environment, foliage, greenery, vegetation, plants, shrubs, undergrowth, woods environment, forest scene, woodland scene, bright, illuminated, glowing, warm, serene, tranquil, peaceful, idyllic, quiet, mist, fog, atmospheric, morning, sunrise, daylight, outdoors, beautiful, scenic, natural, rural, travel, adventure, exploration",11,2025-03-29
239417_6c6c6f24-986e-4927-b148-82a809132bff.jpg,Scenic River with Boulders and Sunlight in Forest Stream. Serene Landscape with Flowing Water,Scenic River with Boulders and Sunlight in Forest Stream. Serene Landscape with Flowing Water,"river, flowing water, stream, riverbed, rocky riverbed, rocks, boulders, stones, smooth rocks, smooth stones, pebbles, clear water, clean water, fresh water, water surface, water reflection, reflection, forest, trees, woodland, sunlight, sunbeams, sunrays, morning light, bright, peaceful, tranquil, serene, idyllic, scenic, landscape, nature, outdoors, environment, daylight, daytime, summer, green, moss, grass, vegetation, bank, shore, waterside, natural, untouched, pristine, calming, relaxing",11,2025-03-29
239426_0e1a2565-733f-4686-8f74-93304e0f7a6c.jpg,Breakfast Bowl with Berries and Almonds in Bright Kitchen - Healthy Eating and Delicious Mix,Breakfast Bowl with Berries and Almonds in Bright Kitchen - Healthy Eating and Delicious Mix,"fruit bowl, berry bowl, fruit mix, berries, strawberries, blueberries, raspberries, sliced fruit, fresh fruit, mixed fruit, healthy food, healthy eating, healthy lifestyle, nutritious, nutrition, wellness, diet, antioxidants, vitamins, superfood, chia seeds, seeds, almonds, nuts, wooden spoon, kitchen setting, window light, bright, morning light, breakfast, table, countertop, minimalist, modern, indoors, still life, food photography, cooking, culinary, dish, ingredient, food preparation, recipe, refreshing, delicious, tasty, sweet, natural, organic, lemon",7,2025-03-29
239428_f216ce44-716d-4408-ac57-a34c40ecfaf9.jpg,Medical Team Analyzing Brain Scan on Futuristic Hologram Interface in Hospital. Advanced tech meeting,Medical Team Analyzing Brain Scan on Futuristic Hologram Interface in Hospital. Advanced tech meeting,"medical team, healthcare team, doctors, nurses, medical professionals, health professionals, hospital staff, clinical staff, medical staff, surgery, surgical, surgeon, medicine, healthcare, medical, health, diagnosis, brain scan, brain health, neurology, neurological, brain, anatomy, futuristic, advanced technology, hi-tech, high tech, digital, modern, innovation, innovative, technology, interface, display, hologram, holographic, augmented reality, virtual reality, ar, vr, meeting, collaboration, teamwork, group, team, research, studying, analyzing, scrubs, uniform, hospital",16,2025-03-29
239430_1dcdcc3e-8ceb-4b77-9a1c-d50be4f3ebfc.jpg,Attentive Doctor Reviews Patient Record in Office at Night ,Attentive Doctor Reviews Patient Record in Office at Night ,"doctor, physician, medical professional, healthcare provider, male doctor, man, adult, middle-aged, examining, reviewing, reading, document, paperwork, medical record, patient file, office, desk, bookshelf, certificate, diploma, credentials, stethoscope, lab coat, tie, professional attire, serious, focused, concentrating, thoughtful, contemplative, clinical, medical, healthcare, medicine, expertise, knowledge, skill, competence, diagnosis, treatment, care, well-being, health, wellness, private practice, consultation, expertise, medical field, job",13,2025-03-29
239437_d3585810-9ce5-4353-9a38-8169447b6d12.jpg,Portrait of a thoughtful senior man with gray hair sitting in a leather chair at home.,Portrait of a thoughtful senior man with gray hair sitting in a leather chair at home.,"senior man, elderly man, older man, aged man, man, portrait, indoor portrait, mature, retirement, home, indoors, senior, elderly, older, aged, pensive, thoughtful, contemplative, reflective, calm, peaceful, serene, cozy, comfortable, classic, library, bookshelf, books, book, chair, armchair, leather chair, lamp, window, natural light, living room, home interior, domestic life, sitting, relaxed, gray hair, white hair, beard, facial hair, sweater, warm clothing, reading, literature, wisdom",13,2025-03-29
239436_d4cc6395-9e5c-4326-bbed-1e229dfc943a.jpg,"Business team collaborates in modern office space near whiteboard, discussing strategy and project data with charts.","Business team collaborates in modern office space near whiteboard, discussing strategy and project data with charts.","business, team, meeting, office, collaboration, corporate, group, discussion, work, coworkers, employees, staff, executives, professionals, whiteboard, presentation, planning, strategy, ideas, brainstorming, communication, leadership, success, project, analysis, data, charts, graphs, notes, sticky notes, urban, cityscape, indoor, modern, workspace, positive, cheerful, smiling, happy, confident, motivated, engaged, enthusiastic, diverse, equality, opportunity, career, job, growth",3,2025-03-29
239431_edae8003-c220-42b3-972b-438630f8a483.jpg,Busy Hospital Intensive Care Unit with Medical Staff Attending to Patients,Busy Hospital Intensive Care Unit with Medical Staff Attending to Patients,"hospital, hospital ward, intensive care unit, ICU, medical, healthcare, patient, treatment, emergency, clinic, doctor, nurse, medical staff, medical team, care, health, medicine, recovery, illness, disease, sick, injured, diagnosis, therapy, clinical, beds, medical beds, equipment, medical equipment, monitoring, vital signs, technology, screen, modern, sterile, clean, urgent, critical, life support, uniform, medical gown, blur, motion blur, interior, indoor, people, professional, aid, assistance, wellness",13,2025-03-29
239435_14775662-815a-4cb6-a709-b7c3968aa0db.jpg,Vibrant Echeveria Succulent with Red Tips and Water Droplets in Desert Rock Garden,Vibrant Echeveria Succulent with Red Tips and Water Droplets in Desert Rock Garden,"Echeveria, succulent, plant, succulent plant, echeveria succulent, green, succulents, red tips, water droplets, dew drops, dew, flora, botany, botanical, garden, gardening, small, miniature, rocks, stone, gravel, desert, southwest, southwestern, arid, dry, environment, texture, background, natural, growth, vibrant, vivid, closeup, macro, detail, pattern, bright, outdoor, sunny, daylight, sunlight, beautiful, pretty, decorative, wild, wildlife, unique, colorful, isolated, tropical",14,2025-03-29
239454_bd383a8e-26ec-459f-97db-06c7542a373c.jpg,"Intricate Gear Mobile: Metallic Cogwheels Hanging in Dark Studio, Industrial Mechanism Design","Intricate Gear Mobile: Metallic Cogwheels Hanging in Dark Studio, Industrial Mechanism Design","gear, gears, cogwheel, cogwheels, mechanical, mechanics, mechanism, metal, metallic, industry, industrial, machine, machinery, engineering, engineering, structure, design, connection, connect, element, component, part, motion, movement, symbol, abstract, vintage, retro, antique, old, classic, dark, black, background, shadow, illumination, light, spotlight, hanging, mobile, decorative, decoration, art, artistic, still life, still-life, studio shot, copy space, illustration, 3D rendering",8,2025-03-29
239439_b6054041-9e14-4245-81d9-090abf7b986c.jpg,Tree Silhouetted Against Dramatic Lightning Storm in Rainy Weather - Landscape,Tree Silhouetted Against Dramatic Lightning Storm in Rainy Weather - Landscape,"storm, thunderstorm, lightning, severe weather, rain, rainy, dark, night, tree, silhouette, nature, outdoors, landscape, field, hill, grass, sky, clouds, dramatic, eerie, ominous, scary, spooky, weather, climate, atmosphere, natural, environment, rural, countryside, season, seasonal, cold, water, droplets, precipitation, strike, electric, electricity, power, energy, dangerous, hazard, illumination, gloom, twilight, midnight, melancholy, moody",11,2025-03-29
239448_cc02582f-1568-4786-8fa2-78504fc16e4a.jpg,Clear Mountain River with Rocks and Sunlight Reflections on the Water Surface,Clear Mountain River with Rocks and Sunlight Reflections on the Water Surface,"mountain river, river, water, flowing water, clear water, fresh water, clean water, surface, water surface, stones, river stones, smooth stones, rocks, river rocks, smooth rocks, shoreline, riverbank, bank, river side, landscape, mountain landscape, nature, scenery, mountain scenery, mountains, hills, mountain range, green hills, blue sky, sky, sunny, sunlight, reflection, water reflection, sparkling water, sparkle, outdoor, daytime, tranquil, serene, peaceful, calm, idyllic, natural, environment, travel, destination, beautiful, relaxation, background",11,2025-03-29
239443_322ffc94-3ee7-4536-8dc9-c5eb50258d37.jpg,Interlocking Gold and Silver Gears: Mechanical Precision and Industrial Technology in Motion ,Interlocking Gold and Silver Gears: Mechanical Precision and Industrial Technology in Motion ,"gear, gears, cog, cogs, cogwheel, cogwheels, machine, machinery, mechanism, mechanisms, mechanical, engineering, technology, industry, industrial, automation, manufacturing, precision, system, metallic, metal, steel, iron, chrome, silver, gold, brass, bronze, coordination, collaboration, connection, linkage, interaction, interlock, interface, teamwork, process, motion, movement, rotation, turning, complex, intricate, detail, macro, close-up, abstract, render, illustration, design",10,2025-03-29
239461_64380fa8-e61d-4285-a2f0-31852050d16c.jpg,"Bonsai tree on river rocks at sunset, creating a zen and tranquil natural scene. Focus on foliage and reflection.","Bonsai tree on river rocks at sunset, creating a zen and tranquil natural scene. Focus on foliage and reflection.","bonsai, bonsai tree, miniature tree, small tree, dwarf tree, plant, botany, flora, foliage, leaf, leaves, green leaves, new leaves, rock, rocks, river rocks, pebbles, stones, river stones, water, reflection, sunset, sunrise, sun, sunlight, zen, tranquil, tranquility, serene, serenity, peaceful, peace, stillness, meditation, mindfulness, nature, outdoors, garden, asian, japanese, background, blur, blurred, close-up, macro, art, artistic, artful, creative, well-being",14,2025-03-29
239462_d8b3fc19-f70f-4f11-bbc2-5766df1e119b.jpg,Floating Island Castles Under a Celestial Sky: A Fantasy Landscape,Floating Island Castles Under a Celestial Sky: A Fantasy Landscape,"castle, fantasy, architecture, landscape, sky, clouds, bridge, sunset, dreamscape, fairytale, heavenly, ethereal, magic, whimsical, celestial, aurora, twilight, dawn, scenery, nature, travel, building, fortress, structure, island, cliff, water, river, reflection, people, silhouette, walkway, path, birds, flight, flying, portal, vortex, swirl, sun, light, gradient, horizon, vacation, destination, tourism, romantic, serene, peaceful, idyllic",11,2025-03-29
239464_d7fe349a-ead5-4beb-8113-01bba5289df5.jpg,Medical Team Analyzing Data on Tablets in Hospital Hallway for Enhanced Patient Care,Medical Team Analyzing Data on Tablets in Hospital Hallway for Enhanced Patient Care,"medical team, healthcare team, doctors, physicians, nurses, medical professionals, hospital staff, clinical staff, medical personnel, hallway consultation, medical discussion, patient care, medical review, teamwork, collaboration, diagnosis, medical tablets, digital health, electronic records, medical technology, medical data, stethoscope, lab coats, scrubs, hospital setting, clinic setting, healthcare facility, hospital corridor, clinic interior, medical center, modern medicine, health, medicine, patient safety, professional, expertise, advice, caucasian ethnicity, diverse team, adults, men, women, health care, medical field, analyzing, contemporary, indoor, well lit, serious, attentive",13,2025-03-29
239474_f489dd32-6a68-466e-9172-e2e7b9d0c5a7.jpg,Balancing Act: Colorful Abstract Floral Design on Seesaw for Equilibrium and Harmony Concept,Balancing Act: Colorful Abstract Floral Design on Seesaw for Equilibrium and Harmony Concept,"balance, balancing, equilibrium, harmony, scale, seesaw, abstract, abstract art, modern art, colorful, vibrant, bright, spectrum, spectrum colors, spectrum hues, geometric, geometric shapes, geometric form, symmetry, symmetric, symmetrical, shapes, form, floral, flower, lotus, petal, leaves, stylized, artwork, design, illustration, concept, conceptual, artistic, creativity, creative, ideas, symbol, decorative, graphic, element, minimalist, minimal, background, backdrop, still life, studio shot, cutout, composition",8,2025-03-29
239467_d598310a-c6b7-40eb-9982-1cf3a9c4d23e.jpg,Doctor and Businessman Meeting in Office Discussing Healthcare or Financial Matters,Doctor and Businessman Meeting in Office Discussing Healthcare or Financial Matters,"doctor, physician, medical professional, healthcare provider, businessman, executive, professional, adult, mature adult, senior, gray hair, meeting, consultation, conversation, discussion, office, interior, formal, business attire, suit, tie, lab coat, stethoscope, table, desk, paperwork, documents, report, financial, insurance, medical insurance, health insurance, agreement, contract, negotiation, advice, counseling, healthcare, medicine, business meeting, corporate, finance, banking, investment, wealth, success, achievement, expertise, professionalism, communication",3,2025-03-29
239468_ccfaacb9-6972-47da-9f20-320bde5bf2ea.jpg,Detailed 3D Rendering of a Double Helix DNA Structure for Scientific and Medical Visualizations,Detailed 3D Rendering of a Double Helix DNA Structure for Scientific and Medical Visualizations,"DNA, double helix, helix, genetic code, genes, genetics, molecule, molecular, science, scientific, research, biotechnology, biotech, biology, biological, medicine, medical, healthcare, pharmaceutical, pharmacy, genome, genomic, chromosome, deoxyribonucleic acid, nucleic acid, strand, cellular, cells, microscopic, nanotechnology, nanotech, engineering, dna structure, structure, spiral, 3d rendering, rendering, futuristic, abstract, illustration, digitally generated, conceptual, data, hightech, information, coding, complex, patterns, futurism",16,2025-03-29
239465_3088046a-6c21-41a9-8ede-9bbf614aa81d.jpg,"Gavel Resting on Books in Courtroom Setting: Symbol of Justice and Law. Legal, Ethical,and Jurisprudence","Gavel Resting on Books in Courtroom Setting: Symbol of Justice and Law. Legal, Ethical,and Jurisprudence","gavel, wooden gavel, judge, judgment, law, legal, justice, court, courthouse, legislation, attorney, lawyer, law books, books, rule of law, legal system, courtroom, advocacy, authority, government, constitution, parliament, legislation, verdict, sentence, criminal, crime, trial, appeal, litigation, jurisprudence, ethics, professional, documents, paperwork, contract, agreement, negotiation, signature, wood, wooden, desk, table, interior, indoor, closeup, still life, antique, vintage",3,2025-03-29
