Filename,Title,Description,Keywords,Category,Release(s)
240773_66c8ca2e-50f2-4e0c-a4e9-760b0568c57d.jpg,"Elegant Figure Skater in Motion on Ice Rink, Performing Beautifully for Crowd","Elegant Figure Skater in Motion on Ice Rink, Performing Beautifully for Crowd","figure skating, ice skating, skating, ice skater, figure skater, woman, female, girl, dress, performance, sport, ice, rink, stage, competition, athlete, dancing, dancer, artistic, professional, elegance, grace, beauty, skill, talent, studio shot, spotlight, motion, speed, training, winter, cold, indoors, event, exercise, recreation, entertainment, crowd, audience, show, art, art performance, skillful, fit, healthy, beautiful, young, person, adult, slim",18,2025-03-30
240779_a4f374e6-cef6-4404-a981-3538156eb281.jpg,Balanced Stones in Serene Spa Setting with Bamboo View for Relaxation and Wellness,Balanced Stones in Serene Spa Setting with Bamboo View for Relaxation and Wellness,"wellness, well-being, Zen, serenity, tranquility, mindfulness, harmony, balance, peace, calm, relaxation, meditation, contemplation, spiritual, spa, hot tub, jacuzzi, bath, bathing, stone, pebble, stack, stacked, arrangement, therapeutic, therapy, rejuvenation, renewal, nature, natural, bamboo, plant, green, window, indoor, interior, design, still life, candle, flame, light, warmth, shadow, reflection, water, pool, Asian, Japanese, artistic, minimalist",12,2025-03-30
240782_00dbb9d8-e3e2-4848-b5e3-276e1d083566.jpg,Tranquil Lotus Blossom in Glass Bowl at Sunrise: A Serene Reflection of Nature's Harmony,Tranquil Lotus Blossom in Glass Bowl at Sunrise: A Serene Reflection of Nature's Harmony,"lotus, water lily, aquatic plant, sacred lotus, nelumbo nucifera, flower, petal, pink flower, blooming, blossom, flora, floral, glass bowl, water, ripple, clear water, still water, sunrise, sunset, dawn, dusk, mountain, mountain range, scenery, landscape, nature, tranquil, serene, peaceful, calm, meditation, zen, spa, wellness, harmony, balance, spiritual, reflection, blurred background, pink hue, soft light, relaxing, well-being, asian, oriental, asian culture, still life, background, wallpaper",14,2025-03-30
240780_3df154cc-6702-44e3-85df-6247081f1218.jpg,"Elegant and Modern Bathroom Interior with Bathtub, Plants and Stylish Decor, Minimalist Design","Elegant and Modern Bathroom Interior with Bathtub, Plants and Stylish Decor, Minimalist Design","bathroom, interior, modern, minimalist, design, home, decor, room, house, architecture, style, contemporary, luxury, domestic, indoor, tub, bath, water, spa, wellness, relaxation, clean, aqua, clear, fresh, stone, massage, fixture, faucet, hygiene, plant, green, flora, decoration, circle, graphic, wall, sunlight, daylight, window, surface, tile, shadow, backdrop, pattern, render, desktop, art, illustration, background",2,2025-03-30
240783_b306bd24-9d7d-4bb1-a5ff-5364e90a7da8.jpg,"Minimalist Wooden Sculpture on a Table with Green Plant, Modern Art Decor","Minimalist Wooden Sculpture on a Table with Green Plant, Modern Art Decor","wooden, wood, carving, sculpture, art, modern, abstract, decorative, minimalist, design, craft, handmade, artistic, contemporary, creative, unique, geometric, shape, object, ornament, structure, table, indoor, interior, still life, plant, leaf, flora, foliage, botanical, growth, tropical, background, copy space, empty, neutral, simple, clean, studio, shot, minimal, artwork, element, style, decoration, composition, art form, craftsmanship, art object, beautiful",8,2025-03-30
240787_a1237de8-9cd3-4fcd-9390-547cffe55e8d.jpg,"Colorful Abstract Illustration of Space, Planets, Cosmos and Quantum World Background","Colorful Abstract Illustration of Space, Planets, Cosmos and Quantum World Background","abstract, abstract background, space, universe, nebula, star, stars, cosmos, outer space, galactic, galaxy, celestial, astronomy, science, scientific, quantum, physics, particle, atom, molecular, orbit, planetary, planets, sphere, spherical, circle, circular, digital art, artistic, artwork, illustration, design, graphic, graphic design, modern, futuristic, backdrop, decorative, wallpaper, colorful, vibrant, bright, glowing, light, illuminated, fantasy, dreamlike, creative, element",8,2025-03-30
240778_90c03098-85c2-4da6-a44f-9a8bd0ace415.jpg,Abstract organic growth pattern of cells and microorganisms in a microscopic world,Abstract organic growth pattern of cells and microorganisms in a microscopic world,"abstract, organic, growth, organism, cellular, biology, microscopic, microbiology, scientific, medical, biological, scientific, health, healthcare, medicine, blood, cell, vein, artery, vessel, membrane, tissue, structure, anatomy, biotechnology, virus, infection, disease, pathogen, microbe, germ, background, pattern, texture, surface, backdrop, design, element, graphic, illustration, art, render, digital, fantasy, concept, creative, modern, futuristic, wallpaper",8,2025-03-30
240795_4e56a547-17e5-42f1-b1f3-0d5b2957a96b.jpg,"Detailed Eye Anatomy Illustration for Medical and Science Education, Vision and Health","Detailed Eye Anatomy Illustration for Medical and Science Education, Vision and Health","eye, human eye, eye anatomy, vision, ophthalmology, optometry, retina, cornea, lens, iris, pupil, sclera, optic nerve, macula, fovea, aqueous humor, vitreous humor, blood vessels, eye health, eye care, eye disease, eye exam, eye test, eye doctor, eye specialist, medical, anatomy, biology, science, healthcare, medicine, diagnosis, treatment, research, illustration, digital art, 3D rendering, internal, body, structure, organ, detail, close-up, microscopic, cells, anatomy art, medical illustration, health science, visual system",16,2025-03-30
240804_7b3f64cb-23ec-4eca-95a2-823b97fd6097.jpg,Modern Golden Abstract Sculpture on Display: Geometric Metal Art Object,Modern Golden Abstract Sculpture on Display: Geometric Metal Art Object,"abstract, modern, contemporary, design, geometric, sculpture, art, golden, gold, metal, metallic, shiny, structure, shape, form, creative, concept, decorative, element, ornament, object, composition, artistic, decoration, still life, indoor, studio shot, display, exhibit, gallery, museum, white background, minimal, minimalist, clean, elegant, luxury, expensive, rich, wealth, wealthy, style, stylish, geometric shape, circle, curve, swirl, 3D, render, rendering",8,2025-03-30
240799_978ee892-1f51-4689-809a-edbe65995b7a.jpg,Women Practicing Yoga Together in Studio for Wellness and Flexibility,Women Practicing Yoga Together in Studio for Wellness and Flexibility,"yoga, yoga class, yoga studio, fitness, wellness, health, exercise, pose, balance, strength, flexibility, asana, stretch, workout, training, lifestyle, healthy lifestyle, well-being, mindfulness, meditation, sport, active, group, class, indoors, gym, studio, woman, women, female, people, adult, young adult, athletic, body, figure, posture, movement, practice, harmony, serenity, calm, peace, energy, motion, togetherness, community, support, connection",18,2025-03-30
240798_2c8ab81e-95a7-476f-bf8b-23809f91910b.jpg,"Abstract Digital Network: Artificial Intelligence, Data Flow, and Futuristic Technology","Abstract Digital Network: Artificial Intelligence, Data Flow, and Futuristic Technology","abstract, abstract background, digital, digital art, data, data stream, technology, network, connection, neural network, artificial intelligence, ai, machine learning, science, research, development, innovation, futuristic, future, modern, blue, blue background, dark blue, sphere, orb, ball, glowing, glowing lights, orange, red, orange lights, red lights, plexus, nodes, dots, points, lines, wavy, waves, energy, structure, nanotechnology, microscopic, detail, backdrop, illustration, design, element, background, render",19,2025-03-30
240796_397fd71f-3c94-4674-8ba6-a05705731d79.jpg,"Microscopic View of Biological Cells, Scientific Research and Medical Analysis, 3D Rendering","Microscopic View of Biological Cells, Scientific Research and Medical Analysis, 3D Rendering","microscopic, microscopic view, orange, macro, macro view, science, scientific, scientific image, research, medical, medicine, biology, biological, cell, cells, cellular, organism, microorganism, virus, bacteria, molecule, molecular, disease, illness, infection, healthcare, pharmaceutical, pharmacy, laboratory, lab, experiment, analysis, diagnosis, treatment, immunology, virology, bacteriology, biotechnology, genetic, genome, dna, microbiology, study, anatomy, physiology, biochemistry, technology, 3d, rendering, abstract",16,2025-03-30
240801_678876e2-3521-4083-a54a-5c4d39254743.jpg,Enthusiastic dance class of diverse young people enjoying a spirited and energetic dance performance.,Enthusiastic dance class of diverse young people enjoying a spirited and energetic dance performance.,"dance, dancing, dancer, dancers, dance class, dance studio, performance, art, artistic, artwork, artists, studio, spotlight, spotlights, stage, entertainment, group, group of people, group activity, class, lesson, studio shot, indoors, barefoot, movement, motion, training, woman, women, young women, youth, young, female, youthful, teen, teenagers, adolescent, adolescents, people, activity, recreation, lifestyle, leisure, fun, happy, smiling, happiness, joy, cheerful",18,2025-03-30
240807_8353a473-2b64-4fa6-aa94-4179c34096be.jpg,Aroma diffuser with stones for relaxation and aromatherapy at home,Aroma diffuser with stones for relaxation and aromatherapy at home,"aroma, aroma therapy, essential oil, essential, oil, fragrance, scent, diffuser, humidifier, steam, incense, relax, zen, wellness, well-being, home, interior, decoration, decorative, design, still life, spa, treatment, health, healthcare, healthy, lifestyle, meditation, mindfulness, balance, harmony, calm, serenity, peace, peaceful, stone, stones, stack, stacked, massage, therapeutic, therapy, candle, plant, window, curtain, indoor, table, surface, blur",12,2025-03-30
240809_ff8fa0ef-0491-426e-97f6-c4818da4cfa6.jpg,Woman in Tree Pose on Mountain Peak Overlooking Serene Lake at Sunset,Woman in Tree Pose on Mountain Peak Overlooking Serene Lake at Sunset,"yoga, woman, fitness, exercise, health, outdoors, pose, mountain, balance, nature, wellness, sport, tree pose, peace, cliff, lake, strength, active, lifestyle, training, healthy, body, landscape, calm, stretch, sunset, rock, silhouette, harmony, serenity, motivation, determination, contemplation, mindfulness, spirituality, flexibility, concentration, meditation, zen, mountain range, valley, vista, scenic, travel, adventure, recreation, tourist, destination, retreat, escape",18,2025-03-30
240812_1810f7a4-c0bc-4c27-8481-31f999bd6201.jpg,Energetic Abstract Flow: A Vibrant Dance of Light and Color on Dark Backdrop,Energetic Abstract Flow: A Vibrant Dance of Light and Color on Dark Backdrop,"abstract, energy, vibrant, dynamic, flowing, motion, glowing, luminous, radiant, spectral, futuristic, modern, contemporary, artistic, creative, design, illustration, graphic, visual, element, background, wallpaper, pattern, texture, curve, wave, spiral, swirl, gradient, color, spectrum, red, orange, yellow, blue, indigo, violet, light, shine, sparkle, glitter, magic, fantasy, dreamlike, surreal, digital, rendering, computer generated, artwork, style",8,2025-03-30
240808_f96f2bab-167b-4b51-a97c-48e96001c3ca.jpg,"Crashing Waves on Rocky Coastline Under Stormy Sky, Dramatic Seascape","Crashing Waves on Rocky Coastline Under Stormy Sky, Dramatic Seascape","ocean, sea, waves, wave, stormy, storm, coast, coastal, rocky coast, rocky shore, shore, rocks, rock, cliff, cliffs, seascape, landscape, water, spray, splashing, splashes, nature, rough sea, turbulent, sky, cloudy sky, cloud, clouds, sunlight, daylight, weather, dramatic, powerful, strength, beauty, scene, scenery, environment, outdoor, outdoors, travel, vacation, holiday, backdrop, background, natural, nobody, photography, image",11,2025-03-30
240822_e8cac2c7-de45-49ad-90be-487d366547a9.jpg,Glass of refreshing clear water with water droplet for health and wellness concept on dark background,Glass of refreshing clear water with water droplet for health and wellness concept on dark background,"water, clear water, fresh water, sparkling water, glass of water, drink, beverage, hydration, refreshment, liquid, transparent, still life, studio shot, indoor, table, surface, minimal, purity, cleanliness, health, wellness, cold, cool, aqua, droplets, condensation, reflection, dark background, moody, calm, simple, minimalist, plain, aqua, shiny, wet, watery, refreshing, natural, liquid refreshment, clear beverage, cool drink, hydration concept, wellness lifestyle, still life photography, healthy drink, pure water, water glass, clear liquid",7,2025-03-30
240811_54d828c4-5ea4-4b37-a497-96cd5aa25b1e.jpg,"Natural wellness: assortment of oils, fruits, and herbs for holistic health and alternative medicine preparation","Natural wellness: assortment of oils, fruits, and herbs for holistic health and alternative medicine preparation","essential oils, aromatherapy, alternative medicine, holistic health, natural remedies, herbal medicine, wellness, well-being, health, healthy, ingredients, natural ingredients, food ingredients, food, diet, nutrition, fresh, freshness, organic, oranges, citrus, lemons, fruit, vegetables, raspberries, seeds, grains, beans, spices, herbs, plants, botanicals, bottles, droppers, glassware, containers, remedies, medicine, science, composition, arrangement, still life, tabletop, indoors, window, daylight, rustic, wooden, wood, sunlight",7,2025-03-30
240814_bfc862dd-080e-4ab4-9ce6-06767b5d8795.jpg,Woman balancing on board indoors. Healthy lifestyle and wellness in comfortable home environment,Woman balancing on board indoors. Healthy lifestyle and wellness in comfortable home environment,"balance, woman, home, balance board, indoor, fitness, exercise, health, healthy, lifestyle, well being, wellness, sport, training, workout, activity, sportswear, room, female, board, stability, barefoot, active, fit, sporty, peaceful, mindfulness, practice, calm, body, pose, indoors, window, curtains, daylight, light, plants, potted plants, home decor, apartment, yoga mat, floor, wood floor, sunlight, Zen, neutral colors, relaxation, domestic life, harmony",12,2025-03-30
240823_47ef53f5-1563-4852-8864-b894dd07b986.jpg,"Spiderweb with Dew Drops in Morning Light, Detailed Close-up in Natural Green Setting","Spiderweb with Dew Drops in Morning Light, Detailed Close-up in Natural Green Setting","spiderweb, spider web, cobweb, dew drops, water droplets, water, dew, morning dew, nature, natural, leaf, leaves, foliage, greenery, vegetation, plant, flora, macro, closeup, intricate, pattern, design, woven, web, silk, threads, sticky, trap, insect, spider, arachnid, wildlife, outdoors, sunlight, sun, sunrise, morning, fresh, clean, environment, ecology, spring, summer, fragile, delicate, beauty, beautiful, background, backdrop, wallpaper, texture",1,2025-03-30
240827_e6eae797-6bd3-4dad-a0f8-c002285a1fa4.jpg,Ascending climber on a steep rock face with mountain views. A challenging outdoor adventure.,Ascending climber on a steep rock face with mountain views. A challenging outdoor adventure.,"rock climbing, climbing, climber, mountain climbing, mountain climber, free climbing, outdoor climbing, adventure, adventure activity, challenging, extreme sport, sport, sports, rock, rocky, cliff, mountain, mountains, mountainous, mountain range, outdoor, outdoors, outdoor pursuits, backpack, hike, hiking, trekking, landscape, scenery, scenic, view, vista, valley, nature, environment, protection, skill, strength, determination, challenge, success, achievement, triumph, winning, red helmet, safety helmet, safety, daytime, sunny, blue sky",18,2025-03-30
240835_f9fd27a1-f0cf-4baf-b9af-3ca22062653e.jpg,Ornate Metallic Gears Balancing on Scales. Antique Brass Balancing with Decorative Gears,Ornate Metallic Gears Balancing on Scales. Antique Brass Balancing with Decorative Gears,"gear, gears, cogwheel, cogwheels, machine, machinery, mechanism, mechanical, balance, balancing, scale, scales, equilibrium, instrument, vintage, retro, antique, old, gold, golden, brass, metal, metallic, shiny, polished, precision, engineering, industrial, technology, device, equipment, classic, ornate, detailed, complicated, complex, design, art, structure, still life, decoration, object, artwork, studio shot, illustration, render, 3d, background, backdrop",8,2025-03-30
240832_ed257745-e064-4097-bb7f-4dcd2ef9a0ff.jpg,"Healthy berry smoothie bowl with strawberries, blueberries, mango, and granola for nutritious breakfast.","Healthy berry smoothie bowl with strawberries, blueberries, mango, and granola for nutritious breakfast.","smoothie bowl, fruit bowl, berry bowl, healthy bowl, delicious bowl, berry smoothie, fruit smoothie, healthy smoothie, breakfast, morning, refreshment, strawberries, blueberries, mango, granola, lemon, mint, juice, spoon, almonds, bowl, wooden bowl, kitchen, table, wood table, fruit, berries, citrus fruit, fresh, homemade, organic, vegan, vegetarian, nutritious, antioxidant, vitamins, wellness, diet, nutrition, food, food photography, still life, indoor, window, natural light, plant, leaves, close up, bright",7,2025-03-30
240836_cbb8c189-c552-4d67-948e-868c833fff4f.jpg,Macro Shot of Water Droplets Splashing on a Calm Surface with Reflections on Dark Backdrop,Macro Shot of Water Droplets Splashing on a Calm Surface with Reflections on Dark Backdrop,"water, liquid, fluid, splash, water splash, liquid splash, fluid splash, drop, water drop, liquid drop, fluid drop, water surface, liquid surface, fluid surface, abstract, abstract water, abstract liquid, abstract fluid, macro, macro water, macro liquid, macro fluid, close-up, reflection, clear, transparent, purity, freshness, motion, dynamic, wave, ripple, clean, refreshing, surface tension, dark background, black background, still life, artwork, design element, graphic resource, nature, science, experiment, texture, pattern, backdrop, background, detail, artistic",8,2025-03-30
240842_c332372c-5b86-4295-9800-d2e87bc37e94.jpg,"Muscular man is working out in the gym on fitness equipment, demonstrating strength, focus, and athletic physique","Muscular man is working out in the gym on fitness equipment, demonstrating strength, focus, and athletic physique","man, male, fitness, exercise, gym, workout, bodybuilding, strength, training, athlete, sports, muscle, muscular, body, athletic, strong, lifestyle, health, healthy, wellness, determination, motivation, effort, machine, equipment, gym equipment, fitness machine, exercise equipment, physical, activity, indoor, indoors, serious, weight, weights, lifting, weightlifting, concentrate, concentration, focus, black shorts, gym interior, modern gym, power, well-being, body care, sport, sporty, active, toned",18,2025-03-30
240856_9de6eb21-3157-4b51-b2ce-2d87c392b5bf.jpg,Morning Tea on Wooden Table Overlooking Lake and Mountains Peaceful and Tranquil Landscape,Morning Tea on Wooden Table Overlooking Lake and Mountains Peaceful and Tranquil Landscape,"cup, tea, coffee, drink, beverage, refreshment, hot drink, table, wooden table, wood, plank, surface, background, lake, mountains, landscape, nature, scenery, outdoor, view, reflection, water, tranquil, serene, peaceful, relaxing, relaxation, calm, morning, sunrise, daylight, sunlight, deck chair, furniture, tree, vegetation, shore, scene, summer, vacation, travel, tourism, getaway, holiday, leisure, rest, well-being, plate, cup on table, close-up",7,2025-03-30
240854_d437d93f-06aa-4d57-b0b5-997ca6dfe9ca.jpg,Assortment of Herbal Supplements and Natural Medicine Ingredients in Bottles on Display,Assortment of Herbal Supplements and Natural Medicine Ingredients in Bottles on Display,"herbal medicine, herbal remedies, herbs, botanical medicine, alternative medicine, natural medicine, holistic medicine, wellness, well-being, health, healthy, healthcare, pharmaceutical, pharmacy, pills, capsules, vitamins, supplements, nutrition, nutritional supplements, dietary supplements, ingredients, natural ingredients, organic, botanical, plant-based, vegan, vegetarian, apothecary, brown glass bottles, glassware, cork lids, display, shelf, wooden shelf, rustic, still life, studio shot, indoor, tabletop, macro, close-up, brown, green, orange, leaves, foliage, plant, homeopathy, naturopathy",7,2025-03-30
240858_4386b0bc-fcb3-4795-92c3-e04941d6f763.jpg,Bird and Stones in Equilibrium: A Minimalist Composition of Harmony and Zen,Bird and Stones in Equilibrium: A Minimalist Composition of Harmony and Zen,"balance, stability, equilibrium, harmony, counterbalance, poise, symmetry, zen, meditation, mindfulness, still life, minimalism, simplicity, tranquility, serenity, calmness, peacefulness, repose, relaxation, contemplation, spiritual, well-being, wellness, stone, stones, rock, rocks, pebble, pebbles, nature, natural, object, objects, still, flat lay, studio shot, bird, birds, avian, wooden bird, wood, art, artistic, craft, crafts, handmade, desktop, indoors, neutral background, grey background",8,2025-03-30
240859_14e8aba1-34bd-4244-9ea7-0c0155286630.jpg,Elegant Alcoholic Beverage Splash in a Glass with Dynamic Movement and Rich Color,Elegant Alcoholic Beverage Splash in a Glass with Dynamic Movement and Rich Color,"alcohol, alcoholic beverage, drink, beverage, wine, glass, liquid, fluid, splash, splashing, motion, dynamic, movement, abstract, dark, black, gold, golden, amber, brown, still life, studio shot, close-up, macro, detail, art, artistic, creative, design, stylish, elegance, elegant, luxury, luxurious, sophisticated, stylish, minimal, minimalist, background, backdrop, texture, grainy, blur, blurred, transparent, empty, copy space, single object, indoor, horizontal",4,2025-03-30
240861_88498eca-9122-44fc-8d90-85e71feefd8f.jpg,Butterfly on Stack of Old Books in a Library Setting - A Still Life Composition,Butterfly on Stack of Old Books in a Library Setting - A Still Life Composition,"butterfly, butterfly wings, yellow butterfly, insect, animal, lepidoptera, entomology, books, stack of books, book pages, book spines, library, literature, knowledge, reading, studying, learning, education, academic, old books, vintage books, antique books, paper, pages, stories, novel, textbook, hardcover, book cover, classic, study, desktop, table, surface, wood, wooden, indoors, home, school, college, university, classroom, still life, interior, design, art, artistic, decorative, closeup, background",1,2025-03-30
240864_60fbfd10-5173-426e-8372-a2b47f2647e7.jpg,Fit woman hydrating with a green drink after workout at the gym.,Fit woman hydrating with a green drink after workout at the gym.,"fitness, workout, exercise, gym, wellness, sport, health, lifestyle, healthy, woman, female, girl, young woman, adult, hydration, drink, beverage, liquid, green drink, sports drink, supplement, vitamin drink, electrolyte drink, nutrition, bottle, water bottle, gym bottle, sweat, sweaty, body, figure, face, beautiful, attractive, athletic, active, indoor, gym interior, fitness center, weights, training, strength, strong, window, natural light, sunlight, daylight, ponytail, watch, arm",18,2025-03-30
240865_6cd8d937-d771-4c04-8967-7a4bbe84327a.jpg,"Intense Bodybuilder Lifting Weights in Gym for Strength, Fitness, and Healthy Athletic Lifestyle","Intense Bodybuilder Lifting Weights in Gym for Strength, Fitness, and Healthy Athletic Lifestyle","bodybuilding, bodybuilder, weightlifting, weightlifter, gym, gyms, fitness center, fitness, exercise, exercising, workout, workouts, strength, strength training, strong, muscle, muscles, muscular, man, men, male, determination, determined, effort, intense, intensity, wellness, well being, healthy, health, lifestyle, athlete, athletic, sport, sports, black tank top, tank top, weight, weights, weight training, indoors, indoor, gym equipment, equipment, cross training, human, people, adult, face",18,2025-03-30
240868_7311d9cc-79e2-42e3-a101-c6cd1dadf31e.jpg,"Vibrant Orange Juice with Splash and Citrus Slice: Fresh, Healthy, and Refreshing Drink","Vibrant Orange Juice with Splash and Citrus Slice: Fresh, Healthy, and Refreshing Drink","orange juice, citrus drink, fresh juice, healthy beverage, vitamin c, fruit drink, glass of juice, refreshment, orange flavor, tropical juice, juice splash, liquid burst, drink explosion, fruit pulp, juicy, fruit segment, citrus fruit, orange slice, half orange, fresh fruit, citrus, orange color, bright color, vibrant, studio shot, still life, minimal, paper straw, striped straw, yellow straw, drink straw, clear glass, glassware, liquid, beverage, drink, close up, macro, food photography, product photography, artistic, aesthetic, splash, motion, dynamic, nutrition, wellness, health, freshness, sweet",7,2025-03-30
240860_bf715fca-8b82-4d28-bba7-9d998df12132.jpg,"Romantic hands forming heart at Horseshoe Bend with canyon backdrop; love, travel, and scenic vista","Romantic hands forming heart at Horseshoe Bend with canyon backdrop; love, travel, and scenic vista","horseshoe bend, canyon, river, landscape, nature, travel, hands, heart shape, finger heart, love, romantic, marriage, engagement, wedding ring, couple, vacation, destination, viewpoint, scenic, red rocks, arizona, southwest, outdoors, geology, erosion, formation, cliff, gorge, grand canyon, colorado river, adventure, exploration, tourism, sightseeing, beautiful, natural wonder, landmark, destination, sunset, golden hour, sky, horizon, vista, panoramic, open space, geological, rocky, western, holiday",21,2025-03-30
