Filename,Title,Description,Keywords,Category,Release(s)
237991_97bb4ca9-ffc1-4bf2-b41a-bb26e5aa6c3f.jpg,"Abstract smoke art background with flowing gradients, smooth waves and colorful fluid ink design elements","Abstract smoke art background with flowing gradients, smooth waves and colorful fluid ink design elements","abstract, abstract art, smoke, flowing, smooth, curves, wave, color, colorful, gradient, fluid, ink, alcohol ink, paint, art, design, artistic, background, backdrop, wallpaper, texture, illustration, modern, creative, graphic, element, image, digital, style, artwork, effect, decorative, soft, light, bright, clean, elegant, simple, minimal, calm, dreamy, gentle, pastel, purple, green, red, pink, white, backdrop",8,2025-03-29
237997_6c07cd6a-3e36-4eb6-9635-ca4d12efd3e4.jpg,Woman enjoys the sunset over the misty mountain peaks and landscape.,Woman enjoys the sunset over the misty mountain peaks and landscape.,"woman, sunset, landscape, scenery, mountain, golden hour, outdoor, view, serene, nature, sun, sky, horizon, adventure, travel, tourism, vista, peak, hill, ridge, summits, overlook, panorama, dusk, evening, twilight, backlit, silhouette, dreamy, relaxing, peaceful, quiet, contemplative, spiritual, tranquil, wellness, well being, serenity, solitude, getaway, vacation, journey, destination, sunlight, back, grass, hilltop, warm",11,2025-03-29
238004_3f0e1f84-6548-49bd-b94d-ab75f3886c70.jpg,Water Drop on Green Lotus Leaf with Refraction Effect,Water Drop on Green Lotus Leaf with Refraction Effect,"lotus leaf, water drop, water droplet, leaf, green, nature, plant, flora, botany, foliage, environment, natural, closeup, macro, detail, fresh, growth, vein, stem, dew, rain, liquid, surface tension, purity, clear, transparent, glossy, clean, serene, peaceful, zen, meditation, harmony, balance, tranquility, stillness, reflection, refraction, blur, soft, artistic, aesthetic, minimalist, simple, organic, well-being, wellness, symbol, asia, asian",14,2025-03-29
238002_fa580a35-8ac5-4816-91f3-4ebfeb618963.jpg,Automated industrial robotic arm welding molten metal in manufacturing plant.,Automated industrial robotic arm welding molten metal in manufacturing plant.,"industrial, industry, manufacturing, metalworking, steel, iron, factory, plant, robot, robotic, automation, machine, machinery, welding, welder, molten, heat, hot, spark, sparks, fire, casting, steelmaking, forge, ironwork, production, process, engineering, technology, equipment, tool, automatic, automated, precise, precision, powerful, power, yellow, detail, closeup, indoors, contemporary, intricate, closeup, manufacturing plant, industrial sector, steel industry, metal industry",10,2025-03-29
238000_cd4de89f-f90b-46cf-9889-43a6d2f45c72.jpg,"Futuristic Circuit Board with Gears and Cityscape Background at Sunset, Engineering, Technology","Futuristic Circuit Board with Gears and Cityscape Background at Sunset, Engineering, Technology","circuit board, printed circuit board, pcb, electronics, technology, engineering, futuristic, modern, digital, data, processing, integrated circuit, microchip, computer, system, network, connectivity, automation, artificial intelligence, ai, machine learning, cogwheel, gear, mechanism, components, parts, interconnected, glowing, orange, blue, abstract, background, cityscape, city, sunset, urban, skyline, blur, depth of field, macro, close-up, detail, innovation, high tech, science, communication, electrical, equipment, metallic",19,2025-03-29
237995_f91489a2-9480-45c0-ac32-b72e66000a67.jpg,Fresh Vegetables and Fruits on Kitchen Counter for Healthy Eating and Nutrition,Fresh Vegetables and Fruits on Kitchen Counter for Healthy Eating and Nutrition,"vegetables, fresh vegetables, raw vegetables, produce, fresh produce, raw produce, fruits, fresh fruits, raw fruits, healthy, healthy eating, kitchen, kitchen scene, kitchen interior, countertop, kitchen countertop, food, food photography, still life, still life photography, window light, natural light, broccoli, bell peppers, tomatoes, lettuce, onions, citrus fruits, apples, culinary, food preparation, cooking, ingredients, colorful, abundance, nutrition, diet, wellness, vegetarian, vegan, organic, farm fresh, wholesome, table, tabletop, home, indoors, daylight, health",7,2025-03-29
238007_c31ca2dd-d91b-4f92-9dbc-0b4a4b8219d2.jpg,"Interlocking metal chain with water droplets and splash. Abstract, clean liquid element on gray backdrop","Interlocking metal chain with water droplets and splash. Abstract, clean liquid element on gray backdrop","chain, chains, linked, interlocked, connection, linking, strong, strength, secure, security, metal, metallic, steel, iron, aqua, water, liquid, fluid, drops, droplets, splash, splashing, clean, cleaning, fresh, purity, transparent, abstract, concept, conceptual, design, element, graphic, illustration, modern, shiny, surface, texture, wallpaper, background, network, networking, technology, engineering, industrial, macro, closeup, detail, isolated, backdrop",8,2025-03-29
238019_26df00db-0f77-48f5-b970-4e692c6f2568.jpg,Woman Meditating in Lotus Position on a Mountain Top with Scenic Landscape View,Woman Meditating in Lotus Position on a Mountain Top with Scenic Landscape View,"woman, female, yoga, meditation, meditating, pose, lotus position, mountain, mountains, mountain range, nature, landscape, scenery, outdoor, outdoors, rock, cliff, peak, zen, spiritual, spirituality, wellness, well being, mindfulness, health, healthy, lifestyle, serene, tranquil, calm, peaceful, relaxation, harmony, connection, balance, inner peace, self-care, journey, escape, retreat, adventure, exploration, travel, destination, view, vista, scenic, back view, forest, trees",12,2025-03-29
238029_adaffe54-80b2-4908-9224-89ee9fea0336.jpg,Elegant Gold and Silver Ribbon Swirls on Black Backdrop for Festive Celebrations and Ornamental Decoration,Elegant Gold and Silver Ribbon Swirls on Black Backdrop for Festive Celebrations and Ornamental Decoration,"ribbon, gold ribbon, golden ribbon, silk ribbon, fabric ribbon, decorative ribbon, shiny ribbon, festive ribbon, celebration, festivity, celebratory, ornamental, decoration, decorative, black background, backdrop, neutral background, elegant, elegance, graceful, luxury, luxurious, smooth, glossy, shine, shimmer, flowing, undulating, curve, curves, stylish, style, design element, graphic element, swirl, spiral, motion, movement, modern, contemporary, artistic, abstract, neutral color, metallic, metallic gold, glitter, glamour, bright, illuminated, light, copy space",8,2025-03-29
238026_c912c1fb-3a7c-4a58-ac33-9a125d5168a3.jpg,Luxurious Minimalist Indoor Pool with Natural Light and Plants,Luxurious Minimalist Indoor Pool with Natural Light and Plants,"indoor swimming pool, indoor pool, swimming pool, pool, water, interior, interiors, indoor, minimalist, minimalism, minimal, zen, calm, peaceful, serene, relaxation, wellness, well being, wellbeing, health, healthy, spa, hotel, resort, vacation, holiday, leisure, plants, plant, houseplants, indoor plants, foliage, greenery, flora, home decor, decoration, decor, design, interior design, architecture, building, structure, sunlight, daylight, light, shadows, natural light, contemporary, modern, clean",12,2025-03-29
238020_89bd4458-b764-4319-a428-a65f601320f2.jpg,Futuristic Technology Network with Glowing Data Servers and AI Connection for High Tech Solutions,Futuristic Technology Network with Glowing Data Servers and AI Connection for High Tech Solutions,"technology, tech, cyber, cyberspace, digital, data, information, network, networking, connection, connections, artificial intelligence, AI, machine learning, neural network, computing, computer, server, servers, mainframe, processors, microchip, circuit, circuitry, motherboard, electronic, electronics, futuristic, future, abstract, innovation, innovative, modern, system, blue, red, glowing, glow, lines, geometric, design, illustration, render, graphic, background, backdrop, high tech, cloud computing, crypto, cryptocurrency",19,2025-03-29
238027_919bfa0d-2dec-4fd2-833a-e3e835322276.jpg,"Close-up of water droplets on a vibrant green leaf, showcasing nature's beauty, freshness, and delicate details.","Close-up of water droplets on a vibrant green leaf, showcasing nature's beauty, freshness, and delicate details.","water drops, water droplets, dew drops, dew, leaf, green leaf, plant leaf, fresh, macro, closeup, nature, environment, botany, botanical, flora, foliage, garden, spring, summer, growth, vibrant, clean, clear, transparent, purity, refreshing, natural, organic, detail, texture, pattern, veins, surface, background, backdrop, element, design, graphic, artistic, art, image, still life, outdoors, daylight, blur, soft, calm, peaceful, serene, zen",14,2025-03-29
238022_ad35a7b2-c7af-45b9-a52f-12ba951d1925.jpg,Digital network with glowing nodes depicting data connection and distributed system,Digital network with glowing nodes depicting data connection and distributed system,"network, networking, internet, nodes, connection, connections, data, digital, technology, system, distributed, computing, futuristic, abstract, artificial intelligence, ai, neural network, neural, cybersecurity, cyber, security, circuit, pattern, design, communication, grid, structure, linked, links, mainframe, transfer, transferring, telecommunications, telecom, transmission, global, worldwide, worldwide web, www, complex, web, illustration, background, science, engineering, innovation, innovative, modern, electric, blue, neon",19,2025-03-29
238030_b0bf9fde-0610-411f-ae39-18dc343eb714.jpg,Tender Hands Planting New Sprout Seedling in Fertile Soil,Tender Hands Planting New Sprout Seedling in Fertile Soil,"planting, plant, sprout, seedling, hands, hand, soil, earth, ground, dirt, gardening, garden, growth, growing, new life, life, beginning, beginnings, agriculture, cultivation, organic, ecological, sustainability, sustainable, environment, environmental, eco-friendly, green, nature, natural, close-up, macro, outdoors, daylight, sunlight, bokeh, blur, flora, foliage, leaf, leaves, small, young, tender, care, tending, nurturing, horticulture, fresh, spring",5,2025-03-29
238033_3efa254f-c5f5-47e0-974b-dbd71fa78ea4.jpg,Glowing moon reflecting in lake waters at twilight night with mountain backdrop and twinkling stars,Glowing moon reflecting in lake waters at twilight night with mountain backdrop and twinkling stars,"moon, full moon, lunar, moonlight, celestial, night, nighttime, night sky, sky, star, stars, lake, water, reflection, ripple, ripples, landscape, mountain, mountains, scenery, scene, dark, blue, evening, tranquil, serene, calm, peaceful, quiet, nature, outdoors, beautiful, scenic, twilight, midnight, night scene, astronomy, space, outer space, universe, nebula, cosmic, galaxy, planet, sphere, orb, horizon, vista, panoramic",11,2025-03-29
238047_d6b158ae-85db-415d-8aa0-12dfa798ac4d.jpg,Woman in pink jumpsuit doing yoga tree pose in sunlit room for wellness and fitness,Woman in pink jumpsuit doing yoga tree pose in sunlit room for wellness and fitness,"yoga, yoga pose, yogi, woman, exercise, fitness, wellness, health, healthy, lifestyle, home, indoors, interior, room, practice, balance, pose, asana, one-legged, tree pose, vrksasana, meditation, meditative, mindful, mindfulness, serene, tranquil, calm, peaceful, relaxation, relax, zen, spiritual, spirituality, well-being, body, mind, soul, connection, energy, flow, strength, flexible, flexibility, stretch, stretching, movement, moving, barefoot, light",18,2025-03-29
238036_8a60c38c-0ea3-4c1f-b363-ea960da036fe.jpg,Abstract Background with Glowing Flowing Wavy Lines in Blue and Pink Gradient,Abstract Background with Glowing Flowing Wavy Lines in Blue and Pink Gradient,"abstract, wavy, waves, flowing, flow, lines, glowing, glow, glisten, glitter, sparkle, shimmer, iridescent, colorful, gradient, smooth, curve, art, design, graphic, background, wallpaper, backdrop, illustration, element, decorative, modern, futuristic, elegant, style, texture, pattern, light, bright, vibrant, dreamy, soft, blurry, blue, pink, purple, indigo, violet, magenta, space, energy, motion, digital, rendering",8,2025-03-29
238038_f7a2dd36-a95a-4db1-81f9-54fd9564c292.jpg,Balanced Stones in Zen Garden with Bamboo: Serenity and Mindfulness,Balanced Stones in Zen Garden with Bamboo: Serenity and Mindfulness,"zen garden, zen, meditation, relaxation, mindfulness, peace, harmony, balance, well-being, spiritual, spirituality, inner peace, contemplation, serenity, calm, tranquility, repose, stillness, meditative, wellness, therapeutic, healing, stone stacking, stones, pebbles, rocks, stacked stones, stacked pebbles, sand, sand garden, garden, bamboo, bamboo forest, asian, east asian, japanese, zen buddhism, buddhism, culture, tradition, nature, natural, outdoor, symbol, abstract, background, copy space, design element, backdrop, texture",15,2025-03-29
238035_41da11bf-b027-4c30-94d3-36e8ac3b6f21.jpg,Energetic Man Running Through Cityscape at Sunset,Energetic Man Running Through Cityscape at Sunset,"runner, running, jogging, jogger, exercise, athlete, athletic, fitness, urban, cityscape, city, metropolis, skyline, buildings, street, road, sunset, sunrise, dawn, dusk, morning, evening, clouds, sky, horizon, speed, motion, movement, energy, health, wellness, healthy, lifestyle, sport, race, marathon, cardio, outdoor, outdoors, training, workout, person, man, male, torso, red shirt, shorts, activewear, roadway, artwork",18,2025-03-29
238050_cb7680fb-32f0-49ab-8f40-2eaa24f9ac7c.jpg,A vibrant assortment of fruits is displayed with a refreshing green smoothie for a healthy breakfast.,A vibrant assortment of fruits is displayed with a refreshing green smoothie for a healthy breakfast.,"fruit, fruits, fresh fruit, healthy fruit, variety of fruits, fruit platter, fruit plate, mixed fruit, assorted fruits, berries, blueberries, raspberries, oranges, tangerines, kiwi fruit, mango, apple, smoothie, green smoothie, healthy smoothie, fruit smoothie, breakfast, healthy breakfast, healthy eating, eating, food, healthy food, table, wooden table, arrangement, food arrangement, delicious, sweet, juicy, refreshing, vitamin, nutrition, nutritious, still life, vegetarian, vegan, raw, colorful, vibrant, close-up, macro, studio shot, daylight, indoor, basket",7,2025-03-29
238051_c01d4de7-477a-488c-aca3-2fed7c3791e6.jpg,Tender Sprouts Emerging from Soil Under Sunlight,Tender Sprouts Emerging from Soil Under Sunlight,"seedling, seedlings, sprout, sprouts, young plant, young plants, plant, plants, new life, growth, growing, grow, progress, development, beginning, start, earth, soil, dirt, ground, organic, agriculture, horticulture, cultivation, botany, flora, foliage, green, vibrant, fresh, nature, natural, environment, eco, ecological, sustainability, sustainable, life cycle, new beginnings, spring, closeup, macro, detail, small, tiny, fragile, hope, future, renewal, revival",14,2025-03-29
238053_fb9da5d9-d7d8-4503-9ef4-4d06d7f3a746.jpg,"Abstract network connections background with glowing nodes in a futuristic style, representing digital technology","Abstract network connections background with glowing nodes in a futuristic style, representing digital technology","neural network, network, connections, nodes, data, internet, communication, artificial intelligence, ai, technology, abstract, digital, glowing, futuristic, modern, background, design, science, innovation, cyber, space, render, illustration, concept, backdrop, bright, web, security, connection, cloud, computing, binary, code, graphic, element, glow, structure, system, wave, dot, matrix, pattern, virtual, cyberspace, fiber, optic, cable, transmit, transmit data, futurism",19,2025-03-29
238056_10d86c16-4f6e-4ccd-b9d3-7b259a09c13b.jpg,"Golden Wheat Field Under a Cloudy Sky, Awaiting Harvest in the Countryside","Golden Wheat Field Under a Cloudy Sky, Awaiting Harvest in the Countryside","wheat, wheat field, golden wheat, ripe wheat, harvest, grain, crop, agriculture, farming, field, rural, countryside, farm, land, outdoors, nature, sky, clouds, storm clouds, horizon, landscape, plant, cereal, food, staple food, ingredient, raw material, ingredient, healthy, natural, golden, yellow, brown, close-up, macro, detail, texture, pattern, background, backdrop, surface, abstract, environment, season, summer, autumn, seasonal, growth, cultivation, nourishment",11,2025-03-29
238054_40779de8-c196-4cc4-9a43-635c674cc04b.jpg,Scenic River Waterfall Flowing Through Forest in Mountain Landscape with Birds Flying,Scenic River Waterfall Flowing Through Forest in Mountain Landscape with Birds Flying,"river, flowing river, waterfall, cascades, rapids, river rapids, rocks, boulders, river stones, forest, woods, trees, lush forest, sunlight, sunbeams, landscape, mountain landscape, nature, nature scenery, idyllic, serene, tranquil, peaceful, misty, atmospheric, fresh water, clean water, clear water, scenic, picturesque, stream, creek, watercourse, terrain, geography, environment, ecology, daytime, outdoor, travel, adventure, exploration, birds, avian, wildlife, vegetation, foliage, greenery, mountain, valley",11,2025-03-29
238067_148c8116-5a10-4ea0-84ea-aca42994581f.jpg,Futuristic Cybersecurity Concept: Data Encryption and Network Security with Glowing Lock and Circuit Board,Futuristic Cybersecurity Concept: Data Encryption and Network Security with Glowing Lock and Circuit Board,"cybersecurity, cyber security, information security, data security, network security, security, data protection, digital security, internet security, cybercrime, cyber crime, cyber attack, attack, threat, vulnerability, encryption, cryptography, firewall, antivirus, malware, software, system, technology, digital, binary code, binary, code, data, information, lock, padlock, safe, cube, futuristic, abstract, circuit board, circuit, board, network, connection, internet, web, online, communication, innovation, artificial intelligence, ai, computing, modern",19,2025-03-29
238071_86b1a23a-f8ef-4251-af7a-28ab6648613c.jpg,Abstract Dark Blue Wavy Texture Background with Dots and Particles,Abstract Dark Blue Wavy Texture Background with Dots and Particles,"abstract, abstract background, texture, textured, surface, pattern, design, graphic, modern, contemporary, art, artistic, illustration, decorative, wallpaper, backdrop, digital, rendering, generated, 3d, dark, deep, monochrome, blue, navy blue, gradient, wave, wavy, undulating, smooth, fluid, organic, shape, form, structure, network, connection, dots, points, particles, sparkles, glitter, glowing, light, shiny, elegant, futuristic, science, technology, background",8,2025-03-29
238185_61ffbe14-4b5a-4ac6-83a0-b6e8a362abd0.jpg,"Close-up Illustration of Cells, Neurons, Nerves: Biology, Science, and Medical Research","Close-up Illustration of Cells, Neurons, Nerves: Biology, Science, and Medical Research","cell, cells, neuron, neurons, nerve, nerves, biology, biological, anatomy, medical, medicine, science, scientific, scientific research, research, laboratory, microscopic, microscope, membrane, illness, disease, organism, virus, infection, pathogen, bacterium, microbe, healthcare, pharmaceutical, pharmacy, treatment, cure, diagnosis, microbiology, biotechnology, molecular, biochemistry, cytology, genes, DNA, genetics, immunology, vaccine, vaccination, antibody, antigen, immunity, illustration, digital art, 3d",16,2025-03-29
238183_bc5ecd9a-73c0-4b60-bf52-4402ef6359ab.jpg,"Microscopic View of Cells, Vessels, and Molecules, highlighting cellular biology and medical research","Microscopic View of Cells, Vessels, and Molecules, highlighting cellular biology and medical research","cell, cells, cellular, microscopic, biology, biological, science, scientific, medicine, medical, research, laboratory, anatomy, physiology, tissue, microbiology, biotechnology, molecular, diagnosis, healthcare, organism, pathology, cytology, biochemistry, virus, infection, immune system, blood, vessel, circulation, vein, artery, capillary, genome, genetic, dna, gene, molecule, membrane, nucleus, chromosome, replication, structure, protein, enzyme, hormone, artificial intelligence, AI, neural network",16,2025-03-29
238186_b022f13d-6e49-4702-b8ad-bcc8f844008d.jpg,"Detailed microscopic view of a virus cell, medical illustration of infectious disease agent.","Detailed microscopic view of a virus cell, medical illustration of infectious disease agent.","virus, microscopic, pathogen, microbe, microorganism, germ, disease, infection, contagion, illness, sickness, medical, biological, virology, immunology, epidemic, pandemic, health, healthcare, research, science, scientific, laboratory, cell, molecule, structure, membrane, spike, protein, genome, genetic, rna, dna, replication, mutation, immunity, vaccine, treatment, cure, diagnosis, prevention, outbreak, crisis, public health, global health, microscopy, magnification, illustration, 3d rendering, digital art",16,2025-03-29
238184_c84c5d9d-35ad-48e7-9cf4-365e98ed2da7.jpg,Detailed Microscopic Cellular Structures in Orange Hues for Scientific and Medical Use,Detailed Microscopic Cellular Structures in Orange Hues for Scientific and Medical Use,"microscopic, microscopic view, cell, cells, biological cell, science, scientific, scientific image, medical, medicine, research, biology, biotechnology, anatomy, molecular, virus, viruses, bacteria, bacterium, microbiology, disease, infection, pathogen, immune system, cellular, membrane, nucleus, organism, genes, dna, rna, genetic, mutation, cloning, genome, chromosome, laboratory, experiment, analysis, diagnosis, treatment, healthcare, pharmaceutical, vaccine, immunity, virus, cure, microorganism, orange, background",16,2025-03-29
238187_bd44876a-8e80-425a-9216-00df20c1cdd5.jpg,Close-up Illustration of Glowing Cells and Molecules for Scientific or Medical Research,Close-up Illustration of Glowing Cells and Molecules for Scientific or Medical Research,"cell, cells, biological cell, living cell, molecule, molecules, biomolecule, biomolecules, microscopic, microscopy, science, scientific, medical, medicine, research, scientific research, biomedical, biology, biologic, cellular, viral, virus, disease, illness, infection, pathogen, microbe, bacteria, bacterium, organism, microorganism, body, anatomy, structure, abstract, sphere, spherical, geometric, shape, round, illustration, digital art, generated image, futuristic, glowing, light, particles, background, backdrop",16,2025-03-29
238188_7b0b3a6c-5765-45cf-a3e5-b082df640f82.jpg,Detailed Close-up of a Microscopic Virus with Intricate Cellular Structures. Digital Art.,Detailed Close-up of a Microscopic Virus with Intricate Cellular Structures. Digital Art.,"virus, viral, infection, contagion, microbe, microorganism, pathogen, disease, illness, sickness, medical, medicine, health, healthcare, virology, bacteriology, microbiology, epidemic, pandemic, outbreak, immunity, immune system, vaccine, vaccination, research, science, scientific, laboratory, microscopic, cell, cellular, biology, biological, genetic, mutation, coronavirus, influenza, hiv, aids, ebola, zika, dengue, fever, flu, cold, ill, sick, treatment",16,2025-03-29
238190_8d2fa011-3e69-473c-ad9d-81cd18d5a57b.jpg,"Molecular Strand Close-up: Scientific Visualization of DNA, Biotechnology, and Medical Research","Molecular Strand Close-up: Scientific Visualization of DNA, Biotechnology, and Medical Research","molecular structure, dna, genetic code, molecule, science, biology, biotechnology, research, scientific, medical, pharmaceutical, helix, strand, chromosome, gene, genetic, microscopic, cell, cellular, molecular, abstract, futuristic, innovation, medicine, healthcare, laboratory, biochemistry, genome, diagnosis, therapy, pharmacy, illness, virus, infection, disease, microbiology, anatomy, physiology, healthcare, wellness, treatment, diagnosis, prevention, pharmaceuticals, medication, drugs, cure, vaccine, scientific research",16,2025-03-29
238194_3b667716-810b-4afb-abd5-233d74422292.jpg,Golden Turmeric Milk Latte with Cinnamon on Kitchen Counter in Sunlight. Healthy Drink. ,Golden Turmeric Milk Latte with Cinnamon on Kitchen Counter in Sunlight. Healthy Drink. ,"golden milk, turmeric latte, turmeric milk, cinnamon, spice, dairy-free, vegan, beverage, drink, homemade, healthy, wellness, organic, natural, glass, kitchen, counter, window, sunlight, still life, indoor, table, food, milk, latte, turmeric powder, cinnamon sticks, plant-based, golden, yellow, warm, comfort food, aromatic, spiced, blend, recipe, ingredient, antioxidant, anti-inflammatory, Ayurvedic, traditional, culture, cuisine, morning, breakfast, afternoon, relax, cozy, refreshment, flavor",7,2025-03-29
238189_f69bef6e-9926-45f1-aef1-2755c4e9be7c.jpg,"Detailed 3D Rendering of a DNA Double Helix Structure, Representing Genetic Science and Biomedical Research","Detailed 3D Rendering of a DNA Double Helix Structure, Representing Genetic Science and Biomedical Research","dna, gene, genetic, genome, chromosome, heredity, double helix, molecule, cellular, microscopic, biology, biotechnology, biomedical, science, scientific, research, medical, healthcare, pharmaceutical, medicine, diagnosis, treatment, therapy, innovation, technology, nanotechnology, engineering, structure, strand, spiral, helix, orange, glowing, shiny, bright, macro, close-up, abstract, futuristic, conceptual, illustration, visualization, detailed, complex, pattern, dark, blue, backdrop, background",16,2025-03-29
